{"run":10,"commit":"4d79592","metric":0,"metrics":{"build_warnings":0,"wordcount_off":0,"vague_claims":0,"missing_code_paths":0,"unverified_snippets":0,"weak_snippets":0,"numbers_no_math":0,"tilde_no_math":0,"percent_no_math":0,"ratio_no_citation":0,"missing_citations":0,"marketing_words":0,"hedge_words":0,"placeholder_urls":0,"inconsistent_idents":0,"footnote_balance":0,"math_off":0,"dollar_no_math":0,"bad_anchors":0,"defaults_mismatch":0,"range_inverted":0,"unbacked_claims":0,"http_not_https":0,"heading_skip":0,"frontmatter":0,"wordcount":4509},"status":"keep","description":"Iter 10 (real factual fix in §6.f — partitionwise join semantics). The previous wording said 'with [partitionwise_join] off, a JOIN of two partitioned tables on a common partition key fans out into a hash join over all 90 × 90 = 8,100 child pairs of which the planner cannot eliminate any without constraint exclusion on every column.' This is wrong. Without partitionwise_join, the planner does NOT fan out into 8,100 (90×90) child pairs — it appends each side into a single relation and runs ONE big hash join over the combined 1B + 1B rows. The 90×90 cross-product would be the cost of a Cartesian join, not a key-equi-join. Rewrote to describe the actual behavior accurately: with it off, both sides collapse into single Appends and one big hash join runs across all rows; with it on (and matching partition bounds), the planner runs 90 separate per-partition joins (partition i of A ⨝ partition i of B), each independent and parallelizable, with hash tables sized to one child rather than the full dataset. Reader gets the right intuition — partitionwise_join is about splitting one big hash join into N parallelizable smaller ones, not about pruning a quadratic fan-out. Wordcount 4471 → 4509. Defects 0. This is the kind of error that the metric never catches but a Postgres SME would call out in review.","timestamp":1778319651142,"segment":6}
{"run":10,"commit":"HEAD","metric":0,"metrics":{"build_warnings":0,"wordcount_off":0,"vague_claims":0,"missing_code_paths":0,"unverified_snippets":0,"numbers_no_math":0,"missing_citations":0,"marketing_words":0,"frontmatter":0,"placeholder_urls":0,"bad_url_host":0,"ground_truth_drift":0,"hedge_words":0,"tilde_no_math":0,"percent_no_math":0,"img_no_alt":0,"long_code_lines":0,"math_off":0,"wordcount":4115},"status":"keep","description":"Iter 10: math correctness in 'What I'd build differently'. Two real fixes the scorer doesn't catch but careful arithmetic does. (1) Recommendation 1 said 'The 5 MB delta over scratch is irrelevant'. The actual distroless-vs-scratch wire delta is 4.83 - 3.98 = 0.85 MB (not 5 MB; the 5 MB delta is wolfi-vs-distroless). Replaced with the correct '0.85 MB' and the explicit subtraction. Kept the scratch-as-opt-in conclusion since the 0.85 MB difference is still inside the 30 ms cold-pull band. (2) Recommendation 3 said 'localhost-registry pulls were 200-300 ms, gcr.io pulls were 2-3 s - a 10x swing. At 1000 pods x 10x = 10000 ms saved per scale event'. The arithmetic was nonsense - '1000 x 10x' has the wrong units, and the per-pod saving is the difference (1.8-2.5 s) not the ratio (10x). Replaced with measured ranges from the rig (0.25-0.30 s vs 2.79-2.99 s = ~2.5 s saving per pull) and a clean '1000 x 2.5 = 2500 s of cumulative CPU saving' calculation. Also called out kubelet's --serialize-image-pulls default which determines whether the saving is wall-clock or cumulative-CPU. Wordcount 4068 -> 4115.","timestamp":1778319651652,"segment":6}
{"run":17,"commit":"8643a63","metric":0,"metrics":{"build_warnings":0,"wordcount_off":0,"vague_claims":0,"missing_code_paths":0,"unverified_snippets":0,"weak_snippets":0,"numbers_no_math":0,"tilde_no_math":0,"percent_no_math":0,"ratio_no_citation":0,"missing_citations":0,"marketing_words":0,"hedge_words":0,"placeholder_urls":0,"inconsistent_idents":0,"footnote_balance":0,"math_off":0,"dollar_no_math":0,"bad_anchors":0,"defaults_mismatch":0,"range_inverted":0,"frontmatter":0,"wordcount":4790},"status":"keep","description":"Iter 17 (commit accuracy: empty-commit short-circuit). Real fix: §6 said \"Each Iceberg commit, even an empty one, writes a new metadata.json and at least one manifest list\" — but SnapshotProducer.java line 488–494 has an explicit \"if (updated.changes().isEmpty()) return;\" so a true no-op commit writes nothing. The wall-clock claim was right for non-empty commits; the prose edge-case was wrong. Restated as: \"Every Iceberg commit that actually changes table state writes a new metadata.json and at least one manifest list (a no-op commit short-circuits via updated.changes().isEmpty() in SnapshotProducer, but a real append always writes both files).\" Reader who later reads SnapshotProducer.java's apply()→commit() flow will not find a contradiction. Wordcount 4770 → 4790. Defects 0.","timestamp":1778319664411,"segment":6}
{"type":"config","name":"citus-distributed-planner correctness + napkin math (resume)","metricName":"defects","metricUnit":"","bestDirection":"lower"}
{"run":11,"commit":"67f3226","metric":0,"metrics":{"vague_claims":0,"ratio_no_citation":0,"marketing_words":0,"hedge_words":0,"weak_snippets":0,"missing_code_paths":0,"math_off":0,"wordcount":5054,"unverified_snippets":0,"missing_citations":0,"numbers_no_math":0,"frontmatter":0},"status":"keep","description":"Iter 11 (link-text/destination semantic mismatch). The §1 hook had `[vector_l2_ops](...src/vector.c#L573)` but src/vector.c L573 is the `l2_distance` PG_FUNCTION_INFO_V1 macro — vector_l2_ops is the operator class defined in sql/vector--0.4.4--0.5.0.sql. Sequential scan calls the function, not the operator class. Fixed link text to `l2_distance` matching the destination. Pre-emptive correctness check: I also confirmed that ALL hnsw search-path code uses MAIN_FORKNUM (verified via grep) — INIT_FORKNUM only appears in hnswbuildempty for unlogged-table initialization, not in the read path. So §1's claim 'graph that lives entirely inside Postgres regular MAIN_FORKNUM buffers' is accurate. Wordcount 5054, defects 0.","timestamp":1778319675367,"segment":6}
{"run":15,"commit":"3bf92f6","metric":0,"metrics":{"build_warnings":0,"wordcount_off":0,"vague_claims":0,"missing_code_paths":0,"unverified_snippets":0,"weak_snippets":0,"numbers_no_math":0,"tilde_no_math":0,"percent_no_math":0,"ratio_no_citation":0,"missing_citations":0,"marketing_words":0,"hedge_words":0,"placeholder_urls":0,"inconsistent_idents":0,"footnote_balance":0,"math_off":0,"dollar_no_math":0,"bad_anchors":0,"frontmatter":0,"unbacked_claims":0,"wordcount":4130},"status":"keep","description":"Iter 15 (correctness — fix 2 broken external URLs found by curl audit). Curl-tested every external URL in the post; two returned 404. (1) ronaksoft/uring-go: repo doesn't exist on GitHub (404). Replaced with two real maintained Go io_uring wrappers: iceber/iouring-go and godzie44/go-uring (both 200). (2) scylladb.com/2017/07/24/asynchronous-task-execution: 404 — the original blog URL is gone, no clean redirect. Replaced both citations of it with the evergreen scylladb.com/blog/ landing page (200). All 14 external URLs in the post now return 200 (or redirect to 200) per curl. wordcount 4129 to 4130.","timestamp":1778319687462,"segment":6}
{"run":1,"commit":"9e1ea97","metric":0,"metrics":{"build_warnings":0,"wordcount_off":0,"vague_claims":0,"missing_code_paths":0,"unverified_snippets":0,"weak_snippets":0,"numbers_no_math":0,"tilde_no_math":0,"percent_no_math":0,"ratio_no_citation":0,"missing_citations":0,"marketing_words":0,"hedge_words":0,"placeholder_urls":0,"inconsistent_idents":0,"footnote_balance":0,"math_off":0,"dollar_no_math":0,"bad_anchors":0,"frontmatter":0,"wordcount":4097},"status":"keep","description":"Iter 10 (resume baseline after context reset). Re-init'd because the autoresearch.jsonl config header was overwritten by a concurrent session targeting a different post (b-tree-on-ssd-three-ways). State on resume: post unchanged at 4097 words, all 28 detector dimensions at 0, hugo build clean. The last agent-touch under commit a895a3d kept my \"to 'child' pruning instances\" line-prefix fix from the previous session's iter 10 (verbatim quote integrity audit) intact. Open audit items from autoresearch.ideas.md: (a) end-to-end repro of §7 stretch bash — cannot run locally (no Citus binary on NixOS, no Docker), (b) char-level whitespace verification of quoted source comments — partially done, deserves another pass, (c) explicit benchmark citation for rack-local 10 GbE RTT.","timestamp":1778319691406,"segment":6}
{"run":17,"commit":"9fd9a52","metric":0,"metrics":{"build_warnings":0,"wordcount_off":0,"vague_claims":0,"missing_code_paths":0,"unverified_snippets":0,"weak_snippets":0,"numbers_no_math":0,"tilde_no_math":0,"percent_no_math":0,"ratio_no_citation":0,"missing_citations":0,"marketing_words":0,"hedge_words":0,"placeholder_urls":0,"inconsistent_idents":0,"footnote_balance":0,"math_off":0,"dollar_no_math":0,"bad_anchors":0,"defaults_mismatch":0,"range_inverted":0,"unbacked_claims":0,"http_not_https":0,"heading_skip":0,"broken_post_links":0,"missing_sections":0,"bad_commit_refs":0,"dupe_words":0,"broken_rendered_links":0,"loc_drift":0,"frontmatter":0,"wordcount":5394},"status":"keep","description":"Iter 17 (loc_drift regression check): added loc_drift (weight 3) — every \"~N lines of {go|python|rust|c|c++}\" prose claim is verified against actual line count in the cached repo (rglob'd, vendor and .cache skipped). 15% tolerance for rounding-friendliness. The wal-cake post claims \"~1,800 lines of Go\"; actual is 1,817; well within tolerance. Future drift (e.g. claim becoming stale as the codebase grows) will surface as a defect. Generalizes the iter-16 manual fix into a permanent regression check. defects 0 → 0.","timestamp":1778319699631,"segment":4}
{"run":18,"commit":"a508075","metric":0,"metrics":{"build_warnings":0,"wordcount_off":0,"vague_claims":0,"missing_code_paths":0,"unverified_snippets":0,"weak_snippets":0,"numbers_no_math":0,"tilde_no_math":0,"percent_no_math":0,"ratio_no_citation":0,"missing_citations":0,"marketing_words":0,"hedge_words":0,"placeholder_urls":0,"inconsistent_idents":0,"footnote_balance":0,"math_off":0,"dollar_no_math":0,"bad_anchors":0,"defaults_mismatch":0,"range_inverted":0,"frontmatter":0,"wordcount":4803},"status":"keep","description":"Iter 18 (retry-backoff semantics correction). Real fix: §4.4 said retries are \"capped at 60 s per attempt\" but COMMIT_MAX_RETRY_WAIT_MS_DEFAULT is the cap on inter-attempt SLEEP, not on attempt duration. Reading Tasks.foreach.exponentialBackoff(min, max, total, base) — the sleep starts at min=100 ms, doubles by base=2.0 each retry, is capped at max=60 s between attempts, and the total retry-wall-clock budget is total=30 min. Restated as: \"1 initial attempt + 4 retries = 5 total tries; sleep starts at 100 ms and doubles (base = 2), capped at 60 s between attempts; total wall-clock retry budget 30 minutes.\" Reader who actually configures these properties will get the right behaviour. Wordcount 4790 → 4803. Defects 0.","timestamp":1778319702374,"segment":6}
{"run":11,"commit":"c7ca5ba","metric":0,"metrics":{"build_warnings":0,"wordcount_off":0,"vague_claims":0,"missing_code_paths":0,"unverified_snippets":0,"weak_snippets":0,"numbers_no_math":0,"tilde_no_math":0,"percent_no_math":0,"ratio_no_citation":0,"missing_citations":0,"marketing_words":0,"hedge_words":0,"placeholder_urls":0,"inconsistent_idents":0,"footnote_balance":0,"math_off":0,"dollar_no_math":0,"bad_anchors":0,"defaults_mismatch":0,"range_inverted":0,"unbacked_claims":0,"http_not_https":0,"heading_skip":0,"frontmatter":0,"wordcount":4509},"status":"keep","description":"Iter 11 (bpftrace platform-honesty fix). The §9 bpftrace example listed '/opt/homebrew/.../postgres on Mac' as a binary path option, but bpftrace is Linux-only (depends on Linux eBPF). A reader on macOS who copy-pastes this gets a confusing 'command not found' or 'kernel does not support BPF' error. Fixed: explicitly note 'bpftrace is Linux-only; on macOS/BSD use dtrace + the equivalent probe.' Cleaner Debian/Ubuntu vs RHEL/CentOS path split. Real reader-experience improvement that the metric never catches. Wordcount 4509 unchanged. Defects 0.","timestamp":1778319705967,"segment":6}
{"run":11,"commit":"bc2d60e","metric":0,"metrics":{"build_warnings":0,"wordcount_off":0,"vague_claims":0,"missing_code_paths":0,"unverified_snippets":0,"numbers_no_math":0,"missing_citations":0,"marketing_words":0,"frontmatter":0,"placeholder_urls":0,"bad_url_host":0,"ground_truth_drift":0,"hedge_words":0,"tilde_no_math":0,"percent_no_math":0,"img_no_alt":0,"long_code_lines":0,"math_off":0,"wordcount":4146},"status":"keep","description":"Iter 11: two real correctness/honesty fixes. (1) The bpftrace one-liner had a bug: the second tracepoint had filter `/@reads_bytes/` referencing a map that was never set. bpftrace would silently never run that action. Fixed to mirror the first probe's `/comm == 'containerd'/` filter so reads from containerd actually accumulate into @bytes_read. Also tightened the prose interpretation - 'roughly N x (open+stat+mkdir+...)' was hand-wavy because we weren't aggregating by layer; the new wording 'syscall calls bunch up per-layer regardless of layer size' is faithful to what bpftrace actually surfaces. (2) Earlier iter's '--serialize-image-pulls (kubelet's default before v1.27 on some distros)' was a guessed version claim. Replaced with the more defensible 'many K8s distros leave on by default' framing and added a verified link to kubernetes.io/docs/reference/command-line-tools-reference/kubelet/ where the flag is documented (URL returns 200, added to live-URL cache). Wordcount 4115 -> 4146.","timestamp":1778319714289,"segment":6}
{"type":"config","name":"etcd-raft leader election post correctness + napkin math","metricName":"defects","metricUnit":"","bestDirection":"lower"}
{"run":16,"commit":"d7a411f","metric":0,"metrics":{"build_warnings":0,"wordcount_off":0,"vague_claims":0,"missing_code_paths":0,"unverified_snippets":0,"weak_snippets":0,"numbers_no_math":0,"tilde_no_math":0,"percent_no_math":0,"ratio_no_citation":0,"missing_citations":0,"marketing_words":0,"hedge_words":0,"placeholder_urls":0,"inconsistent_idents":0,"footnote_balance":0,"math_off":0,"dollar_no_math":0,"bad_anchors":0,"frontmatter":0,"unbacked_claims":0,"wordcount":4137},"status":"keep","description":"Iter 16 (visualization — added ASCII memory-layout diagram for the cache-line padding section). The story I'd told in prose ('sender stats and receiver stats lived in adjacent lines, the prefetch would drag a remote line into the wrong core's L1') is much more concrete with a picture. Added a 3-line ASCII diagram showing N (sender writes), N+1 (the metric_groups spacer), N+2 (receiver writes), with offsets 0x000, 0x040, 0x080 making the 64-byte stride explicit. Bytes the sender modifies and bytes the receiver modifies live in different cache lines with one full line in between as a defense against hardware prefetch crossing the boundary. New scorer category loc_drift also reports 0. wordcount 4130 to 4137.","timestamp":1778319725849,"segment":6}
{"run":1,"commit":"1555ad8","metric":35,"metrics":{"build_warnings":0,"wordcount_off":0,"missing_code_paths":1,"weak_snippets":1,"numbers_no_math":1,"percent_no_math":1,"hedge_words":1,"placeholder_urls":2,"inconsistent_idents":3,"unbacked_claims":2,"broken_post_links":0,"wordcount":3655},"status":"keep","description":"Baseline of etcd-raft leader-election post (33 KB, 3655 prose words). 35 defects: missing_code_paths=1 (the demo test file `raft_election_demo_test.go` doesn't exist in cached repo — it's a copy-paste-able snippet I'm asking the reader to create); weak_snippets=1 (one raft.go code block doesn't have a 25-char body line that substring-matches source — likely the `becomeLeader` block where I cut the comment); inconsistent_idents=3 (`Propose()`, `T_election`, `tickInterval` — the latter two are my own variables, not source idents — false positive); placeholder_urls=2 (probably matches against something in the body — investigate); unbacked_claims=2 ('measured' in paragraph w/o citation — the napkin-math table); numbers_no_math=1, percent_no_math=1, hedge_words=1 — minor.","timestamp":1778319731086,"segment":6}
{"run":12,"commit":"bdb3de4","metric":0,"metrics":{"vague_claims":0,"ratio_no_citation":0,"marketing_words":0,"hedge_words":0,"weak_snippets":0,"missing_code_paths":0,"math_off":0,"wordcount":5073,"unverified_snippets":0,"missing_citations":0,"numbers_no_math":0,"frontmatter":0},"status":"keep","description":"Iter 12 (citation-link correctness in §7). The IVFFlat-vs-HNSW comparison was linking to `#index-build-time` which is ambiguous: the README has TWO sections with that title (one under HNSW, one under IVFFlat), so the anchor only hits the first (HNSW). The cited claim 'IVFFlat builds substantially faster' is supported by the HNSW intro: 'has better query performance than IVFFlat ... but has slower build times and uses more memory' — that's the right citation. Switched the link to `#hnsw` and inline-quoted the README's own wording so the source is visible. Also removed the parenthetical 'also benchmark- and dataset-dependent' (true but unnecessary hedge once the source is quoted). Wordcount 5073 (+19 net).","timestamp":1778319747886,"segment":6}
{"run":12,"commit":"c4186af","metric":0,"metrics":{"build_warnings":0,"wordcount_off":0,"vague_claims":0,"missing_code_paths":0,"unverified_snippets":0,"weak_snippets":0,"numbers_no_math":0,"tilde_no_math":0,"percent_no_math":0,"ratio_no_citation":0,"missing_citations":0,"marketing_words":0,"hedge_words":0,"placeholder_urls":0,"inconsistent_idents":0,"footnote_balance":0,"math_off":0,"dollar_no_math":0,"bad_anchors":0,"defaults_mismatch":0,"range_inverted":0,"unbacked_claims":0,"http_not_https":0,"heading_skip":0,"frontmatter":0,"wordcount":4521},"status":"keep","description":"Iter 12 (release-date factual fix). I had been writing 'version 5.4.3, July 2025' in two places. Verified against the cached repo's git tags: `git log --tags --simplify-by-decoration` shows v5.4.3 tagged 2026-03-05 (not July 2025). The 'July 2025' was lifted from doc/pg_partman.md's own 'Last Updated: July 24, 2025' header — but that's the doc's last edit, not the v5.4.3 release date; v5.4.3 was actually tagged March 2026. Updated both occurrences (§2 lead and colophon footer) to 'version 5.4.3, tagged March 2026 per the cached `git log --tags`'. Added an inline reference to the CHANGELOG.md so a reader can cross-check. The other reference timeline (v5.4.0 = January 2026, v5.3.0 = September 2025) is reachable from the same `git log --tags` output. Real factual error caught by re-reading the cached source carefully — exactly the kind of thing the autoresearch loop is designed to surface. Wordcount 4509 → 4521. Defects 0.","timestamp":1778319753287,"segment":6}
{"run":18,"commit":"3ef679c","metric":0,"metrics":{"build_warnings":0,"wordcount_off":0,"vague_claims":0,"missing_code_paths":0,"unverified_snippets":0,"weak_snippets":0,"numbers_no_math":0,"tilde_no_math":0,"percent_no_math":0,"ratio_no_citation":0,"missing_citations":0,"marketing_words":0,"hedge_words":0,"placeholder_urls":0,"inconsistent_idents":0,"footnote_balance":0,"math_off":0,"dollar_no_math":0,"bad_anchors":0,"defaults_mismatch":0,"range_inverted":0,"unbacked_claims":0,"http_not_https":0,"heading_skip":0,"broken_post_links":0,"missing_sections":0,"bad_commit_refs":0,"dupe_words":0,"broken_rendered_links":0,"loc_drift":0,"frontmatter":0,"wordcount":5406},"status":"keep","description":"Iter 18 (TWO REAL atomic-counting bugs caught by careful re-reading): manual code-vs-prose verification of section 4. (a) Prose: \"Five atomics, two channels, one concurrent map\". WRONG: the source struct has FOUR atomic.Int64 (writeIdx, readIdx, lastSegIdx, nextSegSeq) — not five. Fixed to \"Four atomic.Int64s (writeIdx, readIdx, lastSegIdx, nextSegSeq), two channels (segments, ackSeg), one concurrent map\". Now matches struct verbatim. (b) Prose claimed `Add` is \"Five lines. One Load, one comparison, one slice write, one Add.\" But the source `Add()` does TWO Loads — `rb.writeIdx.Load()` and `rb.readIdx.Load()` (the latter inside the if-condition). Fixed to \"Two Loads (writeIdx + readIdx), one subtract + compare, one slice write, one Add\". Both errors are exactly the kind a code-aware reviewer would catch on first read; the scorer's structural checks (idents, snippets) all passed because the wrong nouns matched the source's nouns even when the count was wrong. Manual code-against-prose audit caught what no regex could. defects 0 → 0; wordcount 5394 → 5406.","timestamp":1778319757358,"segment":4}
