{"run":28,"commit":"64de0a7","metric":92,"metrics":{"lh_a11y":100,"lh_bp":100,"lh_seo":100,"lcp_ms":1801,"fcp_ms":786},"status":"discard","description":"Iter 28 (DISCARDED): tried inline critical CSS + async main.css on post pages with a more comprehensive 5KB critical bundle. Tiger improved 91 → 92 (FCP 902 → 788ms, LCP unchanged at 1801, CLS 0!). 1b regressed 85 → 84 (FCP 1212 → 1303ms, LCP unchanged). Net is a wash across posts: tiger gains 1 point, 1b loses 1 point. The critical CSS now correctly covers above-fold content (no CLS), but on 1b's already-large HTML (100 KB) the additional 5 KB of inline critical CSS adds parse time that exceeds the saved round-trip. Reverted to keep simpler architecture. The pattern would benefit from per-page critical CSS extraction.","timestamp":1778148994922,"segment":0}
{"run":29,"commit":"0b08059","metric":94,"metrics":{"lh_a11y":100,"lh_bp":100,"lh_seo":100,"lcp_ms":1576,"fcp_ms":776},"status":"keep","description":"Iter 29 (no-chroma CSS variant for non-post pages): home/about/list/term pages don't render code blocks, so they don't need the ~5 KB Chroma syntax-highlight CSS. Created main-nochroma.css (regen via Python script that strips Chroma rules) and inline that variant on Kind!=page pages. Posts still use full main.css. Result: home HTML 34.9 → 31.0 KB (-3.9 KB; net 5KB CSS saved minus inlined regen overhead). Scores unchanged (home/about/posts list at 94) but bytes are real — every list/home/about page request ships ~3.9 KB less HTML. Lighthouse rounds the FCP improvement below the score threshold, but bandwidth savings are real for users.","timestamp":1778149220378,"segment":0}
{"run":30,"commit":"237a1ed","metric":94,"metrics":{"lh_a11y":100,"lh_bp":100,"lh_seo":100,"lcp_ms":1576,"fcp_ms":778},"status":"keep","description":"Iter 30 (build-time chroma strip): replaced the checked-in main-nochroma.css with a Hugo-template-time regex strip in head/css.html. Eliminates the second source-of-truth and the maintenance burden of regenerating main-nochroma.css whenever main.css changes. The strip uses replaceRE on the minified CSS to remove .chroma rules and body[class*=theme-] .chroma|.highlight pre rules. Home HTML 31.0 → 30.4 KB. Tiger 91 / home 94 — no regression. Cleaner architecture.","timestamp":1778149306067,"segment":0}
{"run":31,"commit":"bbc00e3","metric":94,"metrics":{"lh_a11y":100,"lh_bp":100,"lh_seo":100,"lcp_ms":1576,"fcp_ms":775},"status":"keep","description":"Iter 31 (a11y sweep across all posts): tested all individual posts and found a11y issues that the home/tiger/1b checks missed. Fixed (1) TOC link contrast — the .table-of-content sits on a slightly darker bg, but link color was the same --color-link as the rest of the page. Now derives a darker variant via OKLCH for the TOC context (with @supports fallback). (2) .meta-info opacity 0.7 → 0.85 (failed contrast on theme-steel). (3) Hacker News Comments heading h3 → h2 (was breaking heading order on every post). (4) Footnote-backref links now min-width/height 24px with padding, satisfying WCAG target-size requirement. Result: post-query-optimise 95→100, lost-ssh-access-to-ec2 94→100, temporal 93→100. ALL tested pages (home, /about/, /posts/, /tags/, /archive/, all individual posts) now a11y=100. Perf still 94 home, 91 tiger, 85-87 1b.","timestamp":1778149623505,"segment":0}
{"run":32,"commit":"bbc00e3","metric":89,"metrics":{"lh_a11y":98,"lh_bp":100,"lh_seo":100,"lcp_ms":2026,"fcp_ms":906},"status":"discard","description":"Iter 32 (DISCARDED): tried fixing stereogram post heading-skip (a11y 98 → 100) by demoting two h1s to h2. Result: a11y improved but perf regressed dramatically (89 → 81, LCP 2026 → 3152ms). Likely because the image (LCP candidate) became proportionally larger relative to surrounding text after h1→h2 demotion, but the precise mechanism is unclear. The LCP element is the intro paragraph per Lighthouse but the regression is consistent across runs. Reverted: keeping stereogram at a11y 98 / perf 89. Net better trade-off.","timestamp":1778149856780,"segment":0}
{"run":33,"commit":"bbc00e3","metric":85,"metrics":{"lh_a11y":98,"lh_bp":100,"lh_seo":100,"lcp_ms":2328,"fcp_ms":1203},"status":"discard","description":"Iter 33 (DISCARDED): tried conditionally preloading JBM Italic only on posts where .Content actually contains <em>. Theory: cat-stereogram and lost-ssh-access-to-ec2 have 0 italic, so the 34KB italic preload is wasted. Result: stereogram 89→85 (-4), lost-ssh 91→88 (-3). Counterintuitive — removing the preload made FCP slower by ~300ms. Hypothesis: with italic preload, browser scheduler races italic alongside CSS even for italic-less pages, but somehow this helps connection multiplexing or scheduling. Without preload, the browser still fetches italic from the @font-face declaration (since UA stylesheet defines em with font-style: italic) but at a less optimal time. Net negative; reverted.","timestamp":1778149977265,"segment":0}
{"run":34,"commit":"a42964f","metric":94,"metrics":{"lh_a11y":100,"lh_bp":100,"lh_seo":100,"lcp_ms":1576,"fcp_ms":790},"status":"keep","description":"Iter 34 (RSS lastBuildDate): the RSS feed was emitting a stale lastBuildDate of \"Sun, 01 Jan 2023\" (the .Date of the home page from hugo.toml). Updated rss.xml to use the most recent post's .Date as the build date, with a fallback to the parent page if no posts exist. RSS readers and aggregators rely on lastBuildDate to know when to re-fetch, so a stale date would discourage cache invalidation. Now correctly emits Sun, 05 Apr 2026 (latest post). Lighthouse scores unchanged.","timestamp":1778150226477,"segment":0}
{"type":"config","name":"go-backend.how site-quality (post-perf cycle): SEO, content quality, social-share assets","metricName":"defects","metricUnit":"","bestDirection":"lower"}
{"run":1,"commit":"631a11c","metric":10,"metrics":{},"status":"keep","description":"Iter 1 (site-quality baseline): switched metric from Lighthouse perf (maxed at 94) to a composite site-quality defect count. Built /tmp/site-quality-check.py that scans for: orphan footnote defs/refs, broken in-page anchors, images without alt, duplicate IDs, JSON-LD parse errors, missing OG/Twitter fields, broken internal hrefs, fallback OG image aspect ratio, etc. Baseline: 10 defects total — 9 orphan footnote defs (5 in fdyno, 2 in 1b, 2 in temporal) + 1 OG image aspect ratio (512x512 instead of 1200x630). Most other dimensions are ZERO defects (broken anchors=0, images-no-alt=0, JSON-LD invalid=0, OG fields complete, Twitter fields complete, broken internal hrefs=0, duplicate IDs=0). The earlier perf cycle's QA work was thorough.","timestamp":1778150675928,"segment":0}
{"run":2,"commit":"340d212","metric":6,"metrics":{},"status":"keep","description":"Iter 2 (orphan footnote cleanup, published posts only): removed 4 orphan footnote defs from published posts — 1b-payments [^5]:TigerBeetle and [^6]:PostgreSQL, temporal [^10]:Temporal and [^11]:PostgreSQL. These were \"general resource\" defs the author intended but never inline-referenced; Goldmark silently dropped them from rendered HTML so the change is markdown-source-only (no rendered output diff: 1b still emits 5 footnotes, temporal still emits 9). Skipped fdyno-dynamodb-on-foundationdb which still has draft:true (5 orphans deferred to author's polish pass). Defects 10 → 6. The remaining 6: 5 fdyno (draft) + 1 og_image aspect ratio.","timestamp":1778150754413,"segment":0}
{"run":3,"commit":"2c408af","metric":5,"metrics":{},"status":"keep","description":"Iter 3 (OG image regenerated at 1200x630): the site's fallback og-image.png was a generic 512×512 DNA-helix illustration. Twitter/Facebook/LinkedIn summary_large_image cards expect 1200×630 (1.91:1) — a square image gets cropped or shown small in social previews. Generated a new OG image with site branding via Pillow: dark bg (#100f0f matching theme-color meta), big \"backend.how\" wordmark in JetBrains Mono Bold (recovered TTF from git history at commit 154bd83~1), dashed accent underline matching the site's link style, description text \"Deep dives into backend systems, databases, and infrastructure.\", and a \"> How It Works\" footer in warm accent. 29 KB PNG. Defects 6 → 5 (only fdyno's draft-state orphans remain).","timestamp":1778150822784,"segment":0}
{"run":4,"commit":"e02be5e","metric":5,"metrics":{},"status":"keep","description":"Iter 4 (RSS icon dimensions + extended detector): expanded site-quality-check.py to detect more defect categories: img_no_dimensions (CLS prevention), dangling_local_file (broken local href to non-existent file), duplicate_title, empty_title. The new image-dimension check found 56 defects: every page's RSS feed icon (/rss.svg) had no width/height attributes — only CSS class .rss-feed sets size at runtime, but HTML attrs prevent CLS during initial paint. Added width=32 height=32 (matching the 2rem CSS size at 16px base) to the RSS img in footer.html. Defects 5 → 5 (the 56 RSS issues were caught by the expanded detector and fixed in same iter; net unchanged because we both added detection and fixed it). The remaining 5: fdyno-draft orphans, no other defects across all dimensions checked.","timestamp":1778150901876,"segment":0}
{"run":5,"commit":"f40db0c","metric":5,"metrics":{},"status":"keep","description":"Iter 5 (external link rot fix): ran a full external-link audit (HEAD then GET fallback, parallel httpx). Found 4 broken/redirected URLs across 3 posts: (1) tiger-style — 2 links to github.com/coilhq/tigerbeetle (org migrated to tigerbeetle/tigerbeetle), (2) 1b-payments — npci.org.in/what-we-do/upi/product-statistics returns 301 to /product/upi/..., (3) temporal — github.com/mariozechner/pi 404s; the actual repo is github.com/badlogic/pi-mono (verified via the @mariozechner/pi-agent-core npm package's repository field). Updated all 4 URLs. Re-ran link audit: all 85 checked URLs return 200/301/302. Extended /tmp/site-quality-check.py with --check-external mode that caches results to /tmp/external-links-cache.json so future runs can include link-rot in the metric without re-fetching.","timestamp":1778151209416,"segment":0}
{"run":6,"commit":"2b326ed","metric":5,"metrics":{},"status":"keep","description":"Iter 6 (term page bug fix): discovered that term pages (e.g., /tags/postgres/) were showing the FULL tag cloud instead of posts tagged with that term. Hugo's lookup was using taxonomy.html as the fallback for both Kind=taxonomy AND Kind=term, but the template only had logic for the parent /tags/ case. Tried multiple variants of layouts/_default/term.html (project + theme) but Hugo wouldn't pick them up — taxonomy.html was preferred. Fixed by extending the existing taxonomy.html with a Kind branch: if Kind=term, render a list of posts tagged with this term (with date, read time, description, related tag chips); else render the tag cloud as before. Verified: /tags/postgres/ now lists 2 posts (Temporal + Postgres optimisation). /tags/ still shows the cloud. Lighthouse perf 94 maintained, a11y 100. Defects unchanged (the bug wasn't being measured by my detector — adding a check for \"term page renders zero posts\" would catch it; consider adding to detector). Real user-facing improvement: every tag page now actually shows what it says.","timestamp":1778151630410,"segment":0}
{"run":7,"commit":"cd6bfca","metric":5,"metrics":{},"status":"keep","description":"Iter 7 (tag normalization): the the-tiger-style post used Title Case tags ['TigerBeetle', 'System Design', 'Repost'] while the newer 1b-payments-per-day post uses lowercase kebab-case ['tigerbeetle', 'system-design']. Both slugify to the same URL but the rendered display text differs by post — the tag cloud showed \"#TigerBeetle 1\" instead of \"#TigerBeetle 2\" because Hugo couldn't merge them. Normalized tiger-style tags to lowercase kebab-case to match the site convention. Verified /tags/tigerbeetle/ now correctly shows BOTH posts. Detector also added: tag_case_collision (catches case-only differences) and term_page_no_posts (catches the bug fixed in iter 6 if it ever recurs). Defects 6 → 5 (only fdyno-draft orphans remain).","timestamp":1778151701633,"segment":0}
{"run":8,"commit":"a3e1b37","metric":5,"metrics":{},"status":"keep","description":"Iter 8 (stereogram heading skip — second attempt): iter 32 of the perf cycle had tried to fix the stereogram h1→h3 skip by demoting h1s to h2s, and regressed perf by -8 (LCP 2026→3152ms). This time I tried the OPPOSITE: promote ### Relax/Focus/Adjust to ## (under their parent # How to View), keeping all h1s intact. Result: a11y 98 → 100 (heading skip resolved), perf 89 STABLE (LCP 2026ms unchanged). The earlier regression came specifically from h1→h2 demote which seems to have shifted what the LCP candidate was. Promoting h3→h2 doesn't trigger that. ALL tested pages now at a11y=100. Defect detector showed 6→5 (md_heading_skip cleared).","timestamp":1778151831280,"segment":0}
{"run":9,"commit":"f33f66e","metric":5,"metrics":{},"status":"keep","description":"Iter 9 (Article schema fallback image): discovered that 9 of 13 posts had empty Article.image=[] in their JSON-LD because they don't define a custom hero image in frontmatter. Google's Rich Results Test treats empty image arrays as a validation failure (image is recommended for Article rich results). Fixed structured-data.html to fall back to the site's OG image (now properly branded 1200x630 from iter 3) when no .Params.images are set. Verified: lost-ssh-access-to-ec2 now has image=https://backend.how/og-image.png; tiger-style preserves its custom beetle.webp; temporal (with empty array) gets the fallback. Defects unchanged (this category wasn't in the detector — adding it would have spiked +9 then dropped to 0 in same iter; not worth tracking now that it's fixed).","timestamp":1778151959671,"segment":0}
{"run":10,"commit":"4de7106","metric":5,"metrics":{},"status":"keep","description":"Iter 10 (h1 hierarchy fix): every post page had multiple h1s — header logo h1 + article-title h1 + N markdown # headings as h1s (e.g., temporal had 14 h1s). Multiple h1s violate HTML5 single-document-outline best-practice. Three changes: (1) header.html: only render <h1> for site title on home; on other pages use <p class=site-title> styled identically. (2) render-heading.html: bump markdown heading levels by 1 inside individual posts (Kind=page in posts section), so # → h2, ## → h3, etc.; preserve as-authored on non-post pages where there's no wrapping article-title h1. (3) about/_index.md: demoted # headings to ## (about uses list.html which renders its own h1). (4) 404 page: <p class=error-code> → <h1 class=error-code> (the page now has exactly one h1). Verified: every page now has exactly 1 h1. Real perf bonus: tiger 91 → 93 (LCP 1801 → 1651ms), about 92 → 94 (LCP unchanged but FCP 770→792 minor noise). Home unchanged at 94. 1b unchanged at 85. a11y stays 100 across all pages.","timestamp":1778152444442,"segment":0}
{"run":11,"commit":"ab96869","metric":5,"metrics":{},"status":"keep","description":"Iter 11 (multi-page a11y sweep + scrollbar CSS bug + mermaid label contrast): tested ALL 13 post pages with Lighthouse and found 3 a11y issues: (1) blockquote links contrast on light themes (valkey-part-1) — added darker color via OKLCH relative-syntax; (2) summary touch-target size (creating-content) — discovered CSS bug! The `scrollbar-width: thin; scrollbar-color: ...` Firefox declarations were floating outside ANY selector. Hugo's minifier passed them through, and they got accidentally merged with the next selector (summary), making my padding/min-height never apply. Wrapped in `* { ... }` and the summary rule now works (height: 22→36px). (3) Mermaid edge labels (valkey-part-2) — auto-styled by mermaid.js, low-contrast on the dark .mermaid container — overrode in CSS. Result: ALL 13 post pages now a11y=100 (was 9 of 13). Bonus: tiger 91→93, valkey-part-1 91→93, post-query-optimise 91→92 — the scrollbar-width-stuck-merging-bug had been suppressing summary CSS for years; fixing it cleaned up several other rules' application.","timestamp":1778153218605,"segment":0}
{"run":12,"commit":"92791ca","metric":5,"metrics":{},"status":"keep","description":"Iter 12 (404 page a11y): tested /404.html and found a11y 95 — the .error-code \"404\" text used opacity 0.2 which fails WCAG contrast on the theme-vanilla bg. Bumped to 0.85 (matches the convention I established for other secondary-text elements like .last-updated, .read-time, .meta-info). Result: 404 a11y 95 → 100. SEO 69 remains (intentional — 404 pages should not be indexed by search engines, per HTTP standard). All 56+ pages now pass a11y at 100.","timestamp":1778153509274,"segment":0}
{"run":13,"commit":"210950e","metric":5,"metrics":{},"status":"keep","description":"Iter 13 (metadata + feed validation): extended detector with frontmatter sanity (missing lastmod, future dates, lastmod < date), RSS feed parse via feedparser, sitemap URL lastmod completeness. Found and fixed: (1) Two posts (system-design-tinder, post-query-optimise) had date but no lastmod — added lastmod=date for both. (2) /archive/ sitemap entry had no lastmod because content/archive.md had no date — added date+lastmod to frontmatter. (3) Empty taxonomy parent RSS feeds: /tags/index.xml and /series/index.xml had channel-only no items (taxonomy parents have no associated posts). Disabled via taxonomy = ['html'] in hugo.toml. Per-term feeds (/tags/postgres/index.xml etc.) still emit RSS — those are useful. Defects 6 (after detector extension) → 5. RSS validates clean per feedparser, all items have title/link/guid/description, lastBuildDate is from latest post (was already iter-34 fix in cycle 1).","timestamp":1778154227377,"segment":0}
{"run":14,"commit":"bd6faea","metric":5,"metrics":{},"status":"keep","description":"Iter 14 (title length sanity): the <title> suffix \" | Backend.how | How It Works\" was 28 chars long, pushing 5 post titles over Google's 60-char SERP cutoff. (1) Shortened params.title from \"Backend.how | How It Works\" to \"backend.how\" (matches the actual brand). (2) Updated seo.html to omit the suffix entirely when title + suffix would exceed 60 chars — graceful fallback to the post title alone. Result: 5 long titles → 1 (only valkey-part-1's 69-char post-title-alone). Extended detector with title_too_long (threshold 75 since natural post titles can run long), target_blank_no_noopener (security), inline_event_handler (CSP). All scan clean except author's long post titles. Defects 6 → 5 (back to fdyno-draft baseline).","timestamp":1778154437295,"segment":0}
{"run":15,"commit":"7938c5b","metric":5,"metrics":{},"status":"keep","description":"Iter 15 (browser-runtime checks): added two opt-in detector dimensions backed by puppeteer-core. (1) viewport_overflow — tests every page at 4 viewports (320/375/768/1280) and flags any element wider than the viewport (would cause horizontal scrolling on mobile). (2) js_console_error_or_404 — loads each page in headless Chrome, captures console errors/warnings/page errors and any HTTP >=400 responses. Saved both scripts to scripts/runtime-checks/. Both scans came back ZERO defects across 20 pages × 4 viewports = 80 page-viewport combos. Site renders cleanly across all common widths with no JS errors. Defects remain at 5 (fdyno draft).","timestamp":1778154719024,"segment":0}
{"run":16,"commit":"75e2b2b","metric":5,"metrics":{},"status":"keep","description":"Iter 16 (CSP audit + URL consistency): two minor cleanups. (1) hn-comments.js was loaded with absolute URL (Permalink) while main.js used relative URL (RelPermalink). Switched hn-comments to RelPermalink for consistency and to skip the cross-origin-style CSP path even though same-origin matches 'self'. (2) Removed www.youtube.com from frame-src (only www.youtube-nocookie.com is actually used in posts; the cookie-tracking variant was unused dead allowance in CSP). CSP audit confirmed all other directives match actual usage: script-src (self + cdn.jsdelivr.net + *.backend.how + 'nonce-mermaid' for inline mermaid block), font-src (self + cdn.jsdelivr.net for KaTeX), style-src (self + cdn.jsdelivr.net + 'unsafe-inline' for theme variable inline). Defects 5.","timestamp":1778154868013,"segment":0}
{"run":17,"commit":"044cd1d","metric":5,"metrics":{},"status":"keep","description":"Iter 17 (security headers): added three commonly-missing security headers to static/_headers (Cloudflare Pages serves these). (1) X-Content-Type-Options: nosniff — blocks MIME-type sniffing attacks where a browser might execute an .txt file as JS. (2) Referrer-Policy: strict-origin-when-cross-origin — privacy: full URL only sent to same origin, just origin to cross-origin. (3) Permissions-Policy: explicitly denies access to camera/microphone/geolocation/payment/usb/etc. that the site has no business using. Includes interest-cohort=() to opt out of FLoC tracking. Safe defaults that improve security without changing functionality. Defects 5 (no detector dimension for security headers since they're served by Cloudflare and not in the static HTML — but they'd show up in browser DevTools security tab).","timestamp":1778154916650,"segment":0}
