{"run":31,"commit":"9887fb7","metric":0,"metrics":{"build_warnings":0,"wordcount_off":0,"vague_claims":0,"missing_code_paths":0,"unverified_snippets":0,"weak_snippets":0,"numbers_no_math":0,"tilde_no_math":0,"percent_no_math":0,"ratio_no_citation":0,"missing_citations":0,"marketing_words":0,"hedge_words":0,"placeholder_urls":0,"inconsistent_idents":0,"footnote_balance":0,"math_off":0,"dollar_no_math":0,"bad_anchors":0,"defaults_mismatch":0,"range_inverted":0,"unbacked_claims":0,"http_not_https":0,"heading_skip":0,"broken_post_links":0,"missing_sections":0,"bad_commit_refs":0,"dupe_words":0,"broken_rendered_links":0,"loc_drift":0,"frontmatter":0,"wordcount":5494},"status":"keep","description":"Iter 31 (errgroup attribution precision): the §2 narrative said \"The boundary between the two halves is two channels and an errgroup.\" That's wrong about *where* the errgroup lives. The errgroup is inside `rb.Start` and supervises the ring buffer's internal goroutines (receiver, N workers, ack pipeline). The replicator's `repl.Start` is launched via plain `go repl.Start(...)` from main, not via errgroup. So the boundary between replicator and ring buffer is just two channels (eventsCh, ackCh) — not channels-and-errgroup. Rewrote: \"No shared mutex between the two halves; the only boundary is two channels (eventsCh, ackCh). An errgroup inside the ring buffer supervises receiver, workers, and ack pipeline.\" Linked the errgroup pkg.go.dev page so the reader unfamiliar with it can read about WithContext + Wait. Trim of redundant phrasing kept wordcount at 5494 (just under the 5500 threshold). defects 1 → 0; wordcount 5475 → 5494.","timestamp":1778320688107,"segment":4}
{"run":37,"commit":"533753a","metric":0,"metrics":{"build_warnings":0,"missing_code_paths":0,"unverified_snippets":0,"unverified_literal":0,"numbers_no_math":0,"missing_citations":0,"marketing_words":0,"frontmatter":0,"bad_url_anchor":0,"bad_commit_ref":0,"factlib_size_drift":0,"wal_record_overhead_off":0,"fabricated_production":0,"loc_drift":0,"orders_of_magnitude":0,"bad_section_xref":0,"long_code_lines":0,"heading_skip":0,"bad_anchor_link":0,"license_claim":0,"gofmt":0,"wordcount":4969},"status":"keep","description":"Iter 39 (scorer extension — gofmt syntax check). New detector gofmt (×3): for every ```go code block, run gofmt -l on a tmpfile (wrapping with `package x\\n` if the snippet doesn't have a package decl). If gofmt returns non-zero, the block has a syntax error. Skips pseudocode blocks (containing '...' or no `func` declaration) so the §4 application example with `u.ID, ..., payloadBytes` doesn't trip. Run against the current post: 3 real Go blocks (Emit hot path, WithTxn, listenEventAck, processLogicalMessage, the ##Minimal Go producer demo) all pass. Now any future code edit that breaks Go syntax will trip the detector immediately. Defects stays at 0.","timestamp":1778320696828,"segment":4}
{"run":37,"commit":"38f2299","metric":0,"metrics":{"build_warnings":0,"wordcount_off":0,"vague_claims":0,"missing_code_paths":0,"unverified_snippets":0,"weak_snippets":0,"numbers_no_math":0,"tilde_no_math":0,"percent_no_math":0,"ratio_no_citation":0,"missing_citations":0,"marketing_words":0,"hedge_words":0,"placeholder_urls":0,"inconsistent_idents":0,"footnote_balance":0,"math_off":0,"dollar_no_math":0,"bad_anchors":0,"defaults_mismatch":0,"range_inverted":0,"frontmatter":0,"wordcount":4933},"status":"keep","description":"Iter 37 (intro consistency with closing). The intro's roadmap promised what I would build differently \"if I were designing v5 today\" — but iter 19 deliberately removed the \"v5 debates\" claim from the closing because I have no concrete v5 reference. Updated the intro to \"if I were designing the manifest layer fresh\" which doesn't promise a v5 concept that the post doesn't deliver. Wordcount 4931 → 4933. Defects 0.","timestamp":1778320706312,"segment":6}
{"run":13,"commit":"82e792c","metric":0,"metrics":{"build_warnings":0,"wordcount_off":0,"vague_claims":0,"missing_code_paths":0,"unverified_snippets":0,"weak_snippets":0,"numbers_no_math":0,"tilde_no_math":0,"percent_no_math":0,"ratio_no_citation":0,"missing_citations":0,"marketing_words":0,"hedge_words":0,"placeholder_urls":0,"inconsistent_idents":0,"footnote_balance":0,"math_off":0,"dollar_no_math":0,"bad_anchors":0,"defaults_mismatch":0,"range_inverted":0,"unbacked_claims":0,"http_not_https":0,"heading_skip":0,"broken_post_links":0,"missing_sections":0,"bad_commit_refs":0,"dupe_words":0,"broken_rendered_links":0,"frontmatter":0,"wordcount":4328},"status":"keep","description":"Iter 12 (audit pass — bbolt Bucket struct line off-by-one). I cited bucket.go:31 for the `Bucket` type definition. Verified: `type Bucket struct {` is at line 30; line 31 is the embedded `*common.InBucket` field. Updated `#L31` → `#L30` and prose `bucket.go:31` → `bucket.go:30`. Spot-checked all other Pebble line citations (MemTableSize at 1714, LBaseMaxBytes at 1686, L0CompactionThreshold at 1654 — those are the if-default-zero conditions, the assignment is the next line; both are reasonable references) and bbolt (DefaultFillPercent ✓ at 27, split ✓ at 206) and LMDB (mm_psize ✓ at 1271, MDB_meta typedef ✓ at 1253-1279, mdb_env_write_meta ✓ at 4359, mdb_page_touch ✓ at 2785). Defects 0; wordcount 4328 (tag).","timestamp":1778320714469,"segment":6}
{"run":14,"commit":"c3c8164","metric":0,"metrics":{"build_warnings":0,"wordcount_off":0,"vague_claims":0,"missing_code_paths":0,"unverified_snippets":0,"weak_snippets":0,"numbers_no_math":0,"tilde_no_math":0,"percent_no_math":0,"ratio_no_citation":0,"missing_citations":0,"marketing_words":0,"hedge_words":0,"placeholder_urls":0,"inconsistent_idents":0,"footnote_balance":0,"math_off":0,"dollar_no_math":0,"bad_anchors":0,"frontmatter":0,"wordcount":4401},"status":"keep","description":"Iter 23 (final-pass spot-checks + ideas-backlog refresh). Verified: pull_var_clause cited in §7 idea #3 actually appears in fast_path_router_planner.c:375 + extended_op_node_utils.c (3 hits). Reference-table claim in §4 step 0 is accurate (1 shard replicated to all nodes; pruning returns all shards). Diagram's \"Distributed Subplans (intermediate results materialised on every worker)\" matches the citus README phrasing word-for-word (\"output is sent to all the workers and written into an intermediate result\"). Refreshed autoresearch.ideas.md to reflect 13 closed audit items in this resume cycle (iters 11-23) plus the 2 remaining open items: (a) cannot end-to-end repro the §7 stretch bash without a Citus cluster, (b) §6 CockroachDB/Spanner comparison is a directional claim — could be tightened with explicit \"ranges\" / \"splits\" terminology but isn't a correctness bug. defects 0 → 0; wordcount unchanged at 4401. The post is now in a state where every napkin number, file:line, DEBUG message, and quoted code line has been individually verified against the source — many false claims found and fixed that the regex scorer would never have caught.","timestamp":1778320720576,"segment":6}
{"run":32,"commit":"7eb96c9","metric":0,"metrics":{"build_warnings":0,"wordcount_off":0,"vague_claims":0,"missing_code_paths":0,"unverified_snippets":0,"weak_snippets":0,"numbers_no_math":0,"tilde_no_math":0,"percent_no_math":0,"ratio_no_citation":0,"missing_citations":0,"marketing_words":0,"hedge_words":0,"placeholder_urls":0,"inconsistent_idents":0,"footnote_balance":0,"math_off":0,"dollar_no_math":0,"bad_anchors":0,"frontmatter":0,"unbacked_claims":0,"wordcount":4419},"status":"keep","description":"Iter 32 (correctness — fix driver names + add real GitHub links). Tradeoff #5 listed Scylla's shard-aware drivers as 'gocql, scylla-driver-python, the official Java driver, the ScyllaDB Rust driver' — three of those names were either wrong or vague. Real names per ScyllaDB's GitHub org: scylladb/gocql (the Scylla fork of gocql), scylladb/python-driver (NOT scylla-driver-python — that name doesn't exist on GitHub), scylladb/scylla-rust-driver. Replaced the prose name list with backticked-link list pointing at the actual repos (all three URLs return 200 per curl). Also added 'plus the latency of the extra cross-core hop' to make the cost more concrete than just '70 ns penalty'. wordcount 4392 to 4419.","timestamp":1778320722158,"segment":6}
{"run":6,"commit":"d1394e5","metric":0,"metrics":{"build_warnings":0,"wordcount_off":0,"vague_claims":0,"missing_code_paths":0,"unverified_snippets":0,"weak_snippets":0,"numbers_no_math":0,"tilde_no_math":0,"percent_no_math":0,"ratio_no_citation":0,"missing_citations":0,"marketing_words":0,"hedge_words":0,"placeholder_urls":0,"inconsistent_idents":0,"footnote_balance":0,"math_off":0,"dollar_no_math":0,"bad_anchors":0,"defaults_mismatch":0,"range_inverted":0,"unbacked_claims":0,"http_not_https":0,"heading_skip":0,"broken_post_links":0,"missing_sections":0,"bad_commit_refs":0,"dupe_words":0,"broken_rendered_links":0,"loc_drift":0,"frontmatter":0,"wordcount":3769},"status":"keep","description":"Iter 6 (citation truthfulness + unit consistency): 0 defects held. Three real fixes the metric didn't catch. (1) Removed fabricated 'CIDR 2024 paper p86-kohn.pdf' citation — verified the URL 404s and there is no such Kohn paper at CIDR 2024. Replaced with the real DuckDB SIGMOD 2019 paper by Raasveldt & Mühleisen (https://hannes.muehleisen.org/publications/SIGMOD2019-demo-duckdb.pdf, 200 OK), and added the source-file pointer to pipeline_executor.cpp. (2) Removed the second hand-wavy '80× rationalization' paragraph that tried to make `(55+60+42)/3 = 52` round to 80 by appealing to 'SF-1 row-store tax'. Honest replacement: 'the title is round; the geomean is 58×; Q06 SF=10 is 600×; the spread is 1.5–2 orders of magnitude with single-query 3-orders-of-magnitude outliers.' (3) Unified the 8.4 vs 8.2 GiB calculation across the post — `1,078,182 × 8 KiB = 8625456 KiB = 8.22 GiB`. Was inconsistently 8 GB / 8.2 GiB / 8.4 GiB across three places. Fixed all three to 8.2 GiB and adjusted the 350 MB/s napkin number to 340 MB/s to match the corrected denominator. Wordcount 3787 → 3769.","timestamp":1778320726717,"segment":6}
{"run":11,"commit":"9486b22","metric":0,"metrics":{"build_warnings":0,"wordcount_off":0,"missing_code_paths":0,"weak_snippets":0,"numbers_no_math":0,"percent_no_math":0,"hedge_words":0,"placeholder_urls":0,"inconsistent_idents":0,"unbacked_claims":0,"broken_post_links":0,"wordcount":4292},"status":"keep","description":"Iter 10 (split-vote probability fix). The previous claim was 1/4 chance, once per ten elections - off by 2x. For two iid uniform draws on a band of L=10 ticks (the randomisation window the source comment specifies), P(|X-Y| < 1) approximately 2/L = 0.2, so the actual collision rate is once per five elections. Rewrote with the explicit formula P(|X-Y| < epsilon) approximately 2*epsilon/L - (epsilon/L)^2 for small epsilon, computed as 2/10 approximately 0.2. Metric tripped math_off briefly because I wrote 2/10 = 20% (mixing raw ratio with percentage); fixed to 2/10 approximately 0.2 then noted that as 20%. defects 0; wordcount 4286 to 4292.","timestamp":1778320731813,"segment":6}
{"run":38,"commit":"5396dae","metric":0,"metrics":{"build_warnings":0,"missing_code_paths":0,"unverified_snippets":0,"unverified_literal":0,"numbers_no_math":0,"missing_citations":0,"marketing_words":0,"frontmatter":0,"bad_url_anchor":0,"bad_commit_ref":0,"factlib_size_drift":0,"wal_record_overhead_off":0,"fabricated_production":0,"loc_drift":0,"orders_of_magnitude":0,"bad_section_xref":0,"long_code_lines":0,"heading_skip":0,"bad_anchor_link":0,"license_claim":0,"gofmt":0,"wordcount":4972},"status":"keep","description":"Iter 40 (semantic correctness — replication-slot creation order). The §10 verification SQL block from iter 38 created the slot AFTER framing it as 'after running the demo'. Wrong: a logical replication slot only sees changes from its creation point forward (Postgres docs: 'Replication slots provide an automated way to ensure that the master does not remove WAL segments until they have been received by all standbys' — slots track from creation LSN onward). So peeking after-the-fact returned nothing. Restructured the SQL block as a numbered 4-step recipe: (1) BEFORE the demo: CREATE PUBLICATION + create slot; (2) run the Go program; (3) peek with the now-populated slot; (4) cleanup. Also switched to `encode(data, 'hex')` so the bytes are human-readable when displayed (raw bytea otherwise gets escape-encoded). And added 'lsn' to the SELECT so the reader can correlate. Wordcount 4969 → 4972.","timestamp":1778320737307,"segment":4}
{"run":26,"commit":"HEAD","metric":0,"metrics":{"vague_claims":0,"ratio_no_citation":0,"marketing_words":0,"hedge_words":0,"weak_snippets":0,"missing_code_paths":0,"math_off":0,"wordcount":5230,"unverified_snippets":0,"missing_citations":0,"numbers_no_math":0,"frontmatter":0},"status":"keep","description":"Iter 26 (autoresearch.ideas.md refresh). Updated my per-loop ideas backlog: closed 7 more items (iters 19-25 covering benchmark reproducibility, architecture diagram precision, mean clarification, deduplication mechanism, magnitude weakening, IVFFlat formula correction, and §7 system taxonomy). Closed the OG image item — verified og.png exists at 1200×630. Added a new open item about end-to-end perf-flamegraph validation of the §5 109 ns/row decomposition. Backlog now lists 5 open items, all 'nice to have' rather than blocking. Wordcount 5230; defects 0.","timestamp":1778320737476,"segment":6}
{"run":38,"commit":"1ad5a3a","metric":0,"metrics":{"build_warnings":0,"wordcount_off":0,"vague_claims":0,"missing_code_paths":0,"unverified_snippets":0,"weak_snippets":0,"numbers_no_math":0,"tilde_no_math":0,"percent_no_math":0,"ratio_no_citation":0,"missing_citations":0,"marketing_words":0,"hedge_words":0,"placeholder_urls":0,"inconsistent_idents":0,"footnote_balance":0,"math_off":0,"dollar_no_math":0,"bad_anchors":0,"defaults_mismatch":0,"range_inverted":0,"frontmatter":0,"wordcount":4956},"status":"keep","description":"Iter 38 (overclaim cooling: \"uniquely determine\" → \"largely determine\"). Real fix: §2 closer said \"These four constraints uniquely determine the shape of Iceberg\" — but Delta Lake and Hudi land at very similar designs from the same constraint set (single-pointer atomic swap, immutable file tree, log/manifest layer). The differences are below the manifest layer (Delta uses transaction log Parquet checkpoint files; Hudi has CoW + MoR; Iceberg has explicit field-id tracking). Reframed to \"largely determine\" with the explicit caveat that the differences live one level below. The \"everything else is consequence\" cliché → \"Everything in §3 onwards follows from this list.\" (more accurate, calls forward to the structure). Wordcount 4933 → 4956. Defects 0.","timestamp":1778320737802,"segment":6}
{"run":20,"commit":"ae2e3a6","metric":0,"metrics":{"build_warnings":0,"wordcount_off":0,"vague_claims":0,"missing_code_paths":0,"unverified_snippets":0,"numbers_no_math":0,"missing_citations":0,"marketing_words":0,"frontmatter":0,"placeholder_urls":0,"bad_url_host":0,"ground_truth_drift":0,"hedge_words":0,"tilde_no_math":0,"percent_no_math":0,"img_no_alt":0,"long_code_lines":0,"math_off":0,"wordcount":4469},"status":"keep","description":"Iter 20: technical-correctness fix on PIE recommendation. The earlier wording said 'PIE adds a per-pod relocation pass on the dynamic linker side' - but Go static-PIE binaries (CGO_ENABLED=0 + buildmode=pie) do NOT go through ld.so; they remain self-contained and the kernel + the binary's own startup code apply relocations. Reworded to be technically accurate: 'static-PIE: the binary is still self-contained (no ld.so involved on a CGO_ENABLED=0 build), but the kernel + the binary's own startup code apply relocations on every execve'. Anyone reading this who knows Go's build modes would immediately notice the original 'dynamic linker side' phrasing was wrong. Wordcount 4443 -> 4469.","timestamp":1778320738277,"segment":6}
{"run":12,"commit":"0cdd01d","metric":0,"metrics":{"build_warnings":0,"wordcount_off":0,"vague_claims":0,"missing_code_paths":0,"unverified_snippets":0,"weak_snippets":0,"numbers_no_math":0,"tilde_no_math":0,"percent_no_math":0,"ratio_no_citation":0,"missing_citations":0,"marketing_words":0,"hedge_words":0,"placeholder_urls":0,"inconsistent_idents":0,"footnote_balance":0,"math_off":0,"dollar_no_math":0,"bad_anchors":0,"defaults_mismatch":0,"range_inverted":0,"unbacked_claims":0,"http_not_https":0,"heading_skip":0,"frontmatter":0,"wordcount":3912},"status":"keep","description":"Iter 12 (intellectual-honesty caveat — benchmark not worst-case). Reading the harness's `rand.Read(val)` line, the same value buffer is populated once and reused for ALL N writes. Default Badger compression is Snappy (per options.go:144 'Compression: options.Snappy'). When all blocks in an SST contain the same byte string, Snappy collapses each block to a back-reference, making the on-disk LSM dramatically smaller than `N × valSz` would predict. Concretely, my 10M × 128 B run shows L6 = '192 MiB of 192 MiB' for what should be ~1.28 GB of values (the compression ratio is 6.7×, which only happens because the values are identical). A real workload with varied 128-byte values would push more bytes through L0→Lbase and stall earlier than the table shows. Added a methodology paragraph caveat: 'value slice is populated once with rand.Read and reused across all writes, so default Snappy compression collapses every block — the on-disk LSM is much smaller than N × valSz would suggest. Real workloads with varied values flow more bytes through L0→Lbase compaction and stall earlier; the numbers below are a generous floor for \"small-value\" performance, not a worst-case.' This is the kind of disclosure the brief asks for ('honest about tradeoffs'). Wordcount 3847 → 3912. defects 0.","timestamp":1778320740186,"segment":6}
{"run":15,"commit":"c28d72e","metric":0,"metrics":{"build_warnings":0,"wordcount_off":0,"vague_claims":0,"missing_code_paths":0,"unverified_snippets":0,"weak_snippets":0,"numbers_no_math":0,"tilde_no_math":0,"percent_no_math":0,"ratio_no_citation":0,"missing_citations":0,"marketing_words":0,"hedge_words":0,"placeholder_urls":0,"inconsistent_idents":0,"footnote_balance":0,"math_off":0,"dollar_no_math":0,"bad_anchors":0,"frontmatter":0,"wordcount":4437},"status":"keep","description":"Iter 24 (closed last open polish item — §6 CockroachDB/Spanner comparison). Original framing: \"systems like CockroachDB or Spanner where the placement decision is continuous; Citus has explicit boundaries.\" Replaced the vague \"the placement decision is continuous\" with the actual terminology each system uses: \"CockroachDB calls them 'ranges' and rebalances them continuously across nodes; Spanner calls them 'splits' and the TabletServer/Spanner placement layer auto-redistributes.\" Reader who knows either system will recognize the terms. Also added the tradeoff bookend: \"fewer surprises on a quiet cluster, more operator work on a growing one\" — Citus' explicit shards have real upside in operational predictability. defects 0 → 0; wordcount 4401 → 4437.","timestamp":1778320750895,"segment":6}
{"run":14,"commit":"4c70af3","metric":0,"metrics":{"build_warnings":0,"wordcount_off":0,"vague_claims":0,"missing_code_paths":0,"unverified_snippets":0,"weak_snippets":0,"numbers_no_math":0,"tilde_no_math":0,"percent_no_math":0,"ratio_no_citation":0,"missing_citations":0,"marketing_words":0,"hedge_words":0,"placeholder_urls":0,"inconsistent_idents":0,"footnote_balance":0,"math_off":0,"dollar_no_math":0,"bad_anchors":0,"defaults_mismatch":0,"range_inverted":0,"unbacked_claims":0,"http_not_https":0,"heading_skip":0,"broken_post_links":0,"missing_sections":0,"bad_commit_refs":0,"dupe_words":0,"broken_rendered_links":0,"frontmatter":0,"wordcount":4360},"status":"keep","description":"Iter 13 (audit pass — major factual error fixed: Pebble default bloom filter). My post stated \"With 10 bits/key bloom defaults, false-positive rate ≈ 1%\". That was wrong by Pebble's actual default. Verified: `var NoFilterPolicy = base.NoFilterPolicy` (options.go:68) and `o.TableFilterPolicy = func() TableFilterPolicy { return NoFilterPolicy }` (options.go:497) — Pebble's out-of-the-box default is no bloom filter at any level. CockroachDB and other production users explicitly opt in via `bloom.FilterPolicy` from `sstable/tablefilters/bloom/`, typically at 10 bits/key. Updated to: \"Pebble's out-of-the-box default is actually `NoFilterPolicy`. CockroachDB and other production users opt in via bloom.FilterPolicy typically at 10 bits/key, which gives ~1% false-positive rate. Under that configuration a 5-level LSM decompresses ~1.05 blocks per Get on average\". Linked both the NoFilterPolicy line in options.go and the bloom package source. The downstream \"1 skiplist + N bloom probes + 1.05 block decompresses ≈ 4 µs napkin math\" claim is preserved with the correct caveat (it assumes the production-style 10-bits-per-key bloom is enabled, which is true for CockroachDB but not for a vanilla pebble.Open). Defects 0; wordcount 4328 → 4360.","timestamp":1778320771046,"segment":6}
