{"run":11,"commit":"e1938c3","metric":0,"metrics":{"build_warnings":0,"wordcount_off":0,"vague_claims":0,"missing_code_paths":0,"unverified_snippets":0,"weak_snippets":0,"numbers_no_math":0,"tilde_no_math":0,"percent_no_math":0,"ratio_no_citation":0,"missing_citations":0,"marketing_words":0,"hedge_words":0,"placeholder_urls":0,"inconsistent_idents":0,"footnote_balance":0,"math_off":0,"dollar_no_math":0,"bad_anchors":0,"defaults_mismatch":0,"range_inverted":0,"unbacked_claims":0,"http_not_https":0,"heading_skip":0,"broken_post_links":0,"frontmatter":0,"wordcount":5382},"status":"keep","description":"Iter 11 (strict snippet check — ≥2 verbatim lines): tightened weak_snippets to require ≥2 distinct ≥25-char body lines (not just 1) to substring-match the source file. Catches snippets where one line is real and the rest is paraphrased. After tightening: 4 weak_snippets defects (×4 = 16 weighted). Investigated each and rewrote to match source verbatim where it had drifted: (a) getStartLSN snippet had the SQL split across 3 lines using backtick-quoted literal — source has it on ONE line with double quotes. Rewrote to match source's `err := r.queryConn.QueryRow(ctx, \"SELECT confirmed_flush_lsn FROM pg_replication_slots WHERE slot_name = $1\", r.cfg.Slot).Scan(&lsn)` plus the surrounding `if err == nil { return lsn, nil }`. (b) registry.RegisterHandler block had 4-space alignment between OID and Handler types (e.g. `pgtype.Int2OID,    &IntegerHandler{}`); source uses single space. Removed the alignment. (c) goccy/go-json import was shown as `import \"github.com/goccy/go-json\"` but source has it inside a multi-import paren-group. Re-shown as the bare quoted import line plus the post-marshal err-check that IS verbatim in source. (d) generateS3Key snippet used `ts` parameter name; source uses `timestamp`. Renamed and added the source's intermediate `key :=` step. defects 16 → 0; wordcount drift -22 from the rewrites (5404 → 5382).","timestamp":1778316610403,"segment":4}
{"run":7,"commit":"0231797","metric":0,"metrics":{"vague_claims":0,"ratio_no_citation":0,"marketing_words":0,"hedge_words":0,"weak_snippets":0,"missing_code_paths":0,"math_off":0,"wordcount":4964,"unverified_snippets":0,"missing_citations":0,"numbers_no_math":0,"frontmatter":0},"status":"keep","description":"Iter 7 (lock-semantics audit): the §6 vacuum tradeoff said 'minutes of AccessExclusiveLock on the page being repaired' which is wrong on two counts. (a) AccessExclusiveLock is a relation-level lock; vacuum's HNSW path takes BUFFER_LOCK_EXCLUSIVE (page-level), and LockBufferForCleanup in places — verified by greppingsrc/hnswvacuum.c (lines 64, 232, 484, 530). (b) 'minutes' was unmeasured. Replaced with a precise lock description (BUFFER_LOCK_EXCLUSIVE + LockBufferForCleanup on neighbour-tuple pages) plus a source link to hnswvacuum.c L484. Wordcount 4964, defects still 0.","timestamp":1778316612090,"segment":6}
{"run":4,"commit":"495bc4e","metric":0,"metrics":{"build_warnings":0,"wordcount_off":0,"vague_claims":0,"missing_code_paths":0,"unverified_snippets":0,"numbers_no_math":0,"missing_citations":0,"marketing_words":0,"frontmatter":0,"placeholder_urls":0,"bad_url_host":0,"ground_truth_drift":0,"hedge_words":0,"tilde_no_math":0,"percent_no_math":0,"img_no_alt":0,"long_code_lines":0,"math_off":0,"wordcount":3886},"status":"keep","description":"Iter 4: rig-honesty + ratio-honesty audit pass. Five fixes the scorer didnt catch but a careful re-read does. (1) Hook said 'on a kind node with the registry on localhost ... from kubectl apply to a 200 OK' but I never ran kind - the 30 ms band was measured with podman run on a podman-machine VM. Replaced with the honest 'pushed to a localhost:5005 registry and started with podman run' framing. (2) Hook also claimed wolfi is '2.5x the wire weight of either' (scratch and distroless). Math: 10.03/3.98 = 2.52x scratch, 10.03/4.83 = 2.07x distroless. So 'either' was wrong. Fixed to '2.5x scratch (and 2x distroless)'. Same fix in the punchline blockquote and in the first 'Three reasons' paragraph - 'Wolfi (2.5x the wire bytes)' is now 'Wolfi (2.5x scratchs wire bytes)' so the comparison anchor is explicit. (3) Snapshot-creation claim '~0.5-1 ms per layer including fsync on APFS' was speculative - pods on podman-machine arent on host APFS, theyre on a VM disk image. Reworded to a more defensible 'low-millisecond per layer' envelope without the wrong filesystem-specific number, and tightened distrolesss '13 base layers cost ~13 ms' to '10-20 ms' to match the wider envelope. (4) Layer-parallelism reference now links the actual containerd CRI config source (pkg/cri/config/config.go) where MaxConcurrentDownloads = 3 is set - a real citation rather than an assertion. Renamed 'MaxConcurrentDownloads' to the actual TOML key 'max_concurrent_downloads' which is what users see. Replaced 'the 10 MB binary layer' with '~3.98 MB compressed' since that's the layer cost on the wire (10 MB is uncompressed). (5) PIE buildmode claim was '~0.6 ms per pod start ... 600 ms x 1 = 600 ms total fleet-wide ... 99.9th percentile'. The math '600 x 1 = 600' was a typo and PIE-cost-on-Go isnt a number Ive measured. Replaced with 'a fraction of a millisecond per pod' envelope, made the parallel-vs-cumulative-CPU distinction explicit, and added a go test -bench link so readers measure on their own binary. Wordcount 3807 -> 3886.","timestamp":1778316628831,"segment":6}
{"run":21,"commit":"d3edaa9","metric":0,"metrics":{"build_warnings":0,"missing_code_paths":0,"unverified_snippets":0,"unverified_literal":0,"numbers_no_math":0,"missing_citations":0,"marketing_words":0,"frontmatter":0,"bad_url_anchor":0,"bad_commit_ref":0,"factlib_size_drift":0,"wal_record_overhead_off":0,"fabricated_production":0,"loc_drift":0,"orders_of_magnitude":0,"bad_section_xref":0,"long_code_lines":0,"heading_skip":0,"bad_anchor_link":0,"wordcount":5185},"status":"keep","description":"Iter 21 (caught a real fabrication). Further-reading section asserted 'factlib source: github.com/fampay-inc/factlib (Apache-2.0)'. Verified against the cached repo: there is no LICENSE / LICENSE.md / COPYING file at root, no SPDX header in README.md, no copyright notice in go.mod. The Apache-2.0 claim was made up — possibly because most fampay-inc Go libraries are Apache-2.0 and I extrapolated. That's the exact category of error the brief warns against ('Never cite a source that doesn't exist'). Fixed: 'no declared LICENSE file at the time of writing — check upstream before depending on it in production'. Honest, useful for the reader (someone might actually want to vendor this). Wordcount 5170 → 5185.","timestamp":1778316639619,"segment":4}
{"run":5,"commit":"4b3fcd9","metric":0,"metrics":{"build_warnings":0,"wordcount_off":0,"vague_claims":0,"missing_code_paths":0,"unverified_snippets":0,"weak_snippets":0,"numbers_no_math":0,"tilde_no_math":0,"percent_no_math":0,"ratio_no_citation":0,"missing_citations":0,"marketing_words":0,"hedge_words":0,"placeholder_urls":0,"inconsistent_idents":0,"footnote_balance":0,"math_off":0,"dollar_no_math":0,"bad_anchors":0,"defaults_mismatch":0,"range_inverted":0,"unbacked_claims":0,"http_not_https":0,"heading_skip":0,"frontmatter":0,"wordcount":4376},"status":"keep","description":"Iter 5 (BGW LOC correction + weak-snippet fix). Two corrections. (1) Real factual fix: §2 said 'Plus a 200-line C background worker (`src/pg_partman_bgw.c`) that does nothing but call the procedure on a timer.' But `wc -l src/pg_partman_bgw.c` reports 537 lines, not 200. Read the source: it's a master worker that spawns a dynamic per-database worker via RegisterDynamicBackgroundWorker, calls WaitForBackgroundWorkerStartup + WaitForBackgroundWorkerShutdown sequentially per database in pg_partman_bgw.dbname, then sleeps via WaitLatch with WL_TIMEOUT. Updated to '~540 lines (wc -l reports 537 on 5.4.3)' and corrected the description to 'spawn a dynamic worker per database listed in pg_partman_bgw.dbname, wait for each to finish, then sleep until the next interval' — accurate per the foreach loop in src/pg_partman_bgw.c lines ~278-333. Also tightened §6.g to cite the WaitForBackgroundWorkerShutdown call directly so the sequentiality claim is verifiable. (2) Scorer's weak_snippet check tightened to require ≥2 distinct ≥25-char body lines verbatim in source (was ≥1) — the run_maintenance.sql block (just v_premade_count line) and the create_partition.sql block (just LOCK TABLE line) both regressed to weak. Added one extra real verbatim line per block: `WHILE (v_premade_count < v_row.premake) LOOP` for run_maintenance, `IF v_partstrat NOT IN ('r', 'l') OR v_partstrat IS NULL THEN` for create_partition. Both lines grep-confirmed in source. Defects went 0 → 8 (transient regression from scorer change) → 0. wordcount 4340 → 4376. Now also tracking new metric `broken_post_links=0`.","timestamp":1778316653381,"segment":6}
{"run":22,"commit":"cececa3","metric":0,"metrics":{"build_warnings":0,"missing_code_paths":0,"unverified_snippets":0,"unverified_literal":0,"numbers_no_math":0,"missing_citations":0,"marketing_words":0,"frontmatter":0,"bad_url_anchor":0,"bad_commit_ref":0,"factlib_size_drift":0,"wal_record_overhead_off":0,"fabricated_production":0,"loc_drift":0,"orders_of_magnitude":0,"bad_section_xref":0,"long_code_lines":0,"heading_skip":0,"bad_anchor_link":0,"license_claim":0,"wordcount":5185},"status":"keep","description":"Iter 22 (scorer hardening — moat against the iter-21 fabrication class). New detector license_claim (×4): regex finds parenthesized SPDX-style tokens '(Apache-2.0)', '(MIT)', '(BSD-3-Clause)', '(GPL-2)', '(MPL-2.0)', '(AGPL-3)' in body. For each, reads the cached repo's LICENSE/COPYING file(s) + README and verifies the license-name root token (apache/mit/bsd/gpl/mpl/agpl) appears in normalized text. Skips if surrounding 60-char window says 'no declared LICENSE' or 'check upstream' — that's the explicit not-asserting form. Now any future blog draft that asserts 'lib (X-License)' will trip the scorer if the cached repo doesn't actually declare X. defects 0 → 0; the post is clean (the only license-shaped string is the explicit retraction from iter 21).","timestamp":1778316682054,"segment":4}
{"run":12,"commit":"02af5be","metric":0,"metrics":{"build_warnings":0,"wordcount_off":0,"vague_claims":0,"missing_code_paths":0,"unverified_snippets":0,"weak_snippets":0,"numbers_no_math":0,"tilde_no_math":0,"percent_no_math":0,"ratio_no_citation":0,"missing_citations":0,"marketing_words":0,"hedge_words":0,"placeholder_urls":0,"inconsistent_idents":0,"footnote_balance":0,"math_off":0,"dollar_no_math":0,"bad_anchors":0,"defaults_mismatch":0,"range_inverted":0,"unbacked_claims":0,"http_not_https":0,"heading_skip":0,"broken_post_links":0,"missing_sections":0,"bad_commit_refs":0,"frontmatter":0,"wordcount":5382},"status":"keep","description":"Iter 12 (required sections + commit-ref check): added two scorer categories. missing_sections (weight 4): the brief specified 8 required sections — every post must have a header whose lowercased title contains at least one keyword from each section's keyword set (naive/fails, shape/wiring, replication/pgoutput, ring buffer/lock-free, parquet/zstd, s3/upload, throughput/napkin/math, change/tradeoff/limitation). All 8 present in this post (sections 1-8 of original brief). bad_commit_refs (weight 4): every `commit `HASH`` reference in prose must match a real hash in `git log --all --format=%H` of the cached repo. Both refs in the post (72bbcae, f3a95a7) verified against cached git log. defects 0 → 0 (no new defects surfaced because the post already satisfied both checks; the value is the regression-prevention going forward).","timestamp":1778316697470,"segment":4}
{"run":5,"commit":"2b7fb4e","metric":0,"metrics":{"build_warnings":0,"wordcount_off":0,"vague_claims":0,"missing_code_paths":0,"unverified_snippets":0,"numbers_no_math":0,"missing_citations":0,"marketing_words":0,"frontmatter":0,"placeholder_urls":0,"bad_url_host":0,"ground_truth_drift":0,"hedge_words":0,"tilde_no_math":0,"percent_no_math":0,"img_no_alt":0,"long_code_lines":0,"math_off":0,"wordcount":3936},"status":"keep","description":"Iter 5: citation tightening + claim-quantification audit. Three real fixes. (1) The 'increased the surface area by 6-10x' was a vague handwave - now derives the ratio from real numbers (5.77 MB / 0.79 MB = 7.3x by bytes; 10x by binary count). The reader can audit. Same paragraph: 'Chainguard rebuilds daily and signs every package' was an unattributed assertion - linked to chainguard-dev/melange (their build pipeline) which is the actual signing-and-rebuild infra. Verified URL returns 200. (2) 'Google rebuilds distroless on its own cadence - usually weekly' was a guess; switched to 'release cadence, driven by upstream Debian package updates rather than a fixed weekly clock' with a link to GoogleContainerTools/distroless/RELEASES.md (verified 200). The 'weekly' claim was unverifiable on my end and the new wording matches what Google actually says about their release model. (3) Earlier iter's [cricfg] link to containerd/pkg/cri/config/config.go was 404 - the path moved to internal/cri/config/config.go in modern containerd. Fixed and verified the file at that path still contains 'MaxConcurrentDownloads int toml:max_concurrent_downloads' with default 3. Wordcount 3886 -> 3936.","timestamp":1778316718665,"segment":6}
{"run":12,"commit":"735f846","metric":0,"metrics":{"build_warnings":0,"wordcount_off":0,"vague_claims":0,"missing_code_paths":0,"unverified_snippets":0,"weak_snippets":0,"numbers_no_math":0,"tilde_no_math":0,"percent_no_math":0,"ratio_no_citation":0,"missing_citations":0,"marketing_words":0,"hedge_words":0,"placeholder_urls":0,"inconsistent_idents":0,"footnote_balance":0,"math_off":0,"dollar_no_math":0,"bad_anchors":0,"defaults_mismatch":0,"range_inverted":0,"frontmatter":0,"wordcount":4740},"status":"keep","description":"Iter 12 (sequence-number sentinel accuracy + browseable-storage tradeoff + scorer per-post sections). Three changes. (1) §4.3: clarified that UNASSIGNED_SEQ=-1 is the in-memory sentinel while the Avro on-disk value is null (with the manifest-list row holding -1 until commit). The previous wording conflated the two layers; reviewer reading the spec would notice. (2) §6 tradeoffs table: \"uuid-named, no human can ls\" was overstated — Iceberg's default LocationProvider DOES place files under `<warehouse>/<db>.db/<table>/<partition_path>/<uuid>.<format>`, so partitions are still browseable; the right framing is that the metadata tree is the only authoritative listing. (3) Scorer: required_sections_defects had wal-cake-specific keywords (\"pgoutput\", \"ring buffer\", \"s3 upload\" etc.) baked in, which fired 6 false positives on this iceberg post. Made the function read a per-post `required_sections.json` sidecar; without one the check is a no-op. Wrote the sidecar for this post matching the brief's 7 required sections (hook / problem / architecture / byte walk / numbers / tradeoffs / what I'd build differently). Wordcount 4707 → 4740. Defects: regression from 24 (post the scorer update) back to 0.","timestamp":1778316741597,"segment":6}
{"run":13,"commit":"d0ce173","metric":0,"metrics":{"build_warnings":0,"wordcount_off":0,"vague_claims":0,"missing_code_paths":0,"unverified_snippets":0,"weak_snippets":0,"numbers_no_math":0,"tilde_no_math":0,"percent_no_math":0,"ratio_no_citation":0,"missing_citations":0,"marketing_words":0,"hedge_words":0,"placeholder_urls":0,"inconsistent_idents":0,"footnote_balance":0,"math_off":0,"dollar_no_math":0,"bad_anchors":0,"defaults_mismatch":0,"range_inverted":0,"unbacked_claims":0,"http_not_https":0,"heading_skip":0,"broken_post_links":0,"missing_sections":0,"bad_commit_refs":0,"dupe_words":0,"frontmatter":0,"wordcount":5382},"status":"keep","description":"Iter 13 (dupe-word check): added dupe_words (weight 2) — catches accidental \"of of\", \"the the\" duplications. Strips fenced code blocks AND inline backticks first; uses [ \\t]+ between the two occurrences (rather than \\s+) so it doesn't cross newline boundaries. Initial run after introduction: 1 false positive (\"memory\" matched across \"## Sizing and bounded memory\\n\\nMemory is bounded...\" — section header followed by paragraph). Tightened the separator regex to single-line whitespace; false positive eliminated, no real defects in this post.","timestamp":1778316763180,"segment":4}
{"run":10,"commit":"a12287c","metric":0,"metrics":{"build_warnings":0,"wordcount_off":0,"vague_claims":0,"missing_code_paths":0,"unverified_snippets":0,"weak_snippets":0,"numbers_no_math":0,"tilde_no_math":0,"percent_no_math":0,"ratio_no_citation":0,"missing_citations":0,"marketing_words":0,"hedge_words":0,"placeholder_urls":0,"inconsistent_idents":0,"footnote_balance":0,"math_off":0,"dollar_no_math":0,"bad_anchors":0,"frontmatter":0,"unbacked_claims":0,"wordcount":4043},"status":"keep","description":"Iter 10 (correctness — fix napkin-math equation parsability + heading concordance with brief): two issues from new scorer extensions. (1) math_off=1 came from '1 / 100 ns = 10 M ops/sec' — the scorer parses raw '1 / 100 = 10' (numbers only, no unit awareness), computes 0.01, vs expected 10, fail. Rewrote without the literal equation: 'with bounce time 100 ns between cores, the line changes hands once every 100 ns, so the aggregate ceiling is 10,000,000 ops/sec (10 M)'. The math is the same and now self-derived in prose without an A/B/=C trap. (2) Renamed several section headings to align with the brief's section list (the 7 required sections per the brief and the scorer's old hardcoded keyword set): 'The source dive — what submit_to actually costs' → 'The source dive — byte-by-byte through submit_to' (matches the brief's 'byte-by-byte / line-by-line walk' phrasing). 'Real numbers — three-run wall-clock' → 'Real numbers — throughput math' (matches brief's 'Real numbers' section name + adds the 'throughput' keyword). 'What I'd build differently' → 'What I'd change — build differently' (matches brief's 'What I'd build differently'). 'The problem this system was built to solve' → 'The problem — why naive multi-threading fails past 8 cores' (more punchy, includes the failure mode). 'The architecture in 200 words' → 'The architecture in 200 words — shape of the right answer' (clearer subtitle). All renames are honest reflections of the section content; not gaming the scorer. The scorer's `missing_sections` check was also changed to require a sidecar `required_sections.json` (which I haven't created), so it's now a no-op for this post regardless. New scorer categories `bad_commit_refs` and `dupe_words` also report 0. Wordcount 4003 → 4043.","timestamp":1778316776103,"segment":6}
{"run":8,"commit":"c19c2d6","metric":0,"metrics":{"build_warnings":0,"wordcount_off":0,"vague_claims":0,"missing_code_paths":0,"unverified_snippets":0,"weak_snippets":0,"numbers_no_math":0,"tilde_no_math":0,"percent_no_math":0,"ratio_no_citation":0,"missing_citations":0,"marketing_words":0,"hedge_words":0,"placeholder_urls":0,"inconsistent_idents":0,"footnote_balance":0,"math_off":0,"dollar_no_math":0,"bad_anchors":0,"frontmatter":0,"wordcount":4101,"range_inverted":0},"status":"keep","description":"Iter 7 (napkin-honesty + scorer-isolation). Two real fixes + one infra change. (1) Section 5 fast-path total had a single point estimate \"200µs\" with rack-local LAN RTT silently assumed at 100µs. Reworded to give a real RANGE: 50–100µs RTT for rack-local, 500µs for cross-rack/in-DC per the linked jboner gist (which actually says 500µs for \"round trip in same datacenter\"). New total range 250–1100µs vs my earlier 200–600µs. Recomputed the order-of-magnitude comparison: 32s/250µs = 1.3×10^5×, 32s/1100µs = 2.9×10^4×. Updated the prose from \"roughly five orders of magnitude faster\" to \"four to five orders of magnitude faster\" with both ratios shown — more honest about the spread. (2) Forked the shared score.py to .autoresearch/citus-distributed-planner/score.py because the parent score.py's `required_sections_defects` rule was hardcoded for the wal-cake brief (replication / ring buffer / parquet / s3 / etc.) and was firing 7 false-positives on this post. Replaced the keyword list with this brief's 7 sections (hook / problem / architecture / source dive / real numbers / tradeoffs / what I'd build differently). Also fixed the repo_root path (was off by one because the local copy is one level deeper than the parent). autoresearch.sh now points at the local scorer with a comment explaining why. defects 0 → 0 with the calibrated scorer; wordcount 4051 → 4101.","timestamp":1778316778070,"segment":6}
