{"run":21,"commit":"1bc28e3","metric":0,"metrics":{"build_warnings":0,"wordcount_off":0,"vague_claims":0,"missing_code_paths":0,"unverified_snippets":0,"numbers_no_math":0,"missing_citations":0,"marketing_words":0,"frontmatter":0,"placeholder_urls":0,"bad_url_host":0,"ground_truth_drift":0,"hedge_words":0,"tilde_no_math":0,"percent_no_math":0,"img_no_alt":0,"long_code_lines":0,"math_off":0,"wordcount":4478},"status":"keep","description":"Iter 21: tightened the distroless-CVE-response advice. The earlier wording said 'the SLA window for pushing a new image is however long Googles distroless rebuild takes' - this overstates the constraint. Engineers can do a FROM gcr.io/distroless/static + COPY new-ca.crt /usr/local/share/ca-certificates/ overlay in their own Dockerfile and rebuild in seconds; they dont have to wait on upstream. Reworded to give the actual fastest path and surface that distroless is overlay-friendly even without apk. Wordcount 4469 -> 4478.","timestamp":1778320772744,"segment":6}
{"run":39,"commit":"1ad5a3a","metric":0,"metrics":{"build_warnings":0,"wordcount_off":0,"vague_claims":0,"missing_code_paths":0,"unverified_snippets":0,"weak_snippets":0,"numbers_no_math":0,"tilde_no_math":0,"percent_no_math":0,"ratio_no_citation":0,"missing_citations":0,"marketing_words":0,"hedge_words":0,"placeholder_urls":0,"inconsistent_idents":0,"footnote_balance":0,"math_off":0,"dollar_no_math":0,"bad_anchors":0,"defaults_mismatch":0,"range_inverted":0,"frontmatter":0,"wordcount":4956},"status":"keep","description":"Iter 39 (strace command syntax). Real fix: §5.2's strace one-liner had two cosmetic issues. (a) \"-e signal=none\" is not valid strace syntax — the correct way to drop signals is to NOT include them in -e trace= (which only enables specific syscalls). The bogus flag would error on a real strace invocation. Removed. (b) \"read\" was in -e trace= but a single read() call from a manifest is not the interesting event — the openat() that the kernel makes when fastavro touches the file is. Trimmed to \"openat,connect\" which is enough to see file accesses + network connections. The simplified one-liner now actually runs. No prose word change. Defects 0.","timestamp":1778320772818,"segment":6}
{"run":32,"commit":"0bddb2a","metric":0,"metrics":{"build_warnings":0,"wordcount_off":0,"vague_claims":0,"missing_code_paths":0,"unverified_snippets":0,"weak_snippets":0,"numbers_no_math":0,"tilde_no_math":0,"percent_no_math":0,"ratio_no_citation":0,"missing_citations":0,"marketing_words":0,"hedge_words":0,"placeholder_urls":0,"inconsistent_idents":0,"footnote_balance":0,"math_off":0,"dollar_no_math":0,"bad_anchors":0,"defaults_mismatch":0,"range_inverted":0,"unbacked_claims":0,"http_not_https":0,"heading_skip":0,"broken_post_links":0,"missing_sections":0,"bad_commit_refs":0,"dupe_words":0,"broken_rendered_links":0,"loc_drift":0,"frontmatter":0,"wordcount":5490},"status":"keep","description":"Iter 32 (S3-key/LSN drift correction): the §3 outro claimed \"Every CDC event downstream — every Parquet row, every S3 object key — eventually points back to one of these xLogPos values.\" That overclaims about S3 keys: S3 keys are derived from the event Timestamp (UnixMicro), NOT from LSN. The Parquet `lsn` column does carry the LSN, but the S3 key uses time. Rewrote: \"stored as lastEvent.LSN, written into the Parquet `lsn` column, and once the batch is durable on S3 fed back to Postgres as confirmed_flush_lsn via StandbyStatusUpdate.\" Now traces only places the LSN actually flows. The first version of the rewrite used `CDCEvent.LSN` which the inconsistent_idents check flagged (source has `lastEvent.LSN`, `events[i].LSN`, never the literal `CDCEvent.LSN`). Used `lastEvent.LSN` instead — verbatim from ring_buffer.go's handleSegmentAck. defects 4 → 0; wordcount 5494 → 5490.","timestamp":1778320779113,"segment":4}
{"run":27,"commit":"5ffcf50","metric":0,"metrics":{"vague_claims":0,"ratio_no_citation":0,"marketing_words":0,"hedge_words":0,"weak_snippets":0,"missing_code_paths":0,"math_off":0,"wordcount":5239,"unverified_snippets":0,"missing_citations":0,"numbers_no_math":0,"frontmatter":0},"status":"keep","description":"Iter 27 (line-count precision). My §4.1 said 'GetScanItems is the entire algorithm in 30 lines'. Verified by `awk '/^GetScanItems\\(/,/^}$/' src/hnswscan.c | wc -l` → 31 lines. Updated to 31 with the verifying awk command inline so readers can reproduce. Defects 0; wordcount 5239.","timestamp":1778320785356,"segment":6}
{"run":16,"commit":"4d22b87","metric":0,"metrics":{"build_warnings":0,"wordcount_off":0,"vague_claims":0,"missing_code_paths":0,"unverified_snippets":0,"weak_snippets":0,"numbers_no_math":0,"tilde_no_math":0,"percent_no_math":0,"ratio_no_citation":0,"missing_citations":0,"marketing_words":0,"hedge_words":0,"placeholder_urls":0,"inconsistent_idents":0,"footnote_balance":0,"math_off":0,"dollar_no_math":0,"bad_anchors":0,"frontmatter":0,"wordcount":4449},"status":"keep","description":"Iter 25 (one more honesty pass on Further-reading section). The post claimed \"Section 4.1 covers the planner\" of the SIGMOD '21 Citus paper — but I haven't actually opened that PDF locally. The DOI is verified (it matches what citus README links to), but the specific section number was a guess. Reworded to be honest about the source: cited from the repo's own README, paper covers planner architecture with figures useful as complements. Reader can find the exact section themselves; I don't pretend to have read it. defects 0 → 0; wordcount 4437 → 4449.","timestamp":1778320792059,"segment":6}
{"run":12,"commit":"2222ae3","metric":0,"metrics":{"build_warnings":0,"wordcount_off":0,"missing_code_paths":0,"weak_snippets":0,"numbers_no_math":0,"percent_no_math":0,"hedge_words":0,"placeholder_urls":0,"inconsistent_idents":0,"unbacked_claims":0,"broken_post_links":0,"wordcount":4318},"status":"keep","description":"Iter 11 (the 50-line demo snippet did not actually compile). Real bug, the metric had no way to catch it. After the gogoproto.nullable removal in commit 26c2367, pb.Message fields are now pointers (From, To, Type all *T). The snippet wrote pb.Message{From: 1, To: 1, Type: pb.MsgHup} which fails type-check (cannot use 1 as pointer, etc.). Verified by copying the snippet into a /tmp checkout of etcd-io raft, running go test, getting two compile errors. Fixed in the post by introducing addressable local vars from, to, hup and passing &from, &to, &hup. Re-ran in /tmp - test now passes (node 1 StateLeader term 1 lastIndex 1, others StateFollower). Added a parenthetical in the snippet pointing at commit 26c2367 so a future reader has the context for the otherwise weird local-pointer dance. Defects 0; wordcount 4292 to 4318.","timestamp":1778320793589,"segment":6}
{"run":33,"commit":"8be6423","metric":0,"metrics":{"build_warnings":0,"wordcount_off":0,"vague_claims":0,"missing_code_paths":0,"unverified_snippets":0,"weak_snippets":0,"numbers_no_math":0,"tilde_no_math":0,"percent_no_math":0,"ratio_no_citation":0,"missing_citations":0,"marketing_words":0,"hedge_words":0,"placeholder_urls":0,"inconsistent_idents":0,"footnote_balance":0,"math_off":0,"dollar_no_math":0,"bad_anchors":0,"frontmatter":0,"unbacked_claims":0,"wordcount":4428},"status":"keep","description":"Iter 33 (specificity — name what makes WithLabelValues expensive). Two small fixes to the mutex paragraph. (1) Cosmetic: 'derivable from the table:55.3 / 11.3 ≈ 4.9' had no space between table: and the backticked formula. Now reads 'derivable from the table as 55.3 / 11.3 ≈ 4.9'. (2) Substantive: my claim 'This is what your idiomatic Go service is doing every time it calls metrics.WithLabelValues(...).Inc() in a hot handler' was vague — readers might not know WHY metrics.WithLabelValues is mutex-bound. Added 'the labels-map lookup grabs an internal sync.RWMutex' (true: prometheus client_golang's MetricVec.GetMetricWithLabelValues takes an RWMutex during the labels-to-metric map lookup). Reader now knows the actual mechanism, can verify in the prometheus client_golang source. wordcount 4419 to 4428.","timestamp":1778320799715,"segment":6}
{"run":40,"commit":"480c3cb","metric":0,"metrics":{"build_warnings":0,"wordcount_off":0,"vague_claims":0,"missing_code_paths":0,"unverified_snippets":0,"weak_snippets":0,"numbers_no_math":0,"tilde_no_math":0,"percent_no_math":0,"ratio_no_citation":0,"missing_citations":0,"marketing_words":0,"hedge_words":0,"placeholder_urls":0,"inconsistent_idents":0,"footnote_balance":0,"math_off":0,"dollar_no_math":0,"bad_anchors":0,"defaults_mismatch":0,"range_inverted":0,"frontmatter":0,"wordcount":4955},"status":"keep","description":"Iter 40 (target-vs-actual manifest size accuracy). Real fix: §1 hook said \"A manifest file in Iceberg defaults to 8 MiB\" but the constant is MANIFEST_TARGET_SIZE_BYTES_DEFAULT — a *target* used by the merge manager, not a fixed actual size. Iter 32 measured a real manifest at 4,285 bytes for a tiny insert (3 orders of magnitude below the target). Reframed as \"Iceberg's target manifest size is 8 MiB\" + \"The target is set at MANIFEST_TARGET_SIZE_BYTES_DEFAULT...\" — accurate to the constant's meaning. Reader who runs the §5 reproducer and sees a 4 KB manifest now does not contradict §1. Wordcount 4956 → 4955. Defects 0.","timestamp":1778320806887,"segment":6}
{"run":28,"commit":"83e9553","metric":0,"metrics":{"vague_claims":0,"ratio_no_citation":0,"marketing_words":0,"hedge_words":0,"weak_snippets":0,"missing_code_paths":0,"math_off":0,"wordcount":5247,"unverified_snippets":0,"missing_citations":0,"numbers_no_math":0,"frontmatter":0},"status":"keep","description":"Iter 28 (distance-function precision in §1). I had 'the hot path is bounded by random buffer reads, SIMD inner-product over a few hundred floats'. Wrong specificity: pgvector dispatches between L2/inner-product/cosine via the operator class, and my benchmark uses L2 (vector_l2_ops), not inner product. Reworded to 'SIMD distance computation over a few hundred floats (L2, inner product, or cosine — operator-class dispatched)' so the hook accurately describes the AM rather than overspecifying the operation. Wordcount 5247; defects 0.","timestamp":1778320812374,"segment":6}
{"run":22,"commit":"1ff0904","metric":0,"metrics":{"build_warnings":0,"wordcount_off":0,"vague_claims":0,"missing_code_paths":0,"unverified_snippets":0,"numbers_no_math":0,"missing_citations":0,"marketing_words":0,"frontmatter":0,"placeholder_urls":0,"bad_url_host":0,"ground_truth_drift":0,"hedge_words":0,"tilde_no_math":0,"percent_no_math":0,"img_no_alt":0,"long_code_lines":0,"math_off":0,"wordcount":4486},"status":"keep","description":"Iter 22: consistency fix - removed the ~30 ms napkin claim from the post-repro paragraph (mirroring iter-19's colophon fix). The earlier wording 'On Linux x86 you'll see the runtime overhead drop from ~200 ms to ~30 ms' had a specific number I never measured. Replaced with 'typically much lower than the ~200 ms we measured here' which is honest about what's measured (the 200 ms here is real) vs what's a defensible directional claim (lower is real, the exact value is rig-dependent). Wordcount 4478 -> 4486.","timestamp":1778320817648,"segment":6}
{"run":15,"commit":"4331ba1","metric":0,"metrics":{"build_warnings":0,"wordcount_off":0,"vague_claims":0,"missing_code_paths":0,"unverified_snippets":0,"weak_snippets":0,"numbers_no_math":0,"tilde_no_math":0,"percent_no_math":0,"ratio_no_citation":0,"missing_citations":0,"marketing_words":0,"hedge_words":0,"placeholder_urls":0,"inconsistent_idents":0,"footnote_balance":0,"math_off":0,"dollar_no_math":0,"bad_anchors":0,"defaults_mismatch":0,"range_inverted":0,"unbacked_claims":0,"http_not_https":0,"heading_skip":0,"broken_post_links":0,"missing_sections":0,"bad_commit_refs":0,"dupe_words":0,"broken_rendered_links":0,"frontmatter":0,"wordcount":4420},"status":"keep","description":"Iter 14 (audit pass — Pebble read-path math made consistent with iter 13's bloom fix). After iter 13 corrected \"10 bits/key bloom default\" to \"no bloom by default\", §5.1's napkin math `5 × ~200 ns/bloom + 1 × ~3 µs/decompress ≈ 4 µs ≈ measured` was inconsistent — my benchmark used vanilla `&pebble.Options{}` so there were NO bloom probes; the math should reflect that. Reworked the paragraph: (1) noted my benchmark left NoFilterPolicy in place; (2) the 40 MiB payload spread across ~10 memtable flushes (4-MiB default), leaving ~3 sstables in L0 + partial L1 when reads started; (3) every Get touches ~5 sstables × (index-block lookup + data-block lookup) ≈ 5 × (~500 ns + ~500 ns) ≈ 5 µs, which matches the measured 5.4 µs p50 (without invoking a bloom filter that wasn't there). (4) Added a \"with 10 bits/key bloom enabled this drops to ~1.05 block fetches per Get\" note so the original LSM-read-amp lesson survives. Now §5.1's math is internally consistent with §4.3's NoFilterPolicy disclosure. Wordcount 4360 → 4420.","timestamp":1778320824925,"segment":6}
{"run":7,"commit":"ae27cac","metric":0,"metrics":{"build_warnings":0,"wordcount_off":0,"vague_claims":0,"missing_code_paths":0,"unverified_snippets":0,"weak_snippets":0,"numbers_no_math":0,"tilde_no_math":0,"percent_no_math":0,"ratio_no_citation":0,"missing_citations":0,"marketing_words":0,"hedge_words":0,"placeholder_urls":0,"inconsistent_idents":0,"footnote_balance":0,"math_off":0,"dollar_no_math":0,"bad_anchors":0,"defaults_mismatch":0,"range_inverted":0,"unbacked_claims":0,"http_not_https":0,"heading_skip":0,"broken_post_links":0,"missing_sections":0,"bad_commit_refs":0,"dupe_words":0,"broken_rendered_links":0,"loc_drift":0,"frontmatter":0,"wordcount":3803},"status":"keep","description":"Iter 7 (HW-precise cache + branch-mispredict numbers from sysctl): 0 defects held. Two real corrections. (1) Replaced the dead Anandtech M1 article URL (anandtech.com 301 redirects to a forum because Anandtech wound down in 2024) with the live https://www.7-cpu.com/cpu/Apple_M1.html microbench page, which is the canonical CPU-mech reference for the 13-cycle Firestorm branch mispredict penalty. (2) Verified the actual hardware via `sysctl hw.perflevel0` on this M3 Max: 10 P-cores in 2 clusters of 5 each, 16 MB L2 per cluster (so 16/5 = 3.2 MB per active P-core thread, NOT 4 MB and not 16 MB — both my earlier numbers were wrong). Cache line is 128 B (Apple Silicon, not x86's 64 B). Updated the L2-budget paragraph with the exact `16 / 5 ≈ 3.2 MB` derivation. Branch-mispredict cost: at M3 Max P-core's 4.05 GHz, 13 cycles = 3.2 ns plus iFetch refill + dependent load ≈ 5 ns end-to-end — so 180M × 5 = 900 ms of dispatch tax (was 1.8 s using a too-pessimistic 10 ns). The 900 ms napkin still dominates the Q01 SF=10 11.7 s wall clock as a floor, just by less than I claimed. Wordcount 3769 → 3803.","timestamp":1778320832457,"segment":6}
{"run":13,"commit":"857ed46","metric":0,"metrics":{"build_warnings":0,"wordcount_off":0,"missing_code_paths":0,"weak_snippets":0,"numbers_no_math":0,"percent_no_math":0,"hedge_words":0,"placeholder_urls":0,"inconsistent_idents":0,"unbacked_claims":0,"broken_post_links":0,"wordcount":4322},"status":"keep","description":"Iter 12 (broken TLA+ link). The architecture section linked to https://github.com/etcd-io/raft/blob/main/tla/raft.tla but that file does not exist - the actual files in cached_repo/tla/ are etcdraft.tla (the model) and Traceetcdraft.tla (the trace harness). 404 link in published post would be a real reader-facing bug. Fixed by pointing at Traceetcdraft.tla and naming both files in prose so the reader knows what to open. Also more accurate: TLA+ trace validation specifically refers to the trace-harness file, not the bare model. Defects 0; wordcount 4318 to 4322.","timestamp":1778320833474,"segment":6}
{"run":41,"commit":"9c75c09","metric":0,"metrics":{"build_warnings":0,"wordcount_off":0,"vague_claims":0,"missing_code_paths":0,"unverified_snippets":0,"weak_snippets":0,"numbers_no_math":0,"tilde_no_math":0,"percent_no_math":0,"ratio_no_citation":0,"missing_citations":0,"marketing_words":0,"hedge_words":0,"placeholder_urls":0,"inconsistent_idents":0,"footnote_balance":0,"math_off":0,"dollar_no_math":0,"bad_anchors":0,"defaults_mismatch":0,"range_inverted":0,"frontmatter":0,"wordcount":4963},"status":"keep","description":"Iter 41 (latency-claim consistency in §7). The §7 manifest-list-in-catalog suggestion said \"30 ms median in same-region EC2 measurements\" — but §5.1 was deliberately calibrated to call 30 ms a *lower bound* (warm connection) with the AWS-published 100–200 ms first-byte being the realistic P50 for small objects. The §7 line was therefore claiming a measurement §5.1 was already explicitly hedging. Reframed §7 to mirror §5.1's two-number framing: \"the warm-connection lower bound from §5.1, ~30 ms; the realistic P50 closer to the AWS-published 100–200 ms for small-object GETs.\" Reader who notices the discrepancy between sections is now told the same story twice. Wordcount 4955 → 4963. Defects 0.","timestamp":1778320871500,"segment":6}
{"run":23,"commit":"3e0f131","metric":0,"metrics":{"build_warnings":0,"wordcount_off":0,"vague_claims":0,"missing_code_paths":0,"unverified_snippets":0,"numbers_no_math":0,"missing_citations":0,"marketing_words":0,"frontmatter":0,"placeholder_urls":0,"bad_url_host":0,"ground_truth_drift":0,"hedge_words":0,"tilde_no_math":0,"percent_no_math":0,"img_no_alt":0,"long_code_lines":0,"math_off":0,"wordcount":4547},"status":"keep","description":"Iter 23: range correctness across the post. The post used 17-32 ms in three places ('the Go runtime starts in 17-32 ms inside any of these three images', the table-lead-in, and the runtime ratio). 17-32 was actually distroless's range; the full envelope across all three images was 17-56 ms (one scratch run hit 56 ms). Updated the blockquote to '17-56 ms inside any of these three images (median ~20 ms; one scratch run hit 56 ms as an outlier)'. Updated the table lead-in to '17-56 ms' with a clearer parenthetical on what the 523 microsecond zap measurement actually captures (Go init + main user-code, NOT the listener bind). Updated the punchline ratio to span the full envelope: '~30-50x faster' with explicit floor and tail derivations '17000/523 = 32.5x' and '56000/523 = 107x'. Wordcount 4486 -> 4547 (slightly more careful math justifies the words).","timestamp":1778320873079,"segment":6}
{"run":33,"commit":"f3de385","metric":0,"metrics":{"build_warnings":0,"wordcount_off":0,"vague_claims":0,"missing_code_paths":0,"unverified_snippets":0,"weak_snippets":0,"numbers_no_math":0,"tilde_no_math":0,"percent_no_math":0,"ratio_no_citation":0,"missing_citations":0,"marketing_words":0,"hedge_words":0,"placeholder_urls":0,"inconsistent_idents":0,"footnote_balance":0,"math_off":0,"dollar_no_math":0,"bad_anchors":0,"defaults_mismatch":0,"range_inverted":0,"unbacked_claims":0,"http_not_https":0,"heading_skip":0,"broken_post_links":0,"missing_sections":0,"bad_commit_refs":0,"dupe_words":0,"broken_rendered_links":0,"loc_drift":0,"frontmatter":0,"wordcount":5476},"status":"keep","description":"Iter 33 (idx_scan/seq_scan terminology + trim): the §1 outbox-failure passage said \"the unprocessed-index `idx_scan` collapses as the planner falls back to seq scans\". `idx_scan` is a counter that goes UP, not \"collapses\"; what actually happens when the planner stops picking the index is that idx_scan PLATEAUS (no new scans against it) while seq_scan on the table climbs. Rewrote with the correct semantics: \"the planner starts skipping it for seq scans on the table — pg_stat_user_indexes.idx_scan plateaus while seq_scan climbs.\" `seq_scan` (a pg_stat_user_tables column) was a new identifier the inconsistency check flagged; allowlisted alongside idx_scan / n_live_tup / etc as Postgres-internal stats columns. Trimmed redundant prose to keep wordcount at 5476 (under the 5500 threshold). defects 4 → 0.","timestamp":1778320873466,"segment":4}
{"run":29,"commit":"HEAD","metric":0,"metrics":{"vague_claims":0,"ratio_no_citation":0,"marketing_words":0,"hedge_words":0,"weak_snippets":0,"missing_code_paths":0,"math_off":0,"wordcount":5257,"unverified_snippets":0,"missing_citations":0,"numbers_no_math":0,"frontmatter":0},"status":"keep","description":"Iter 29 (rate-vs-mean confusion). Iter 16 had introduced the line 'ml ≈ 0.361 — the rate parameter, equal to the mean of the underlying continuous exponential'. That's self-contradictory: ml is the MEAN, 1/ml is the rate. For Exp(rate=λ), mean=1/λ. The expression -log(U)*ml has mean ml, so it's Exp(rate=1/ml). Reworded to attribute correctly: 'ml ≈ 0.361 — the mean of the underlying continuous exponential (-log(U) * ml ~ Exp(rate = 1/ml))'. Probability/statistics nomenclature now self-consistent. Wordcount 5257; defects 0.","timestamp":1778320874385,"segment":6}
