{"run":44,"commit":"dbf8e0b","metric":0,"metrics":{"build_warnings":0,"missing_code_paths":0,"unverified_snippets":0,"unverified_literal":0,"numbers_no_math":0,"missing_citations":0,"marketing_words":0,"frontmatter":0,"bad_url_anchor":0,"bad_commit_ref":0,"factlib_size_drift":0,"wal_record_overhead_off":0,"fabricated_production":0,"loc_drift":0,"orders_of_magnitude":0,"bad_section_xref":0,"long_code_lines":0,"heading_skip":0,"bad_anchor_link":0,"license_claim":0,"gofmt":0,"fence_balance":0,"duplicate_paragraph":0,"numbered_list_gap":0,"wordcount":4989},"status":"keep","description":"Iter 46 (scorer extension — numbered-list gap). New detector numbered_list_gap (×2): walks each markdown numbered list, checks the numbers are 1..N (no skips). Catches the regression class where you delete item 3 but forget to renumber, leaving 1, 2, 4. Currently 0; the post's two numbered lists (§1 dual-write failure modes 1,2,3 and §4 UUIDv7 reasons 1,2) both pass. defects unchanged.","timestamp":1778321252731,"segment":4}
{"run":33,"commit":"f964acf","metric":0,"metrics":{"build_warnings":0,"wordcount_off":0,"vague_claims":0,"missing_code_paths":0,"unverified_snippets":0,"numbers_no_math":0,"missing_citations":0,"marketing_words":0,"frontmatter":0,"placeholder_urls":0,"bad_url_host":0,"ground_truth_drift":0,"hedge_words":0,"tilde_no_math":0,"percent_no_math":0,"img_no_alt":0,"long_code_lines":0,"math_off":0,"wordcount":4776},"status":"keep","description":"Iter 33: removed a duplicate 'don't blame chi or zap for cold-start' punchline. Iter 32 added the actionable summary in the strace punchline at line 382, but iter 18's earlier table-section had a similar 'user-code in main() is sub-millisecond - don't blame chi or zap for cold-start' line at 319. Removed the duplicate from the table-section by replacing with 'The user-code line is 0.5 ms - small enough to ignore in cold-start budgets'. Reader now sees the data point twice (good repetition: numbers persist) but the SAME phrasing only once. Wordcount 4775 -> 4776.","timestamp":1778321255388,"segment":6}
{"run":22,"commit":"dda9071","metric":0,"metrics":{"build_warnings":0,"wordcount_off":0,"vague_claims":0,"missing_code_paths":0,"unverified_snippets":0,"weak_snippets":0,"numbers_no_math":0,"tilde_no_math":0,"percent_no_math":0,"ratio_no_citation":0,"missing_citations":0,"marketing_words":0,"hedge_words":0,"placeholder_urls":0,"inconsistent_idents":0,"footnote_balance":0,"math_off":0,"dollar_no_math":0,"bad_anchors":0,"frontmatter":0,"wordcount":4525},"status":"keep","description":"Iter 31 (cosmetic prose fix on §4 step 4 — paragraph break). The paragraph about colocation-mismatch errors and the paragraph about multi-shard SELECT fall-through were jammed together with a mid-sentence boundary (\"router falls through to the logical planner. If a table prunes...\"). Split into two paragraphs so each thought is self-contained. No change in claims or numbers; just readability. defects 0 → 0; wordcount unchanged at 4525.","timestamp":1778321257685,"segment":6}
{"run":11,"commit":"b176fbe","metric":0,"metrics":{"build_warnings":0,"wordcount_off":0,"vague_claims":0,"missing_code_paths":0,"unverified_snippets":0,"weak_snippets":0,"numbers_no_math":0,"tilde_no_math":0,"percent_no_math":0,"ratio_no_citation":0,"missing_citations":0,"marketing_words":0,"hedge_words":0,"placeholder_urls":0,"inconsistent_idents":0,"footnote_balance":0,"math_off":0,"dollar_no_math":0,"bad_anchors":0,"defaults_mismatch":0,"range_inverted":0,"unbacked_claims":0,"http_not_https":0,"heading_skip":0,"broken_post_links":0,"missing_sections":0,"bad_commit_refs":0,"dupe_words":0,"broken_rendered_links":0,"loc_drift":0,"frontmatter":0,"wordcount":4039},"status":"keep","description":"Iter 11 (precise FD count, anchored to source constants): 0 defects held. Replaced the hand-wavy 'across hundreds of fds' Postgres claim with a sourced figure: Postgres splits relations into 1 GiB segment files (`base/<dbid>/<relid>.<seg>`), so a 9 GiB SF=10 lineitem heap is exactly 9 segment files = 9 fds for lineitem alone. The 'hundreds of fds' was an overstatement. Also anchored the 'tight pile of 8-256 KiB reads' DuckDB claim back to the actual source constant: `DEFAULT_BLOCK_ALLOC_SIZE = 262144ULL` defined in `src/include/duckdb/storage/storage_info.hpp` — readers can now grep that constant and verify. Verified the DuckDB Q03 EXPLAIN actually shows the filter-pushdown rewrite I claimed: `c_custkey <= 1499999` auto-generated from the customer-side build into the orders scan, exactly the 'sniffs the build side's join-key range' behaviour the prose describes. (No prose change needed since the claim was already correct; just confirmed externally.) Wordcount 4009 → 4039.","timestamp":1778321259458,"segment":6}
{"run":20,"commit":"17ab179","metric":0,"metrics":{"build_warnings":0,"wordcount_off":0,"missing_code_paths":0,"weak_snippets":0,"numbers_no_math":0,"percent_no_math":0,"hedge_words":0,"placeholder_urls":0,"inconsistent_idents":0,"unbacked_claims":0,"broken_post_links":0,"wordcount":4501},"status":"keep","description":"Iter 19 (adaptive ticks math + units pass). The previous claim \"sub-100 ms failover for hot ranges\" was slightly wrong. With electionTimeout=10 ticks and a 10 ms tick interval, the band is [100, 199] ms, not [under 100]. Fixed by deriving the actual band and the expected first-fire time (100 ms + 100 ms / 3 approximately 133 ms), and renaming the benefit to \"sub-200 ms\" which is honest. Math scorer caught a unit mismatch on the first pass (100 / 3 in raw form is 33, not 133); fixed by adding the unit to the second operand so the equation reads 100 ms + 100 ms / 3. Defects 0; wordcount 4488 to 4501.","timestamp":1778321272379,"segment":6}
{"run":40,"commit":"5539af4","metric":0,"metrics":{"build_warnings":0,"wordcount_off":0,"vague_claims":0,"missing_code_paths":0,"unverified_snippets":0,"weak_snippets":0,"numbers_no_math":0,"tilde_no_math":0,"percent_no_math":0,"ratio_no_citation":0,"missing_citations":0,"marketing_words":0,"hedge_words":0,"placeholder_urls":0,"inconsistent_idents":0,"footnote_balance":0,"math_off":0,"dollar_no_math":0,"bad_anchors":0,"frontmatter":0,"unbacked_claims":0,"wordcount":4495},"status":"keep","description":"Iter 40 (honesty about which statistic). The bench table caption said 'Best-of-three results' but my numbers (88M shared, 2832M padded, etc.) are actually the MEDIAN of three runs not the BEST. Verified by going back to my original bench output: best run was sharded_padded=3326M; median was 2831M. So 2832 in the table is the median, not the best. Updated 'Best-of-three' to 'Median-of-three' so the data label matches what the table contains. wordcount unchanged at 4495.","timestamp":1778321274701,"segment":6}
{"run":38,"commit":"c1e3a69","metric":0,"metrics":{"vague_claims":0,"ratio_no_citation":0,"marketing_words":0,"hedge_words":0,"weak_snippets":0,"missing_code_paths":0,"math_off":0,"wordcount":5352,"unverified_snippets":0,"missing_citations":0,"numbers_no_math":0,"frontmatter":0},"status":"keep","description":"Iter 38 (autoresearch.ideas.md refresh — full audit log). Updated the ideas backlog to record all 18 closed items from iters 19-37 (architecture diagram precision, mean clarification, deduplication mechanism, IVFFlat formula, distance-function generality, ml=mean not rate, IndexAmRoutine jargon, filter-recheck mechanism, napkin math consistency, Postgres age, filter expectation honesty, FMA/buffer ratio, integer truncation, candidate sort order). Open items remain: per-page critical CSS for the post, cross-CPU SIMD verification, 10M-row build measurement, filter-search EXPLAIN demo, perf flamegraph for 109 ns/row claim. Wordcount 5352; defects 0.","timestamp":1778321298347,"segment":6}
{"run":23,"commit":"56639aa","metric":0,"metrics":{"build_warnings":0,"wordcount_off":0,"vague_claims":0,"missing_code_paths":0,"unverified_snippets":0,"weak_snippets":0,"numbers_no_math":0,"tilde_no_math":0,"percent_no_math":0,"ratio_no_citation":0,"missing_citations":0,"marketing_words":0,"hedge_words":0,"placeholder_urls":0,"inconsistent_idents":0,"footnote_balance":0,"math_off":0,"dollar_no_math":0,"bad_anchors":0,"frontmatter":0,"wordcount":4525},"status":"keep","description":"Iter 32 (re-log after concurrent-agent commit-lock collision). Iter 31's paragraph-break edit was applied to disk but the auto-commit failed because a concurrent agent moved HEAD between my edit and the commit lock attempt. The change made it into the next commit anyway (now at b176fbe). State unchanged: defects=0, wordcount=4525, all 28 detector dimensions clean. Heavy concurrent activity on this repo (3 other agent sessions running on different posts: btree-ssd, etcd-raft-leader-election, scylla-shard-per-core); my citus changes are on disk and committed. autoresearch.ideas.md captures the full audit history. Conclusion: in 32 iterations across original (10) + resume (22) cycles, found and fixed ~22 substantive correctness bugs the regex scorer cannot detect, holding defects=0 throughout the audit phase.","timestamp":1778321300765,"segment":6}
{"run":19,"commit":"5778f5d","metric":0,"metrics":{"build_warnings":0,"wordcount_off":0,"vague_claims":0,"missing_code_paths":0,"unverified_snippets":0,"weak_snippets":0,"numbers_no_math":0,"tilde_no_math":0,"percent_no_math":0,"ratio_no_citation":0,"missing_citations":0,"marketing_words":0,"hedge_words":0,"placeholder_urls":0,"inconsistent_idents":0,"footnote_balance":0,"math_off":0,"dollar_no_math":0,"bad_anchors":0,"defaults_mismatch":0,"range_inverted":0,"unbacked_claims":0,"http_not_https":0,"heading_skip":0,"frontmatter":0,"wordcount":4076},"status":"keep","description":"Iter 19 (replace anecdotal claim with verifiable link). Continuous-vlog-GC bullet said 'Half the production deployments I've read forget to schedule it' — a personal-experience claim with no evidence. Worse, in iter 18 I'd briefly considered citing 'issue #1543' but realised I'd been fabricating that issue number. Replaced with a verifiable link to the badger issue tracker pre-filtered for 'value log grow' (https://github.com/dgraph-io/badger/issues?q=value+log+grow), which is a real GitHub search URL the reader can click. The claim is now 'recurring reports of unbounded vlog growth from users who forgot to schedule it' — a softer claim backed by a reproducible search rather than a count I can't substantiate. Wordcount 4064 → 4076. defects 0.","timestamp":1778321307533,"segment":6}
{"run":41,"commit":"9cc4f6d","metric":0,"metrics":{"build_warnings":0,"wordcount_off":0,"vague_claims":0,"missing_code_paths":0,"unverified_snippets":0,"weak_snippets":0,"numbers_no_math":0,"tilde_no_math":0,"percent_no_math":0,"ratio_no_citation":0,"missing_citations":0,"marketing_words":0,"hedge_words":0,"placeholder_urls":0,"inconsistent_idents":0,"footnote_balance":0,"math_off":0,"dollar_no_math":0,"bad_anchors":0,"frontmatter":0,"unbacked_claims":0,"wordcount":4529},"status":"keep","description":"Iter 41 (precision — channel_hop methodology). The channel_hop description said 'each goroutine sends to its neighbour and receives from itself via small buffered channels. ~68 ns per round-trip'. Not quite right: my bench uses 'select { case ch <- v: default: }' (non-blocking send) which DROPS messages when the buffer is full, instead of blocking. So it's not a guaranteed round-trip. Also the loop body includes an atomic.AddInt64 per iter (used for counting, but it does contribute to the measured cost). Updated the prose to spell out: atomic increment + non-blocking send + non-blocking recv = the 68 ns per iteration. Reframed 'round-trip' to 'iteration' to be honest about what the bench measures, and characterized the pattern as 'opportunistic cross-core coordination' which is what non-blocking handoff really is. wordcount 4495 to 4529.","timestamp":1778321317180,"segment":6}
{"run":39,"commit":"HEAD","metric":0,"metrics":{"vague_claims":0,"ratio_no_citation":0,"marketing_words":0,"hedge_words":0,"weak_snippets":0,"missing_code_paths":0,"math_off":0,"wordcount":5370,"unverified_snippets":0,"missing_citations":0,"numbers_no_math":0,"frontmatter":0},"status":"keep","description":"Iter 39 (Postgres page-layout precision in §3). My text said 'with ItemIds in the page header and the data growing from the bottom of the page upwards' — that implies ItemIds are inside the page header, which is wrong. The actual layout is: 24-byte PageHeader, followed by a growing-down array of 4-byte ItemIdData, then free space, then tuples growing up from the bottom. Reworded with explicit byte sizes and a link to the canonical Postgres docs. The architectural point — that pgvector reuses heap-page layout — still stands. Wordcount 5370; defects 0.","timestamp":1778321329201,"segment":6}
{"run":45,"commit":"2b9eb45","metric":0,"metrics":{"build_warnings":0,"missing_code_paths":0,"unverified_snippets":0,"unverified_literal":0,"numbers_no_math":0,"missing_citations":0,"marketing_words":0,"frontmatter":0,"bad_url_anchor":0,"bad_commit_ref":0,"factlib_size_drift":0,"wal_record_overhead_off":0,"fabricated_production":0,"loc_drift":0,"orders_of_magnitude":0,"bad_section_xref":0,"long_code_lines":0,"heading_skip":0,"bad_anchor_link":0,"license_claim":0,"gofmt":0,"fence_balance":0,"duplicate_paragraph":0,"numbered_list_gap":0,"github_line_ref":0,"wordcount":4989},"status":"keep","description":"Iter 47 (scorer extension — GitHub line refs). New detector github_line_ref (×3): finds https://github.com/fampay-inc/factlib/blob/main/<path>#L<n>-L<m> anchors, verifies (a) the file exists in cached repo, (b) the line range is in-bounds (1 ≤ start ≤ end ≤ wc -l). Currently 0; the iter-20 #L381-L398 link to wal.go's listenEventAck verifies as in-bounds (file is 419 lines).","timestamp":1778321329053,"segment":4}
{"run":21,"commit":"c73507b","metric":0,"metrics":{"build_warnings":0,"wordcount_off":0,"missing_code_paths":0,"weak_snippets":0,"numbers_no_math":0,"percent_no_math":0,"hedge_words":0,"placeholder_urls":0,"inconsistent_idents":0,"unbacked_claims":0,"broken_post_links":0,"wordcount":4501},"status":"keep","description":"Iter 20 (consistency: ±5 percent in hook, ±3 percent in colophon - same data, different headline number). The hook block-quote said the M3 Max bench was reproducible to ±5 percent across 3 runs, but the colophon said ±3 percent. Computed actual spread: max minus min divided by median = (1369 minus 1333) divided by 1360 approximately 2.6 percent, so ±3 percent is the honest number for these 3 runs. Reconciled by changing the hook to ±3 percent. ±5 percent is fine across many runs in different conditions but for these specific three runs the tighter number is more accurate. Defects 0; wordcount unchanged.","timestamp":1778321335144,"segment":6}
{"run":24,"commit":"59e2c01","metric":0,"metrics":{"build_warnings":0,"wordcount_off":0,"vague_claims":0,"missing_code_paths":0,"unverified_snippets":0,"weak_snippets":0,"numbers_no_math":0,"tilde_no_math":0,"percent_no_math":0,"ratio_no_citation":0,"missing_citations":0,"marketing_words":0,"hedge_words":0,"placeholder_urls":0,"inconsistent_idents":0,"footnote_balance":0,"math_off":0,"dollar_no_math":0,"bad_anchors":0,"frontmatter":0,"wordcount":4524},"status":"keep","description":"Iter 33 (cross-section consistency: §6 fragile-fast-path numbers vs §5 napkin range). The §6 fast-path-fragility paragraph said \"A query that takes 200 µs on the fast path can balloon to 1 ms\" — but §5 had already established that the fast-path TOTAL envelope is 250-1100 µs (rack-local 50-100 µs RTT + 100-500 µs worker exec + ~50 ns binary search). 200 µs is below that range. Reworded to stitch the two sections together: \"A query that lives in the 250-1100 µs fast-path envelope (§5 napkin: ...) can balloon into the 1-2 ms range...\". Now §6 cites §5's number explicitly. Reader doing back-of-envelope on the post's own claims gets the same answer in both sections. defects 0 → 0; wordcount 4525 → 4524.","timestamp":1778321339142,"segment":6}
{"run":23,"commit":"HEAD","metric":0,"metrics":{"build_warnings":0,"wordcount_off":0,"vague_claims":0,"missing_code_paths":0,"unverified_snippets":0,"weak_snippets":0,"numbers_no_math":0,"tilde_no_math":0,"percent_no_math":0,"ratio_no_citation":0,"missing_citations":0,"marketing_words":0,"hedge_words":0,"placeholder_urls":0,"inconsistent_idents":0,"footnote_balance":0,"math_off":0,"dollar_no_math":0,"bad_anchors":0,"defaults_mismatch":0,"range_inverted":0,"unbacked_claims":0,"http_not_https":0,"heading_skip":0,"broken_post_links":0,"missing_sections":0,"bad_commit_refs":0,"dupe_words":0,"broken_rendered_links":0,"frontmatter":0,"wordcount":4601},"status":"keep","description":"Iter 22 (audit pass — clean up cache.go quote artifact). The §4.3 quote had \"is used for page replacement.\\n// In\\n// order to provide...\" — a parsing artifact from iter 1's URL elision that left a dangling \"// In\" line. Replaced the elided URL with a clear \"(...)\" placeholder so the source-grammar continuity reads naturally: \"is used for page replacement\\n// (...). In\\n// order to...\". Updated the path comment to mark the elision explicitly: \"(line 24, USENIX URL elided)\" — line is 24 because the URL was on line 24 (line 23 is the empty separator above the comment). Defects 0; wordcount 4601 (unchanged).","timestamp":1778321339136,"segment":6}
{"run":34,"commit":"22b43d8","metric":0,"metrics":{"build_warnings":0,"wordcount_off":0,"vague_claims":0,"missing_code_paths":0,"unverified_snippets":0,"numbers_no_math":0,"missing_citations":0,"marketing_words":0,"frontmatter":0,"placeholder_urls":0,"bad_url_host":0,"ground_truth_drift":0,"hedge_words":0,"tilde_no_math":0,"percent_no_math":0,"img_no_alt":0,"long_code_lines":0,"math_off":0,"wordcount":4776},"status":"keep","description":"Iter 34: precision on the containerd default. The previous citation pointed at internal/cri/config/config.go where the field is DEFINED, but the default value is set in config_unix.go (verified: 'MaxConcurrentDownloads: 3' literal in DefaultConfig). Updated [cricfg] link to config_unix.go where the reader can grep for ': 3' and see the default. Verified URL returns 200. Wordcount unchanged.","timestamp":1778321343286,"segment":6}
{"run":20,"commit":"02d62c9","metric":0,"metrics":{"build_warnings":0,"wordcount_off":0,"vague_claims":0,"missing_code_paths":0,"unverified_snippets":0,"weak_snippets":0,"numbers_no_math":0,"tilde_no_math":0,"percent_no_math":0,"ratio_no_citation":0,"missing_citations":0,"marketing_words":0,"hedge_words":0,"placeholder_urls":0,"inconsistent_idents":0,"footnote_balance":0,"math_off":0,"dollar_no_math":0,"bad_anchors":0,"defaults_mismatch":0,"range_inverted":0,"unbacked_claims":0,"http_not_https":0,"heading_skip":0,"frontmatter":0,"wordcount":4083},"status":"keep","description":"Iter 20 (closing-paragraph sloppy claim correction). Closing said 'Storage engines are a few hundred well-named knobs sitting on top of a couple of hard ideas.' Counted Badger's actual config knobs: `grep -cE '^func (opt Options) With' options.go` = 38. 'A few hundred' is wildly off. Tightened to 'a few dozen well-named knobs (Badger has 38 WithX methods on Options)' — now self-checking and accurate. Wordcount 4076 → 4083. defects 0.","timestamp":1778321353163,"segment":6}
{"run":48,"commit":"52c5083","metric":0,"metrics":{"build_warnings":0,"wordcount_off":0,"vague_claims":0,"missing_code_paths":0,"unverified_snippets":0,"weak_snippets":0,"numbers_no_math":0,"tilde_no_math":0,"percent_no_math":0,"ratio_no_citation":0,"missing_citations":0,"marketing_words":0,"hedge_words":0,"placeholder_urls":0,"inconsistent_idents":0,"footnote_balance":0,"math_off":0,"dollar_no_math":0,"bad_anchors":0,"defaults_mismatch":0,"range_inverted":0,"frontmatter":0,"wordcount":4998},"status":"keep","description":"Iter 48 (random-row-updates row accuracy). Real fix: §6 row said equality deletes \"scan all manifests\" — actually equality delete files DO get pruned during planning by column bounds in their entries (see §Scan Planning in the spec for the rules). The actual pain on random row updates is that there is no PK-based lookup, so each update has to write a new equality delete file (and the planner has to consider all of them for any subsequent read of the affected partitions). Restated as: \"No primary-key index; equality deletes apply by column-bound pruning, not by key — every update writes a new delete file.\" Reader who later runs an equality DELETE on Iceberg and watches the file count grow now has the right mental model. Wordcount 4985 → 4998 — 2 words to ceiling. Defects 0.","timestamp":1778321364914,"segment":6}
{"run":22,"commit":"HEAD","metric":0,"metrics":{"build_warnings":0,"wordcount_off":0,"missing_code_paths":0,"weak_snippets":0,"numbers_no_math":0,"percent_no_math":0,"hedge_words":0,"placeholder_urls":0,"inconsistent_idents":0,"unbacked_claims":0,"broken_post_links":0,"wordcount":4502},"status":"keep","description":"Iter 21 (architecture diagram clarity). The diagram had Term, Vote, lead, state in {F, C, PC, L} which incorrectly suggests all four fields are bounded to that 4-state set; only state is. Rewrote the diagram lines to declare types explicitly: Term uint64; Vote, lead uint64; state takes values from a named 4-element enum (Follower, Candidate, PreCandidate, Leader). Now structurally true to the source. Defects 0; wordcount 4501 to 4502.","timestamp":1778321364999,"segment":6}
