{"run":20,"commit":"7f66737","metric":0,"metrics":{"public_kb":5600},"status":"keep","description":"Iter 20: enabled cross-document View Transitions API. Added `<meta name=\"view-transition\" content=\"same-origin\">` to head.html so Chromium browsers smoothly fade between pages of the site (Safari and Firefox: graceful no-op until they ship support). 180ms cubic-bezier curve. Respects `prefers-reduced-motion` — users who opt out of motion get no transition. Pure additive change, no breaking behavior. Verified meta tag emits in /index.html.","timestamp":1778140905819,"segment":0}
{"run":21,"commit":"b1e0492","metric":0,"metrics":{"public_kb":5800},"status":"keep","description":"Iter 21: updated session checkpoints. autoresearch.md now documents both bug-fix cycle (iter 1-17) and feature polish cycle (iter 18-20) under one session header. autoresearch.ideas.md got 3 additional done-items (homepage cards, tag cloud, view transitions) plus 2 newly-pruned-as-adequate (mobile menu, code language labels). Verified dark mode toggle and keyboard nav are already wired (initDarkModeToggle, initKeyboardNav). Larger-features tier is the only remaining open work; everything else is either done or theme-author-decided. Site at 5.8MB, 0 warnings, all polished.","timestamp":1778141049151,"segment":0}
{"run":22,"commit":"e0d9f6d","metric":0,"metrics":{"public_kb":5500},"status":"keep","description":"Iter 22: cleaned stale public/ artifacts (gitignored, just disk hygiene). public/css had grown to 7 main.min fingerprint files from successive iterations + the unminified main.css; public/js had 3 stale files. After rm -rf public/ resources/ and hugo --gc, build dir went 5.8M to 5.2M. After re-running standard hugo (which rebuilds for accurate measurement), final size is 5.5M. Confirms public/ accumulation is a known pattern when iterating CSS/JS - hugo --gc alone doesnt always remove orphans created by an iteration that ran without --gc.","timestamp":1778141116934,"segment":0}
{"run":23,"commit":"72fbd8f","metric":0,"metrics":{"public_kb":5500},"status":"keep","description":"Iter 23: final session checkpoint update. autoresearch.md now has all 3 cycles in one session header (A bug-fixes 1-17, B feature polish 18-20, C housekeeping 21-22). Documented the explicit \"do not push\" rule from saved feedback memory and noted 35+ unpushed commits awaiting user review. Loop has reached genuine diminishing returns - metric at floor, all reachable backlog items done, larger-feature tier requires half-day+ commitments and external setup (Pagefind binary, GitHub Discussions, etc).","timestamp":1778141165299,"segment":0}
{"run":24,"commit":"6eee7fb","metric":0,"metrics":{"public_kb":5500},"status":"keep","description":"Iter 24: fixed broken about page og:image. Was using an absolute Unsplash URL in front matter `images:`, but the opengraph template prepends `$.Permalink` (assuming relative paths). The output was a malformed concat: `https://backend.how/about/https://images.unsplash.com/...`. Removed the unsplash URL entirely so the about page uses the site fallback /og-image.png. Also rewrote the description from the bare placeholder \"About Me\" to a real meta description matching the user voice. Updated lastmod to today (was 2020). Verified output: og:image is now https://backend.how/og-image.png; description picks up the new sentence on every preview.","timestamp":1778141267302,"segment":0}
{"run":25,"commit":"9bb8093","metric":0,"metrics":{"public_kb":5500},"status":"keep","description":"Iter 25: defense-in-depth on opengraph.html. Was unconditionally prepending Permalink to every entry in front-matter `images:` (which broke about page in iter 24 because that page had an abs URL there). Now the template detects http://, https://, or // prefixes and emits the URL as-is; otherwise prepends Permalink as before. Verified all existing pages still emit correct og:image: posts use abs URLs from Permalink concat (the-tiger-style/beetle.webp etc.), site fallback uses og-image.png abs. Future pages with absolute URLs in `images:` will Just Work.","timestamp":1778141314567,"segment":0}
{"run":26,"commit":"0282841","metric":0,"metrics":{"public_kb":5500},"status":"keep","description":"Iter 26: same OG-image robustness fixes for twitter_cards.html and structured-data.html. Twitter card was using RelPermalink (sends Twitter relative URLs - they 404 on fetch); now uses Permalink and absURL for the site fallback path. Structured-data JSON-LD image array also gets the abs-URL detection: if a Params.images entry starts with http/https/// emit as-is, otherwise prepend Permalink. Verified twitter:image and JSON-LD image both render absolute URLs across home, about, and post pages.","timestamp":1778141360655,"segment":0}
{"run":27,"commit":"0282841","metric":0,"metrics":{"public_kb":5500},"status":"keep","description":"Iter 27: fixed relative canonical URLs in seo.html. (a) `<link rel=\"canonical\">` was using RelPermalink — Google strongly prefers absolute canonicals to deduplicate properly; now uses Permalink. (b) Paginator canonical/prev/next switched from relURL to absURL. (c) AlternativeOutputFormats (RSS, AMP feeds) switched from RelPermalink to Permalink. Verified across home/post/about: canonical href is now https://backend.how/..., RSS alternate href is now https://backend.how/.../index.xml. This is the third bag of \"this template was emitting relative where Google/social-platforms wanted absolute\" issues fixed across the SEO partials.","timestamp":1778141398599,"segment":0}
{"run":28,"commit":"aa782a6","metric":0,"metrics":{"public_kb":5500},"status":"keep","description":"Iter 28: fixed Schema.org Person/Article author and publisher names. With schemaType=Person, the JSON-LD was naming the entity \"Backend.how How It Works\" (the site title) instead of the author name \"Pratik\". Now: when schemaType is Person, falls back to author.name (defaults to site.title if author.name unset, preserving back-compat). When schemaType is Organization, still uses site.title. Verified on home and tiger-style post: name is now \"Pratik\" everywhere a Person is referenced. Also tightened the publisher block formatting (omit trailing comma when no logo). Real Google Search Console value: rich-result eligibility uses these fields.","timestamp":1778141468481,"segment":0}
{"run":29,"commit":"8bbc8c5","metric":0,"metrics":{"public_kb":5500},"status":"keep","description":"Iter 29: normalized BreadcrumbList JSON-LD @context. The Article schema used https://schema.org but BreadcrumbList used http://schema.org - inconsistent within the same page. Fixed to https everywhere. Verified: zero remaining http://schema.org refs in built post pages.","timestamp":1778141512908,"segment":0}
{"run":30,"commit":"6e16de8","metric":0,"metrics":{"public_kb":5500},"status":"keep","description":"Iter 30: documented Cycle D findings in autoresearch.md. Records the 5 real SEO bugs found by manual template audit (iter 24-29) that hugo_warnings did NOT catch. Lesson noted for future runs: hugo_warnings is a syntax/template-correctness metric, not a semantic-correctness metric. To find OG/JSON-LD/canonical bugs you have to actually read the templates and compare emitted HTML against what Google/Twitter/Facebook expect. Validated all JSON-LD blocks parse via Python on home, about, temporal, cat-stereogram pages: Article, BreadcrumbList, Person all OK.","timestamp":1778141564750,"segment":0}
{"run":31,"commit":"6e16de8","metric":0,"metrics":{"public_kb":5500},"status":"keep","description":"Iter 31: fixed malformed home page title. Was emitting `<title>Backend.how | How It Works | </title>` with trailing pipe-space because `Site.Params.titleAddition` is unset. Now: when titleAddition is unset, just emit the site title alone. When it's set, emit title + separator + addition. Verified: home now renders `Backend.how | How It Works`, post pages still render `Title | Site` pattern. Bug visible in browser tabs and search engine result pages.","timestamp":1778141605867,"segment":0}
{"run":32,"commit":"6978f5e","metric":0,"metrics":{"public_kb":5500},"status":"keep","description":"Iter 32: comprehensive QA validation pass after Cycle D + iter 31 title fix. Confirmed: every title tag is well-formed (home, posts list, about, single post). Every canonical URL is absolute. Every og:image is absolute. Every twitter:image is absolute. Six post pages JSON-LD parses with zero broken blocks across Article, BreadcrumbList, Person types. The site is materially better than session start: 11 warnings + 6 SEO bugs at baseline, now 0 + 0. 38 commits ahead of origin/main awaiting user review and push.","timestamp":1778141637737,"segment":0}
{"run":33,"commit":"37cf69f","metric":0,"metrics":{"public_kb":5400},"status":"keep","description":"Iter 33: removed two unused/misleading output formats. (a) Home was emitting AMP at /amp/index.html but the page contained zero AMP markup (no ampproject CDN script, no html-amp tag) - just regular HTML. Google would reject this as invalid AMP. Removed amp from home outputs. (b) Per-page RSS feeds were emitted at /posts/temporal-under-the-hood/index.xml and similar - rarely useful and generally not consumed. Removed rss from page outputs; kept it on home and section (/posts/) which are the real subscription endpoints. Site went from 5.5M to 5.4M; cleaner output topology.","timestamp":1778141772264,"segment":0}
{"run":34,"commit":"3183ab7","metric":0,"metrics":{"public_kb":5400},"status":"keep","description":"Iter 34: rewrote default RSS template to fix unprofessional channel titles. Hugo default emitted: title=Home on How It Works, description=Recent content in Home on How It Works. Now: home feed title=Backend.how How It Works, posts feed title=Backend.how How It Works Posts. Description pulls from site.Params.Description (Deep dives into backend systems...). Per-item description uses front-matter .Description instead of full content HTML when available falls back to .Summary. atom:link self-reference still emitted. Verified all RSS endpoints (home, posts, tags) render with the new template.","timestamp":1778141839083,"segment":0}
{"run":35,"commit":"992baad","metric":0,"metrics":{"public_kb":5400},"status":"keep","description":"Iter 35: fixed sitemap.xml XML declaration. The leading processing instruction was being HTML-escaped by Go templates so the sitemap started with literal `andlt;?xml version=...?and gt;` instead of a real XML declaration. Every XML parser would reject this as invalid - search engines could not parse this sitemap. Major SEO bug present since site setup. Fix wraps the declaration in printf and safeHTML so it bypasses template escaping. Verified with Python ElementTree: sitemap now parses cleanly with 55 URLs.","timestamp":1778141932456,"segment":0}
{"run":36,"commit":"c9fbf5d","metric":0,"metrics":{"public_kb":5400},"status":"keep","description":"Iter 36: added missing XML declaration to RSS template. My custom RSS rewrite in iter 34 forgot to include the leading processing instruction. RSS 2.0 spec requires XML declaration. Without it, strict feed readers can fail or warn. Fixed using same pattern as sitemap (printf with safeHTML to bypass template escaping). Validated with Python ElementTree: home, posts, and per-tag RSS feeds all parse cleanly. Sitemap still parses. All four XML output endpoints clean.","timestamp":1778141970078,"segment":0}
{"run":37,"commit":"f58904c","metric":0,"metrics":{"public_kb":5400},"status":"keep","description":"Iter 37: added missing description to /posts/ section page. Without a description front-matter field, the SEO partial falls through to using the site description (which is fine but generic for a list page). Now /posts/ has a section-specific description that says what the listing actually contains. Verified meta description and og:description both render the new sentence on /posts/. Also updated lastmod from 2023 to today.","timestamp":1778142009771,"segment":0}
{"run":38,"commit":"68b1d8d","metric":0,"metrics":{"public_kb":5400},"status":"keep","description":"Iter 38: normalized hugo.toml description config. Was using capital D `Description` inside [params] which only worked because Hugo is case-insensitive on lookups. Now: lowercase `description` at the top level (so site.Description works) AND inside [params] (so site.Params.description works). Both reflect the same string. This is the conventional Hugo pattern - top-level for site.Description (used by RSS spec, builtin templates) and params for explicit reference. All meta description tags continue to render correctly across home, about, posts pages.","timestamp":1778142067522,"segment":0}
{"run":39,"commit":"bfeef79","metric":0,"metrics":{"public_kb":5400},"status":"keep","description":"Iter 39: documented Cycle E findings in autoresearch.md. Records the 6 auxiliary-output bugs found by manual audit (iter 33-38) that hugo_warnings did NOT catch. The big one is iter 35: the sitemap had its XML declaration HTML-escaped to literal andlt;?xmlandgt; meaning every XML parser rejected it - search engines could not parse the sitemap for URL discovery. Pattern continues to hold: floor-then-audit keeps producing value because the metric is too narrow.","timestamp":1778142108306,"segment":0}
{"run":40,"commit":"855f1c3","metric":0,"metrics":{"public_kb":5400},"status":"keep","description":"Iter 40: cycle E final QA pass. Validated 0 broken internal links across all generated HTML pages (script walks public/, builds set of all reachable paths, then for every href= pulls the path and checks membership). Validated all 3 XML output endpoints parse via Python ElementTree (sitemap, home RSS, posts RSS). Validated CSS balance (364 opens vs 364 closes - no unbalanced braces in main.css and main.min.css). View-transition rule emitted twice (2 instances in built CSS). Site is in clean state. 46 commits ahead of origin/main awaiting user push.","timestamp":1778142169423,"segment":0}
{"run":41,"commit":"efc1fa8","metric":0,"metrics":{"public_kb":5400},"status":"keep","description":"Iter 41: added conditional DNS prefetch and preconnect for cdn.jsdelivr.net on pages that load KaTeX. Math posts (1b-payments-per-day, fdyno) load 3 files from jsdelivr - css, main js, auto-render. Without prefetch the DNS lookup happens after head parse delaying first KaTeX render. Conditional emission via Params.math gate so non-math pages dont add unnecessary prefetch hints. Verified: 1b-payments has the prefetch, tiger-style doesnt.","timestamp":1778142240595,"segment":0}
{"run":42,"commit":"85b5d0c","metric":0,"metrics":{"public_kb":5400},"status":"keep","description":"Iter 42: removed duplicate charset and viewport meta tags. baseof.html already emitted these at the very top of head, then head.html partial emitted them again with slightly different syntax (utf-8 lowercase, viewport with extra spec). Browsers ignore the second instance, so no behavior change, but every byte is unnecessary noise. Verified: each page now has exactly 1 charset and 1 viewport meta tag.","timestamp":1778142320402,"segment":0}
{"run":43,"commit":"61fc460","metric":0,"metrics":{"public_kb":5400},"status":"keep","description":"Iter 43: added rel=noopener noreferrer to two target=_blank links that bypassed ext_link.html postprocessing. (a) RSS feed icon link in footer.html. (b) Hacker News upvote link in hacker-news-comments.html (only renders when hnItemId is set). Without these rel attrs the new tab can use window.opener to redirect the original page (tabnabbing). Verified zero remaining target=_blank without rel attributes across all built HTML pages.","timestamp":1778142390213,"segment":0}
{"run":44,"commit":"a89e3bd","metric":0,"metrics":{"public_kb":5400},"status":"keep","description":"Iter 44: fixed malformed twitter:site meta. Was emitting content=@https://x.com/pratikgajjar_in (literal at sign followed by full URL) because the param was set to a URL but the template prepends @. Twitter cards spec wants @handle only. Fixed config: twitterSite=pratikgajjar_in (just the handle). Verified output: now content=@pratikgajjar_in. Twitter creator was already correct.","timestamp":1778142443982,"segment":0}
{"run":45,"commit":"0cf68fd","metric":0,"metrics":{"public_kb":5400},"status":"keep","description":"Iter 45: extended deployment cache-control matcher to include WOFF and WOFF2 fonts. The pattern was matching js, css, svg, ttf but not the modern font formats. DepartureMono is WOFF2 (preloaded in head) and a future JetBrains Mono WOFF2 conversion would also miss the 1-year cache window. Now: woff and woff2 also get the long max-age. No build impact - only affects deployment metadata.","timestamp":1778142517979,"segment":0}
{"run":46,"commit":"42bc2f0","metric":0,"metrics":{"public_kb":5400},"status":"keep","description":"Iter 46: documented Cycle F findings in autoresearch.md. Records all iterations 40-45 with the additional 5 bug fixes the cycle delivered (DNS prefetch for KaTeX, duplicate meta tags removed, target=_blank security attrs, twitter:site malformed, WOFF cache headers extended). Total session score across all 6 cycles: 11 to 0 warnings + 18 distinct semantic-correctness bugs fixed via manual audit. Site is in materially better shape than session start.","timestamp":1778142561552,"segment":0}
{"run":47,"commit":"f74dbd4","metric":0,"metrics":{"public_kb":5400},"status":"keep","description":"Iter 47: cleaned up Content-Security-Policy headers. The _headers file emitted TWO CSP headers - the first with frame-ancestors none and the second with frame-ancestors self. Browsers take the intersection of multiple CSP headers, so frame-ancestors none won (no framing at all) - but X-Frame-Options was SAMEORIGIN allowing same-origin framing. Inconsistent intent. Resolved: one CSP header with frame-ancestors self matching X-Frame-Options SAMEORIGIN. Removed the duplicate dead-code second CSP. Same-origin embed now allowed which is the typical blog policy.","timestamp":1778142681544,"segment":0}
{"run":48,"commit":"872d2e9","metric":0,"metrics":{"public_kb":5400},"status":"keep","description":"Iter 48: tightened CSP by removing dead permissions. Verified via grep that the templates and content reference NONE of: static.cloudflareinsights.com (no CF Web Analytics script anywhere), cloudflareinsights.com (no fetch endpoints), mirrors.creativecommons.org (CC images are local /cc.svg /by.svg /sa.svg). The site uses Plausible at stats.backend.how (covered by *.backend.how) and HN comments hit hn.algolia.com (kept). Dead permissions removed: smaller attack surface, easier to audit. CSP went from 7 third-party hosts to 4 (cdn.jsdelivr.net, *.backend.how, hn.algolia.com, youtube). Also added explicit self to connect-src for clarity.","timestamp":1778142741789,"segment":0}
{"run":49,"commit":"3a9cd32","metric":0,"metrics":{"public_kb":5400},"status":"keep","description":"Iter 49: hardened hn-comments.js. (a) target=_blank link to HN user profile was missing rel=noopener noreferrer (same tabnabbing concern as iter 43, but in the JS-emitted HTML). (b) Added encodeURIComponent around comment.author in href to defend against any malformed HN usernames (HN restricts to alphanumerics+dashes+underscores in practice but defense in depth). Verified rebuilt hn-comments.min.js has the noopener string. Affects posts with hnItemId set: running-101, lost-ssh, creating-content, the-best-way-to-learn, valkey-part-2.","timestamp":1778142797038,"segment":0}
{"run":50,"commit":"df4d06f","metric":0,"metrics":{"public_kb":5500},"status":"keep","description":"Iter 50: documented Cycle G in autoresearch.md. Records security audit findings (iter 47-49): duplicate CSP headers reconciled, dead CSP permissions removed (cloudflareinsights, mirrors.cc), HN comments JS missing rel=noopener and added encodeURIComponent defense-in-depth. Total session: 21 distinct semantic-correctness bugs across 7 cycles. Pattern continues - hugo_warnings is too narrow a metric to capture security/SEO/correctness issues.","timestamp":1778142971882,"segment":0}
{"run":51,"commit":"e1a2cfe","metric":0,"metrics":{"public_kb":5500},"status":"keep","description":"Iter 51: added article:author OG meta. Was conditionally emitted only when Site.Params.facebookAuthor was set (which the site doesn't use). Now: falls back to Site.Params.author.name (Pratik) when facebook auth is unset, so article posts now properly attribute their author. OG spec accepts a name string; Facebook prefers a profile URL but a name fallback is far better than no attribution at all. Verified article:author=Pratik on all post pages.","timestamp":1778143077137,"segment":0}
{"run":52,"commit":"02396da","metric":0,"metrics":{"public_kb":5500},"status":"keep","description":"Iter 52: removed contradictory `defer async` on dev-mode script tag in js.html. Per HTML spec, async overrides defer when both are set - so the dev tag was effectively just `async`, not `defer`. Production used only `defer`. Now both modes are consistent: `defer` only. Minor parity fix; affects dev hot-reload behavior only (production was already fine).","timestamp":1778143145704,"segment":0}
{"run":53,"commit":"b982e87","metric":0,"metrics":{"public_kb":5500},"status":"keep","description":"Iter 53: documented Cycle H findings in autoresearch.md. Records iter 51 article:author fallback fix and iter 52 defer-async parity fix. Total session: 23 distinct semantic-correctness bugs fixed across 8 cycles, all locally committed (66+ commits unpushed). Backlog adds: og-image.png needs to be regenerated at 1200x630 for proper social previews. Loop has hit genuine depletion - any further productive work needs browser tooling or larger features.","timestamp":1778143225426,"segment":0}
