{"run":15,"commit":"e135724","metric":0,"metrics":{"build_warnings":0,"wordcount_off":0,"vague_claims":0,"missing_code_paths":0,"unverified_snippets":0,"weak_snippets":0,"numbers_no_math":0,"tilde_no_math":0,"percent_no_math":0,"ratio_no_citation":0,"missing_citations":0,"marketing_words":0,"hedge_words":0,"placeholder_urls":0,"inconsistent_idents":0,"footnote_balance":0,"math_off":0,"dollar_no_math":0,"bad_anchors":0,"defaults_mismatch":0,"range_inverted":0,"unbacked_claims":0,"http_not_https":0,"heading_skip":0,"broken_post_links":0,"missing_sections":0,"bad_commit_refs":0,"dupe_words":0,"broken_rendered_links":0,"loc_drift":0,"frontmatter":0,"wordcount":4201},"status":"keep","description":"Iter 15 (5-level paging concern + thesis blockquote): 0 defects held. Two improvements. (1) The 'Make salt 24 bits, not 16' suggestion was actually backwards: shrinking pointer space to 40 bits would create real problems for x86-64 hosts running Linux 4.14+ 5-level paging (https://docs.kernel.org/x86/x86_64/5level-paging.html), where user-space gets 56 address bits. The honest concern in the *opposite* direction: today's 16-bit salt + 48-bit pointer works on 4-level paging; on 5-level-paging hosts (>128 TiB RAM, CONFIG_X86_5LEVEL=y) a pointer can exceed 48 bits and DUCKDB_DISABLE_POINTER_SALT must be set or the salt mask chews the top 8 bits. The post now describes the dynamically-sized salt fix as the right design and notes the existing DUCKDB_DISABLE_POINTER_SALT escape hatch. Cost-revised from 'half a day' to '1 day plus large-RAM CI test'. (2) Added a thesis-style blockquote in the intro contrasting the two engines' unit-of-work — matches the Tiger Style / 1B-payments blockquote-as-punchline pattern used in the reference posts. Wordcount 4167 → 4201.","timestamp":1778321787011,"segment":6}
{"run":47,"commit":"HEAD","metric":0,"metrics":{"build_warnings":0,"wordcount_off":0,"vague_claims":0,"missing_code_paths":0,"unverified_snippets":0,"weak_snippets":0,"numbers_no_math":0,"tilde_no_math":0,"percent_no_math":0,"ratio_no_citation":0,"missing_citations":0,"marketing_words":0,"hedge_words":0,"placeholder_urls":0,"inconsistent_idents":0,"footnote_balance":0,"math_off":0,"dollar_no_math":0,"bad_anchors":0,"frontmatter":0,"unbacked_claims":0,"wordcount":4599},"status":"keep","description":"Iter 47 (honesty about variance — Apple Silicon E/P heterogeneity). Colophon claimed 'Ratios will vary by +/-20% across hardware and OS schedulers' — too narrow. Repeating my bench many times during the audit, I observed swings up to +/-50% on Apple Silicon depending on whether the kernel scheduled to E-cores or P-cores. Reframed: 'Variance is significant: on Apple Silicon's heterogeneous E/P core mix the same workload can swing +/-50% between runs depending on which cores get scheduled, so individual measurements drift but the order-of-magnitude ratio between contended-shared and sharded remains invariant.' Also clarified that the table values are MEDIAN-of-three (matching iter 40's table caption) rather than vague 'three runs of the included Go program'. Reader gets accurate expectation of run-to-run noise. wordcount 4581 to 4599.","timestamp":1778321787157,"segment":6}
{"run":37,"commit":"a6a6802","metric":0,"metrics":{"build_warnings":0,"wordcount_off":0,"vague_claims":0,"missing_code_paths":0,"unverified_snippets":0,"numbers_no_math":0,"missing_citations":0,"marketing_words":0,"frontmatter":0,"placeholder_urls":0,"bad_url_host":0,"ground_truth_drift":0,"hedge_words":0,"tilde_no_math":0,"percent_no_math":0,"img_no_alt":0,"long_code_lines":0,"math_off":0,"wordcount":4796},"status":"keep","description":"Iter 37: tag-name consistency between section 3 (test rig 'distroless'/'scratch'/'wolfi') and section 7 (35-line repro 'static'/'wolfi-base'). The previous repro extracted tags via ${base##*/} which produced 'static' from gcr.io/distroless/static and 'wolfi-base' from cgr.dev/chainguard/wolfi-base - inconsistent with the 'distroless' and 'wolfi' names used everywhere else in the post. Restructured to use a bash associative array 'declare -A bases=([scratch]=scratch [distroless]=gcr.io/distroless/static:latest [wolfi]=cgr.dev/chainguard/wolfi-base:latest)' and iterate by intended tag name. Reader's mental model now matches across the post: the bench images are bench/distroless, bench/wolfi, bench/scratch in every section. Updated header from '35-line repro' to '37-line repro' (counted programmatically; bash -n syntax-check passes). Wordcount 4793 -> 4796.","timestamp":1778321792091,"segment":6}
{"run":24,"commit":"1664591","metric":0,"metrics":{"build_warnings":0,"wordcount_off":0,"vague_claims":0,"missing_code_paths":0,"unverified_snippets":0,"weak_snippets":0,"numbers_no_math":0,"tilde_no_math":0,"percent_no_math":0,"ratio_no_citation":0,"missing_citations":0,"marketing_words":0,"hedge_words":0,"placeholder_urls":0,"inconsistent_idents":0,"footnote_balance":0,"math_off":0,"dollar_no_math":0,"bad_anchors":0,"defaults_mismatch":0,"range_inverted":0,"unbacked_claims":0,"http_not_https":0,"heading_skip":0,"frontmatter":0,"wordcount":4195},"status":"keep","description":"Iter 24 (frontmatter description sync). The description still claimed '9-second L0 stalls' from before iter 4's re-measurement (actual median is 13.8 s). Also reframed to lead with the 3.6× collapse so the description reads as a thesis statement rather than a number recital. New description (198 chars, in 100-220 range): 'BadgerDB's writer path from memtable through L0→L6, the compaction-priority calculation, and a Mac M3 Max benchmark hitting 1M ops/s — until 1 KB values drop it 3.6× into 13.8-second L0 stalls.' Same word count 4195. defects 0.","timestamp":1778321796282,"segment":6}
{"run":26,"commit":"b8e26e0","metric":0,"metrics":{"build_warnings":0,"wordcount_off":0,"missing_code_paths":0,"weak_snippets":0,"numbers_no_math":0,"percent_no_math":0,"hedge_words":0,"placeholder_urls":0,"inconsistent_idents":0,"unbacked_claims":0,"broken_post_links":0,"wordcount":4519},"status":"keep","description":"Iter 25 (Closing claim accuracy: TLA+ is recent, not 12 years old). The closing said the correctness story is what 12 years of CI and TLA+ checks buy you. CI is indeed since 2014, but the TLA+ trace-validation work in cached repo (commit 195edd6) is from 2024, not 2014. Reframed: a decade of CI plus the more recent TLA+ trace-validation work. Same point, accurate timeline. Defects 0; wordcount 4517 to 4519.","timestamp":1778321813218,"segment":6}
{"run":32,"commit":"93ceccb","metric":0,"metrics":{"build_warnings":0,"wordcount_off":0,"vague_claims":0,"missing_code_paths":0,"unverified_snippets":0,"weak_snippets":0,"numbers_no_math":0,"tilde_no_math":0,"percent_no_math":0,"ratio_no_citation":0,"missing_citations":0,"marketing_words":0,"hedge_words":0,"placeholder_urls":0,"inconsistent_idents":0,"footnote_balance":0,"math_off":0,"dollar_no_math":0,"bad_anchors":0,"frontmatter":0,"wordcount":4666},"status":"keep","description":"Iter 41 (precision fix on §6 'shard count stays fixed' overclaim). Original prose: \"Citus picks the shard placement at that moment and the shard count stays fixed.\" But verified in source: alter_distributed_table accepts a shard_count parameter (sql/udfs/alter_distributed_table/latest.sql) so shard count CAN be changed via that operator-level UDF — it just does a re-shard with locks and downtime. \"Stays fixed\" was false. Reworded: \"picks the shard count and placement at that moment. Changing either later requires deliberate operator action: alter_distributed_table(..., shard_count := N) to re-shard, or rebalance_table_shards() to move existing shards.\" More precise about WHAT can be changed and WHAT it costs. defects 0 → 0; wordcount 4650 → 4666.","timestamp":1778321815373,"segment":6}
{"run":30,"commit":"467a803","metric":0,"metrics":{"build_warnings":0,"wordcount_off":0,"vague_claims":0,"missing_code_paths":0,"unverified_snippets":0,"weak_snippets":0,"numbers_no_math":0,"tilde_no_math":0,"percent_no_math":0,"ratio_no_citation":0,"missing_citations":0,"marketing_words":0,"hedge_words":0,"placeholder_urls":0,"inconsistent_idents":0,"footnote_balance":0,"math_off":0,"dollar_no_math":0,"bad_anchors":0,"defaults_mismatch":0,"range_inverted":0,"unbacked_claims":0,"http_not_https":0,"heading_skip":0,"broken_post_links":0,"missing_sections":0,"bad_commit_refs":0,"dupe_words":0,"broken_rendered_links":0,"frontmatter":0,"wordcount":4689},"status":"keep","description":"Iter 29 (audit pass — sharpened the etcd-uses-bbolt motivation). Previous wording: \"Etcd ships go.etcd.io/bbolt as a direct dependency for tooling reasons — same single-writer constraint shape, easier ops in the Go ecosystem.\" \"For tooling reasons\" understated the actual motivation. Etcd needs a transactional crash-safe KV store; bbolt provides that with the LMDB-style single-writer guarantee. Pure Go is the ergonomic win. Reworded: \"as its on-disk store: same single-writer constraint shape as LMDB, but staying in pure Go avoids cgo and gives etcd's operators a self-contained binary that ships, fuzzes, and migrates inside the Go toolchain.\" Now the \"why\" is clear (transactional store + pure-Go ergonomics) rather than the vague \"tooling reasons\". Defects 0; wordcount 4673 → 4689.","timestamp":1778321817260,"segment":6}
{"run":53,"commit":"08c0af1","metric":0,"metrics":{"build_warnings":0,"missing_code_paths":0,"unverified_snippets":0,"unverified_literal":0,"numbers_no_math":0,"missing_citations":0,"marketing_words":0,"frontmatter":0,"bad_url_anchor":0,"bad_commit_ref":0,"factlib_size_drift":0,"wal_record_overhead_off":0,"fabricated_production":0,"loc_drift":0,"orders_of_magnitude":0,"bad_section_xref":0,"long_code_lines":0,"heading_skip":0,"bad_anchor_link":0,"license_claim":0,"gofmt":0,"fence_balance":0,"duplicate_paragraph":0,"numbered_list_gap":0,"github_line_ref":0,"digit_claim":0,"wordcount":4975},"status":"keep","description":"Iter 55 (overhead estimate refinement). §8 'Function call overhead' said '~10–20 µs for the function dispatch'. PostgreSQL's per-function-call overhead for built-in C functions is typically a few microseconds (1-5 µs), not 10-20. SQL/PL functions are slower. Verified pg_logical_emit_message_bytea is a built-in C function (registered in pg_proc.dat as `prosrc => 'pg_logical_emit_message_bytea'`). Updated to 'A few µs for the C function dispatch (built-in, not SQL/PL/pgSQL)' — more accurate, also implicitly explains why the cost is so low. Wordcount 4963 → 4975.","timestamp":1778321821644,"segment":4}
{"run":42,"commit":"1bed5ad","metric":0,"metrics":{"build_warnings":0,"wordcount_off":0,"vague_claims":0,"missing_code_paths":0,"unverified_snippets":0,"weak_snippets":0,"numbers_no_math":0,"tilde_no_math":0,"percent_no_math":0,"ratio_no_citation":0,"missing_citations":0,"marketing_words":0,"hedge_words":0,"placeholder_urls":0,"inconsistent_idents":0,"footnote_balance":0,"math_off":0,"dollar_no_math":0,"bad_anchors":0,"defaults_mismatch":0,"range_inverted":0,"unbacked_claims":0,"http_not_https":0,"heading_skip":0,"broken_post_links":0,"missing_sections":0,"bad_commit_refs":0,"dupe_words":0,"broken_rendered_links":0,"loc_drift":0,"frontmatter":0,"wordcount":5474},"status":"keep","description":"Iter 42 (wiring snippet alignment): the §2 main.go wiring snippet had decorative space-padding (\"repl       := ...\", \"ackCh    := ...\"), which broke verbatim-substring matching against source. Source uses single-space `name := value`. Cleaned the alignment so 8 of 12 body lines now match source verbatim (was 2). Also restructured the multi-line BatchProcessor call to match the natural Go style with each argument on its own line (matches source's actual aesthetic). The non-matching lines are still the abridged `go repl.Start(...)` (source wraps it in `go func() { if err := ...; err != nil { log.Fatal } }()`) and `_ = rb.Start(...)` (source has `if err := ...; err != nil`) — those are genuine abridgements marked with the \"(abridged)\" comment. defects 0 → 0; wordcount 5474 unchanged.","timestamp":1778321844426,"segment":4}
{"run":48,"commit":"b1026da","metric":0,"metrics":{"vague_claims":0,"ratio_no_citation":0,"marketing_words":0,"hedge_words":0,"weak_snippets":0,"missing_code_paths":0,"math_off":0,"wordcount":5402,"unverified_snippets":0,"missing_citations":0,"numbers_no_math":0,"frontmatter":0},"status":"keep","description":"Iter 48 (auto-vectorizer claim correction in §4.3). My prose claimed the half-precision path hand-rolls AVX 'because the auto-vectorizer doesnt know how to use F16C'. That's wrong — GCC 4.9+ and Clang 3.4+ DO auto-vectorize F16C if -mf16c is on. Pgvector chose to hand-roll for runtime-dispatch control: machines without F16C use a default scalar fallback (HalfvecL2SquaredDistanceDefault), and machines with F16C use the AVX path (HalfvecL2SquaredDistanceF16c selected via __cpuid). Reworded: 'explicit F16C-based fp16→fp32 conversion ... runtime-dispatched via __cpuid so machines without F16C fall back to a default scalar implementation'. The actual reason is correct now. Wordcount 5402; defects 0.","timestamp":1778321858320,"segment":6}
{"run":27,"commit":"1b7d8c2","metric":0,"metrics":{"build_warnings":0,"wordcount_off":0,"missing_code_paths":0,"weak_snippets":0,"numbers_no_math":0,"percent_no_math":0,"hedge_words":0,"placeholder_urls":0,"inconsistent_idents":0,"unbacked_claims":0,"broken_post_links":0,"wordcount":4530},"status":"keep","description":"Iter 26 (overstatement softened in Step 4). Previous claim was Every other Raft subtle bug descends from getting this check wrong. Too strong - many real Raft bugs are about joint configs, snapshot leftover, async storage, not isUpToDate. Softened to A surprising number of subtle Raft bugs - particularly around log overwrite during view change - descend from getting this check wrong or weakening it under the wrong invariant. Same emphasis (this is the safety property) without overclaiming. Defects 0; wordcount 4519 to 4530.","timestamp":1778321868363,"segment":6}
{"run":16,"commit":"c72747a","metric":0,"metrics":{"build_warnings":0,"wordcount_off":0,"vague_claims":0,"missing_code_paths":0,"unverified_snippets":0,"weak_snippets":0,"numbers_no_math":0,"tilde_no_math":0,"percent_no_math":0,"ratio_no_citation":0,"missing_citations":0,"marketing_words":0,"hedge_words":0,"placeholder_urls":0,"inconsistent_idents":0,"footnote_balance":0,"math_off":0,"dollar_no_math":0,"bad_anchors":0,"defaults_mismatch":0,"range_inverted":0,"unbacked_claims":0,"http_not_https":0,"heading_skip":0,"broken_post_links":0,"missing_sections":0,"bad_commit_refs":0,"dupe_words":0,"broken_rendered_links":0,"loc_drift":0,"frontmatter":0,"wordcount":4201},"status":"keep","description":"Iter 16 (deferred-ideas backlog written): 0 defects held. Wrote .autoresearch/duckdb-vectorized-execution/autoresearch.ideas.md (the per-post deferred ideas file) capturing: (a) reviewer-visible improvements the metric won't catch (custom OG image, cold-cache benchmark, EXPLAIN ANALYZE for Q01/Q06, ClickHouse/DataFusion comparison appendix, PERFECT_HASH_GROUP_BY explainer, CSV ingest tradeoff, ATTACH 'pg:...' integration), (b) scorer false positives and workarounds (3-operand math chains, date range parsing, hedge-word triggers, equality precision tolerance), (c) reasoning for stopping at 15 iters at the metric floor (cycles 5-15 fixed real factual bugs the metric didn't surface; continuing would risk over-polishing prose). This matches the .autoresearch/factlib/autoresearch.ideas.md pattern. No changes to the post. Wordcount 4201 unchanged. Defects 0.","timestamp":1778321874055,"segment":6}
{"run":31,"commit":"818a7c1","metric":0,"metrics":{"build_warnings":0,"wordcount_off":0,"vague_claims":0,"missing_code_paths":0,"unverified_snippets":0,"weak_snippets":0,"numbers_no_math":0,"tilde_no_math":0,"percent_no_math":0,"ratio_no_citation":0,"missing_citations":0,"marketing_words":0,"hedge_words":0,"placeholder_urls":0,"inconsistent_idents":0,"footnote_balance":0,"math_off":0,"dollar_no_math":0,"bad_anchors":0,"defaults_mismatch":0,"range_inverted":0,"unbacked_claims":0,"http_not_https":0,"heading_skip":0,"broken_post_links":0,"missing_sections":0,"bad_commit_refs":0,"dupe_words":0,"broken_rendered_links":0,"frontmatter":0,"wordcount":4690},"status":"keep","description":"Iter 30 (audit pass — §5.1 tree-depth math correction). The previous claim \"Tree depth = ceil(log_170(22000)) = 2 (root → leaf), so each Get is 2 page walks\" was off by one. log_170(22000) = 1.95 → ceil = 2 *internal* levels above the leaves, so the actual page-walk path is `root → branch → leaf` = 3 page accesses. The mistake was conflating \"internal levels\" with \"total walks\". Updated: \"Need ceil(log_170(22000)) = 2 levels of branches above the leaves, so each Get is `root → branch → leaf` = 3 page accesses\". Math: 3 × ~100 ns + ~100 ns binary-search ≈ 400 ns ≈ measured 430-459 ns. Tolerance is napkin-level so the 400 vs 430-459 still fits, and the per-page cost is now 100 ns (cache-line) instead of 150 ns (mid-line guess) — slightly tighter. Defects 0; wordcount 4689 → 4690.","timestamp":1778321880798,"segment":6}
{"run":49,"commit":"8447da7","metric":0,"metrics":{"vague_claims":0,"ratio_no_citation":0,"marketing_words":0,"hedge_words":0,"weak_snippets":0,"missing_code_paths":0,"math_off":0,"wordcount":5402,"unverified_snippets":0,"missing_citations":0,"numbers_no_math":0,"frontmatter":0},"status":"keep","description":"Iter 49 (autoresearch.ideas.md updated for iters 45-48). Recorded latest closed audit items: visited-set semantics (TID is persistent within ONE HnswSearchLayer call's inner loop, not across layer descents), search-class correction (best-first with priority queue, not breadth-first), F16C hand-roll rationale (runtime cpuid dispatch with scalar fallback, not auto-vectorizer limitation). Wordcount 5402; defects 0 across 28 dimensions.","timestamp":1778321904593,"segment":6}
{"run":28,"commit":"d8735c0","metric":0,"metrics":{"build_warnings":0,"wordcount_off":0,"missing_code_paths":0,"weak_snippets":0,"numbers_no_math":0,"percent_no_math":0,"hedge_words":0,"placeholder_urls":0,"inconsistent_idents":0,"unbacked_claims":0,"broken_post_links":0,"wordcount":4538},"status":"keep","description":"Iter 27 (order-statistic formula made explicit). The previous expected-wait formula 1.0 s + (1.0 s)/3 was approximately right but used 1.0 as the band width when the band width is actually 0.999 (the closed lower bound included). Replaced with the explicit formula E[min] = a + (b - a)/(k + 1) for k iid U(a, b), substituted with a=1.0 b=1.999 k=2 to give 1.0 s + 0.999 s / 3 approximately 1.333 s. Same final number; reader who wants to verify the napkin math now has the formula with no rounding shortcut. Defects 0; wordcount 4530 to 4538.","timestamp":1778321906412,"segment":6}
{"run":48,"commit":"7c60db5","metric":0,"metrics":{"build_warnings":0,"wordcount_off":0,"vague_claims":0,"missing_code_paths":0,"unverified_snippets":0,"weak_snippets":0,"numbers_no_math":0,"tilde_no_math":0,"percent_no_math":0,"ratio_no_citation":0,"missing_citations":0,"marketing_words":0,"hedge_words":0,"placeholder_urls":0,"inconsistent_idents":0,"footnote_balance":0,"math_off":0,"dollar_no_math":0,"bad_anchors":0,"frontmatter":0,"unbacked_claims":0,"wordcount":4600},"status":"keep","description":"Iter 48 (correctness — drop the 50-line claim that didnt match). The post had 5 references to a 50-line reproducer but the actual snippet is 46 lines (not counting the closing fence). Either I needed to extend the snippet to exactly 50 or update the references. Updated all 5 references: 50-line cut-down is below in Stretch became compact reproducer is below in Stretch. The Stretch heading went from 50-line reproducer to Compact reproducer. The bench-snippet path comment went from 50-line reproducer to 45-line minimal reproducer (46 lines minus the comment line approximation). The expected-output paragraph went from The 50-line variant to The compact variant. Reader opening the snippet now sees an honest line count. wordcount 4599 to 4600.","timestamp":1778321917165,"segment":6}
{"run":25,"commit":"277e011","metric":0,"metrics":{"build_warnings":0,"wordcount_off":0,"vague_claims":0,"missing_code_paths":0,"unverified_snippets":0,"weak_snippets":0,"numbers_no_math":0,"tilde_no_math":0,"percent_no_math":0,"ratio_no_citation":0,"missing_citations":0,"marketing_words":0,"hedge_words":0,"placeholder_urls":0,"inconsistent_idents":0,"footnote_balance":0,"math_off":0,"dollar_no_math":0,"bad_anchors":0,"defaults_mismatch":0,"range_inverted":0,"unbacked_claims":0,"http_not_https":0,"heading_skip":0,"frontmatter":0,"wordcount":4214},"status":"keep","description":"Iter 25 (per-call latency re-measurement with median + variability disclosure). The latency numbers from iter 8 were single-run results: '1M × 128 B p99=16us p99.9=26us; 1M × 1 KB p99=25us p99.9=646us; -b 100 p99.9=7.3ms'. Re-ran 3x on each config and discovered the p99.9 is much noisier than I'd reported. New medians: 1M × 128 B p50=5us p99=19us p99.9=30us; 1M × 1 KB p99=22us p99.9=48us; 1M × 1 KB -b 100 p50=96us p99=167us p99.9=1.87ms / 950K ops/s. Updated the paragraph with median numbers and explicit variability disclosure: 'The p99.9 is run-to-run noisy (one of three runs hit 1.4 ms p99.9 on a workload whose other two runs sat at 30 µs — the L0 stall transitions can land anywhere in the 1M-entry sequence)'. The qualitative claim 'WriteBatch trades p99.9 for ops/s' still holds (5–10× throughput at the cost of higher p99.9). Wordcount 4195 → 4214. defects 0.","timestamp":1778321917903,"segment":6}
