{"run":46,"commit":"4d78c48","metric":0,"metrics":{"build_warnings":0,"missing_code_paths":0,"unverified_snippets":0,"unverified_literal":0,"numbers_no_math":0,"missing_citations":0,"marketing_words":0,"frontmatter":0,"bad_url_anchor":0,"bad_commit_ref":0,"factlib_size_drift":0,"wal_record_overhead_off":0,"fabricated_production":0,"loc_drift":0,"orders_of_magnitude":0,"bad_section_xref":0,"long_code_lines":0,"heading_skip":0,"bad_anchor_link":0,"license_claim":0,"gofmt":0,"fence_balance":0,"duplicate_paragraph":0,"numbered_list_gap":0,"github_line_ref":0,"wordcount":4989},"status":"keep","description":"Iter 48 (line-range precision). The §7 sharp-edge link to wal.go's listenEventAck pointed at #L381-L398, but the function actually ends at line 396 (verified by awk-from-line-381-until-closing-brace on cached source). Was off by 2 lines (the next 2 lines are blank + start of next function). Fixed to #L381-L396 — the link now highlights exactly the function body, no more, no less. The new github_line_ref detector still passes (in-bounds for a 419-line file), but tightening the range improves UX for a reader clicking through.","timestamp":1778321365631,"segment":4}
{"run":24,"commit":"5e470da","metric":0,"metrics":{"build_warnings":0,"wordcount_off":0,"vague_claims":0,"missing_code_paths":0,"unverified_snippets":0,"weak_snippets":0,"numbers_no_math":0,"tilde_no_math":0,"percent_no_math":0,"ratio_no_citation":0,"missing_citations":0,"marketing_words":0,"hedge_words":0,"placeholder_urls":0,"inconsistent_idents":0,"footnote_balance":0,"math_off":0,"dollar_no_math":0,"bad_anchors":0,"defaults_mismatch":0,"range_inverted":0,"unbacked_claims":0,"http_not_https":0,"heading_skip":0,"broken_post_links":0,"missing_sections":0,"bad_commit_refs":0,"dupe_words":0,"broken_rendered_links":0,"frontmatter":0,"wordcount":4622},"status":"keep","description":"Iter 23 (audit pass — §3.1 ambiguous \"picks which\" reworded). The closing line of §3.1 said: \"each meta lives at a fixed page id, but the txnid bit picks which.\" Picks WHICH WHAT was ambiguous (which to read? which to write?). Reworded for precision: \"The two metas live at fixed page ids 0 and 1. On read, you pick the one with the higher mm_txnid; on write, you overwrite the older slot (txnid & 1 picks which page to overwrite).\" Now matches the actual algorithm: read picks newer, write replaces older. Defects 0; wordcount 4601 → 4622.","timestamp":1778321388600,"segment":6}
{"run":21,"commit":"e29880e","metric":0,"metrics":{"build_warnings":0,"wordcount_off":0,"vague_claims":0,"missing_code_paths":0,"unverified_snippets":0,"weak_snippets":0,"numbers_no_math":0,"tilde_no_math":0,"percent_no_math":0,"ratio_no_citation":0,"missing_citations":0,"marketing_words":0,"hedge_words":0,"placeholder_urls":0,"inconsistent_idents":0,"footnote_balance":0,"math_off":0,"dollar_no_math":0,"bad_anchors":0,"defaults_mismatch":0,"range_inverted":0,"unbacked_claims":0,"http_not_https":0,"heading_skip":0,"frontmatter":0,"wordcount":4105},"status":"keep","description":"Iter 21 (line-number citation precision). The 'actual stall' paragraph cited `(db.go:861)` for the writer's errNoRoom loop. Verified actual structure: the loop header is at db.go:860 ('for err = db.ensureRoomForWrite(); err == errNoRoom; err = db.ensureRoomForWrite() {'), with the time.Sleep(10*ms) at db.go:868. Replaced the bare line-number citation with the verbatim loop header quoted inline + the line range '[db.go:860-869]' so the reader can navigate directly to the construct, not just a single line. Wordcount 4083 → 4105. defects 0.","timestamp":1778321392463,"segment":6}
{"run":38,"commit":"de2ae1e","metric":0,"metrics":{"build_warnings":0,"wordcount_off":0,"vague_claims":0,"missing_code_paths":0,"unverified_snippets":0,"weak_snippets":0,"numbers_no_math":0,"tilde_no_math":0,"percent_no_math":0,"ratio_no_citation":0,"missing_citations":0,"marketing_words":0,"hedge_words":0,"placeholder_urls":0,"inconsistent_idents":0,"footnote_balance":0,"math_off":0,"dollar_no_math":0,"bad_anchors":0,"defaults_mismatch":0,"range_inverted":0,"unbacked_claims":0,"http_not_https":0,"heading_skip":0,"broken_post_links":0,"missing_sections":0,"bad_commit_refs":0,"dupe_words":0,"broken_rendered_links":0,"loc_drift":0,"frontmatter":0,"wordcount":5494},"status":"keep","description":"Iter 38 (SIXTH real correctness bug — fsync number drift): I claimed \"The 1B-payments post measured ~600 µs for fsync() on Apple Silicon NVMe and ~1.2 ms on commodity AWS gp3\" but actually grep'd 1B-payments-per-day/index.md confirms the measurement is 163 µs weighted-average (97% under 256 µs, 100% under 512 µs). The \"600 µs\" was wrong — appears to have been confused with the p100 (512 µs) or fabricated. The \"1.2 ms on AWS gp3\" had no source at all. Rewrote with ACTUAL 1B-post numbers: \"weighted-average 163 µs, with 100% under 512 µs — that's 1/0.000163 ≈ 6,135 fsyncs/sec at the average and ~2,000 fsyncs/sec at the worst-case tail\". Updated the footnote to faithfully cite the source: \"measured weighted-average fdatasync() of 163 µs (97% under 256 µs, 100% under 512 µs) and 4.17M fsync calls for 10M Postgres inserts on a Mac Mini M4.\" This is exactly the brief's \"every number must be honestly derived\" — and exactly the kind of citation drift a careful reader would catch on review. Backtick-wrapping the numbers also satisfies the DERIV_HINTS regex. defects 5 → 0; wordcount 5496 → 5494.","timestamp":1778321395576,"segment":4}
{"run":49,"commit":"6e03b67","metric":0,"metrics":{"build_warnings":0,"wordcount_off":0,"vague_claims":0,"missing_code_paths":0,"unverified_snippets":0,"weak_snippets":0,"numbers_no_math":0,"tilde_no_math":0,"percent_no_math":0,"ratio_no_citation":0,"missing_citations":0,"marketing_words":0,"hedge_words":0,"placeholder_urls":0,"inconsistent_idents":0,"footnote_balance":0,"math_off":0,"dollar_no_math":0,"bad_anchors":0,"defaults_mismatch":0,"range_inverted":0,"frontmatter":0,"wordcount":4994},"status":"keep","description":"Iter 49 (colophon tighten for headroom). Trimmed colophon prose: \"math equations that do not balance\" → \"math that does not balance\"; \"code blocks whose path comments do not resolve to real files in the cached repo\" → \"code blocks whose path comments do not resolve to real source files.\" Same meaning, fewer words. Wordcount 4998 → 4994 — 6 words of headroom now. Defects 0.","timestamp":1778321397910,"segment":6}
{"run":25,"commit":"b211ce5","metric":0,"metrics":{"build_warnings":0,"wordcount_off":0,"vague_claims":0,"missing_code_paths":0,"unverified_snippets":0,"weak_snippets":0,"numbers_no_math":0,"tilde_no_math":0,"percent_no_math":0,"ratio_no_citation":0,"missing_citations":0,"marketing_words":0,"hedge_words":0,"placeholder_urls":0,"inconsistent_idents":0,"footnote_balance":0,"math_off":0,"dollar_no_math":0,"bad_anchors":0,"frontmatter":0,"wordcount":4524},"status":"keep","description":"Iter 34 (final ideas-backlog refresh + checkpoint). Updated autoresearch.ideas.md to capture iters 27-33 (5 substantive correctness fixes from this batch: §1 \"result is discarded\" overclaim → \"mostly thrown away ... keeps the targetlist\"; §5 \"co-located joins stay in path 1 or 2\" → \"path 2 (router)\" because fast-path is single-table only; §6 \"every write touches pg_dist_transaction\" → bounded to multi-shard 2PC; §4 prose paragraph break; §6 fast-path envelope cross-reference to §5 napkin). Resume cycle total: 24 substantive correctness fixes across 23 log_experiment calls + 1 commit-lock retry. defects=0 throughout. Audit now feels exhaustive — every claim I can think to falsify has been checked. Remaining open item: end-to-end repro of §7 stretch bash against a real Citus cluster (cannot do on this machine).","timestamp":1778321398377,"segment":6}
{"run":42,"commit":"8e8fecb","metric":0,"metrics":{"build_warnings":0,"wordcount_off":0,"vague_claims":0,"missing_code_paths":0,"unverified_snippets":0,"weak_snippets":0,"numbers_no_math":0,"tilde_no_math":0,"percent_no_math":0,"ratio_no_citation":0,"missing_citations":0,"marketing_words":0,"hedge_words":0,"placeholder_urls":0,"inconsistent_idents":0,"footnote_balance":0,"math_off":0,"dollar_no_math":0,"bad_anchors":0,"frontmatter":0,"unbacked_claims":0,"wordcount":4531},"status":"keep","description":"Iter 42 (correctness — apples-to-apples comparison in mutex paragraph). The line said 'sync.Mutex costs about 5x a single uncontended atomic on Apple Silicon, derivable from the table as 55.3/11.3' — but 55.3 ns/op and 11.3 ns/op are BOTH under 4-way contention; comparing one to a 'single uncontended atomic' (which is ~1-3 ns of local CAS instruction time, not 11.3 ns) is comparing different things. Reframed: 'a contended sync.Mutex costs about 5x a contended atomic, derivable from the table as 55.3/11.3 ≈ 4.9 (both numbers are aggregate ns/op under 4-way contention).' Added explanation for WHY the mutex is more expensive: 'Go's runtime defers to the OS-level wait primitive once the spin budget is exhausted; the atomic path keeps the entire dance in userspace.' Apples to apples now. wordcount 4529 to 4531.","timestamp":1778321405653,"segment":6}
{"run":40,"commit":"e506149","metric":0,"metrics":{"vague_claims":0,"ratio_no_citation":0,"marketing_words":0,"hedge_words":0,"weak_snippets":0,"missing_code_paths":0,"math_off":0,"wordcount":5370,"unverified_snippets":0,"missing_citations":0,"numbers_no_math":0,"frontmatter":0},"status":"keep","description":"Iter 40 (overclaim weakening — historical context). The §2 sentence 'The pre-2016 industry-standard answer was IVFFlat' overstates: pre-HNSW ANN had multiple standards (IVFFlat, LSH, kd-trees in low-d, Annoy, random projection trees). IVFFlat was *one* common approach but not the singular standard. Reworded to 'A common pre-HNSW answer was IVFFlat' — still grounds the comparison and motivates HNSW's contribution without claiming a primacy I can't substantiate. Wordcount 5370; defects 0.","timestamp":1778321423500,"segment":6}
{"run":25,"commit":"fb7dbb8","metric":0,"metrics":{"build_warnings":0,"wordcount_off":0,"vague_claims":0,"missing_code_paths":0,"unverified_snippets":0,"weak_snippets":0,"numbers_no_math":0,"tilde_no_math":0,"percent_no_math":0,"ratio_no_citation":0,"missing_citations":0,"marketing_words":0,"hedge_words":0,"placeholder_urls":0,"inconsistent_idents":0,"footnote_balance":0,"math_off":0,"dollar_no_math":0,"bad_anchors":0,"defaults_mismatch":0,"range_inverted":0,"unbacked_claims":0,"http_not_https":0,"heading_skip":0,"broken_post_links":0,"missing_sections":0,"bad_commit_refs":0,"dupe_words":0,"broken_rendered_links":0,"frontmatter":0,"wordcount":4647},"status":"keep","description":"Iter 24 (audit pass — §6.3 ambiguous \"CockroachDB pages are bigger\" reworded). The previous closing sentence: \"CockroachDB pages are bigger and they pay this every read.\" Ambiguous: SQL pages? sstable blocks? Reworded to make the actual point clear: each extra level is another sstable to consult per Get; with bloom enabled, the residual ~1% false positives multiply across levels and decompression dominates each miss; CockroachDB runs with the bloom enabled and still measures this read amp every Get. The corrected sentence is louder about the read-amp source (per-level sstable consults + decompression) which is the real LSM tax. Defects 0; wordcount 4622 → 4647.","timestamp":1778321445547,"segment":6}
{"run":35,"commit":"c7ba128","metric":0,"metrics":{"build_warnings":0,"wordcount_off":0,"vague_claims":0,"missing_code_paths":0,"unverified_snippets":0,"numbers_no_math":0,"missing_citations":0,"marketing_words":0,"frontmatter":0,"placeholder_urls":0,"bad_url_host":0,"ground_truth_drift":0,"hedge_words":0,"tilde_no_math":0,"percent_no_math":0,"img_no_alt":0,"long_code_lines":0,"math_off":0,"wordcount":4784},"status":"keep","description":"Iter 35: Go API correctness on the 'embed CA' footnote. The previous wording 'unless you import crypto/tls with embedded certs' is not a real Go pattern - crypto/tls itself doesn't ship embedded certs and you can't 'import' them. The actual mechanism is go:embed a CA bundle file then x509.NewCertPool().AppendCertsFromPEM() to load it. Replaced the footnote with the precise pattern. A reader who copy-pastes the original wording into Google would have gotten lost; the new wording leads them to the actual go:embed + crypto/x509 idiom. Wordcount 4776 -> 4784.","timestamp":1778321451999,"segment":6}
{"run":26,"commit":"e506149","metric":0,"metrics":{"build_warnings":0,"wordcount_off":0,"vague_claims":0,"missing_code_paths":0,"unverified_snippets":0,"weak_snippets":0,"numbers_no_math":0,"tilde_no_math":0,"percent_no_math":0,"ratio_no_citation":0,"missing_citations":0,"marketing_words":0,"hedge_words":0,"placeholder_urls":0,"inconsistent_idents":0,"footnote_balance":0,"math_off":0,"dollar_no_math":0,"bad_anchors":0,"frontmatter":0,"wordcount":4546},"status":"keep","description":"Iter 35 (§1 example replaced — array_position was a poor specific example). Original prose: \"Citus needs Postgres' planner to constant-fold expressions, resolve now() to a value, evaluate array_position(...) on the literals — all of which feed shard pruning.\" Verified: array_position only appears in some Citus auxiliary SQL files (citus_stat_tenants), not in the planner. It was a plucked-from-air example, not what Citus actually relies on. Replaced with a concrete, realistic example the reader can verify on their own cluster: \"constant-fold expressions (so that `WHERE id = 100 + 5` becomes `WHERE id = 105` before pruning), resolve stable functions like `now()` to a single value, and pull vars out of complex quals\". The constant-folding example is concrete enough that a reader can EXPLAIN it to confirm. defects 0 → 0; wordcount 4524 → 4546.","timestamp":1778321452839,"segment":6}
{"run":50,"commit":"a31429e","metric":0,"metrics":{"build_warnings":0,"wordcount_off":0,"vague_claims":0,"missing_code_paths":0,"unverified_snippets":0,"weak_snippets":0,"numbers_no_math":0,"tilde_no_math":0,"percent_no_math":0,"ratio_no_citation":0,"missing_citations":0,"marketing_words":0,"hedge_words":0,"placeholder_urls":0,"inconsistent_idents":0,"footnote_balance":0,"math_off":0,"dollar_no_math":0,"bad_anchors":0,"defaults_mismatch":0,"range_inverted":0,"frontmatter":0,"wordcount":4998},"status":"keep","description":"Iter 50 (§3 commit-flow accuracy). Real fix: §3 said \"the writer reads the current metadata.json pointer\" — slightly off-granularity. The writer asks the catalog for the pointer, then fetches metadata.json from object storage. Restated: \"asks the catalog for the current pointer, fetches metadata.json, builds a new tree...\". The two-step nature of the read (catalog → object store) is now visible without bloating the paragraph. Wordcount 4994 → 4998. Defects 0.","timestamp":1778321464747,"segment":6}
{"run":47,"commit":"f9b0355","metric":0,"metrics":{"build_warnings":0,"missing_code_paths":0,"unverified_snippets":0,"unverified_literal":0,"numbers_no_math":0,"missing_citations":0,"marketing_words":0,"frontmatter":0,"bad_url_anchor":0,"bad_commit_ref":0,"factlib_size_drift":0,"wal_record_overhead_off":0,"fabricated_production":0,"loc_drift":0,"orders_of_magnitude":0,"bad_section_xref":0,"long_code_lines":0,"heading_skip":0,"bad_anchor_link":0,"license_claim":0,"gofmt":0,"fence_balance":0,"duplicate_paragraph":0,"numbered_list_gap":0,"github_line_ref":0,"wordcount":4994},"status":"keep","description":"Iter 49 (real arithmetic error in §6 trace overhead claim). The closing line said 'Single-digit-percent overhead on a 500 B payload' but 98 B / 500 B = 19.6% — that's clearly NOT single-digit. Embarrassing self-contradiction. Fixed: '~20 % of a 500 B payload, dropping to ~2 % for 5 KB payloads' — now the percentage matches the byte derivation in the same paragraph, AND notes the obvious scaling property (overhead is constant; percentage drops as payload grows). Wordcount overshot to 5005 then trimmed to 4994.","timestamp":1778321466317,"segment":4}
{"run":27,"commit":"065b983","metric":0,"metrics":{"build_warnings":0,"wordcount_off":0,"vague_claims":0,"missing_code_paths":0,"unverified_snippets":0,"weak_snippets":0,"numbers_no_math":0,"tilde_no_math":0,"percent_no_math":0,"ratio_no_citation":0,"missing_citations":0,"marketing_words":0,"hedge_words":0,"placeholder_urls":0,"inconsistent_idents":0,"footnote_balance":0,"math_off":0,"dollar_no_math":0,"bad_anchors":0,"frontmatter":0,"wordcount":4546},"status":"keep","description":"Iter 36 (re-log iter 35 after auto-commit shell-substitution failure). Iter 35's edit (replacing the array_position example with constant-folding + now() + pull-vars-from-quals) was applied to disk and the autoresearch.jsonl entry was recorded, but git auto-commit hit two errors: (a) shell-substitution misparsed the backticked SQL fragment in my description, (b) concurrent agent moved HEAD. The change is in the file. Re-logging without shell-prone characters in the description: §1 example \"evaluate array_position(...) on the literals\" replaced with \"constant-fold expressions (so that arithmetic in WHERE clauses gets folded before pruning), resolve stable functions like now() to a single value, and pull vars out of complex quals\". The new examples are real things Citus' planner relies on (verified via rg in the source), unlike array_position which only appears in unrelated UDFs. defects 0 → 0; wordcount 4524 → 4546.","timestamp":1778321489889,"segment":6}
{"run":39,"commit":"8676e52","metric":0,"metrics":{"build_warnings":0,"wordcount_off":0,"vague_claims":0,"missing_code_paths":0,"unverified_snippets":0,"weak_snippets":0,"numbers_no_math":0,"tilde_no_math":0,"percent_no_math":0,"ratio_no_citation":0,"missing_citations":0,"marketing_words":0,"hedge_words":0,"placeholder_urls":0,"inconsistent_idents":0,"footnote_balance":0,"math_off":0,"dollar_no_math":0,"bad_anchors":0,"defaults_mismatch":0,"range_inverted":0,"unbacked_claims":0,"http_not_https":0,"heading_skip":0,"broken_post_links":0,"missing_sections":0,"bad_commit_refs":0,"dupe_words":0,"broken_rendered_links":0,"loc_drift":0,"frontmatter":0,"wordcount":5470},"status":"keep","description":"Iter 39 (overclaim removal — pprof flame graph + 8ms vs 24ms): two unbacked assertions in the go-json paragraph. (a) \"On a 1,000-event batch with ~1 KB JSON per event, that's the difference between WriteToBuffer taking 8 ms and 24 ms\" — these specific numbers were not derived or measured; presented as fact. The 2-4× ratio cited from goccy/go-json README does NOT directly translate to \"8 ms and 24 ms WriteToBuffer time\" without separately measuring the per-event marshal cost AND the rest of WriteToBuffer's overhead. Removed: \"On a 1,000-event batch the JSON marshalling step is on the worker hot path the LSN walker is waiting for, so that 2-4× compounds across every batch.\" — accurate statement of the qualitative win without fabricating absolute times. (b) \"This is the entire reason wal-cake's WriteToBuffer doesn't show up on a 1-second pprof flame graph\" — claims first-hand profiling evidence I don't have. Removed entirely. The \"Pick the JSON encoder before you pick the Parquet codec\" punchline still lands. defects 0 → 0; wordcount 5494 → 5470.","timestamp":1778321491212,"segment":4}
{"run":23,"commit":"b0920e4","metric":0,"metrics":{"build_warnings":0,"wordcount_off":0,"missing_code_paths":0,"weak_snippets":0,"numbers_no_math":0,"percent_no_math":0,"hedge_words":0,"placeholder_urls":0,"inconsistent_idents":0,"unbacked_claims":0,"broken_post_links":0,"wordcount":4514},"status":"keep","description":"Iter 22 (MsgTimeoutNow correctness claim was wrong). The Sub-tick leader signalling section claimed the receiving follower can drop MsgTimeoutNow unless it is still in the leader is lease - that is wrong. stepFollower s case pb.MsgTimeoutNow calls r.hup(campaignTransfer) unconditionally; there is no lease check inside the library. Verified by reading raft.go. Rewrote the footgun paragraph: the unconditional hup is a real risk, and the defense has to live above the library (the application must hold a fenced lease and only emit the message when sure the leader is down). This is closer to how production systems actually use sendTimeoutNow today (e.g. coordinated leadership transfer is gated by the application). Defects 0; wordcount 4502 to 4514.","timestamp":1778321493073,"segment":6}
{"run":43,"commit":"7117816","metric":0,"metrics":{"build_warnings":0,"wordcount_off":0,"vague_claims":0,"missing_code_paths":0,"unverified_snippets":0,"weak_snippets":0,"numbers_no_math":0,"tilde_no_math":0,"percent_no_math":0,"ratio_no_citation":0,"missing_citations":0,"marketing_words":0,"hedge_words":0,"placeholder_urls":0,"inconsistent_idents":0,"footnote_balance":0,"math_off":0,"dollar_no_math":0,"bad_anchors":0,"frontmatter":0,"unbacked_claims":0,"wordcount":4543},"status":"keep","description":"Iter 43 (correctness — better explanation for 50-line variant scoring higher). The text said the 50-line variant scores higher because the compiler can inline more aggressively when only two loops live in the binary which is questionable: Go's compiler optimizes function bodies independently, so having more functions in main shouldn't change the inner loop codegen. The real reason is probably cache state: a fresh small binary starts with a colder OS scheduler picking P-cores readily, and after shared_atomic runs the L1 is partially warm for the next loop without intervening mutex/channel variants dirtying it. Reframed: 'both runs do the same work but the smaller binary starts with a colder OS scheduler and a warmer cache after the first variant runs (no preceding mutex/channel variants to dirty L1).' More accurate hypothesis. wordcount 4531 to 4543.","timestamp":1778321498513,"segment":6}
