{"run":22,"commit":"e61afe4","metric":0,"metrics":{"build_warnings":0,"wordcount_off":0,"vague_claims":0,"missing_code_paths":0,"unverified_snippets":0,"weak_snippets":0,"numbers_no_math":0,"tilde_no_math":0,"percent_no_math":0,"ratio_no_citation":0,"missing_citations":0,"marketing_words":0,"hedge_words":0,"placeholder_urls":0,"inconsistent_idents":0,"footnote_balance":0,"math_off":0,"dollar_no_math":0,"bad_anchors":0,"defaults_mismatch":0,"range_inverted":0,"unbacked_claims":0,"http_not_https":0,"heading_skip":0,"frontmatter":0,"wordcount":4157},"status":"keep","description":"Iter 22 (varied-values for tuned + ValueThreshold rows). The autoresearch.md TODO mentioned 'Re-running the tuned + ValueThreshold rows with VARIED values would produce more honest tuning numbers'. Did it. New rows: tuned-varied = 325,538 ops/s 0s stalls (vs identical 590,355); ValueThreshold=64 varied = 286,230 ops/s 0s stalls (vs identical 525,909). Both stay at 0 stalls because the scheduler change handles the L0 backpressure regardless of compressibility, but throughput drops 1.8x in both cases — pure compression-loss, not L0 stalls. Updated the table with the two new rows and the conclusion paragraph: 'Tuning the scheduler keeps the stall problem out of the way; the throughput hit is pure compression-savings vanishing.' Wordcount 4105 → 4157. defects 0. Also updated autoresearch.md with progress log + further-audit-dimension hints.","timestamp":1778321648235,"segment":6}
{"run":29,"commit":"0d19a47","metric":0,"metrics":{"build_warnings":0,"wordcount_off":0,"vague_claims":0,"missing_code_paths":0,"unverified_snippets":0,"weak_snippets":0,"numbers_no_math":0,"tilde_no_math":0,"percent_no_math":0,"ratio_no_citation":0,"missing_citations":0,"marketing_words":0,"hedge_words":0,"placeholder_urls":0,"inconsistent_idents":0,"footnote_balance":0,"math_off":0,"dollar_no_math":0,"bad_anchors":0,"defaults_mismatch":0,"range_inverted":0,"unbacked_claims":0,"http_not_https":0,"heading_skip":0,"broken_post_links":0,"missing_sections":0,"bad_commit_refs":0,"dupe_words":0,"broken_rendered_links":0,"frontmatter":0,"wordcount":4673},"status":"keep","description":"Iter 28 (audit pass — verify FillPercent=0.95 claim with actual measurement). The post claimed \"Set Bucket.FillPercent = 0.95... and the file shrinks to ~45 MiB\". I had napkin-math'd this but never measured. Wrote a 200K-record loop using `db.Update(... b.FillPercent = 0.95 ...)` on the same M2 machine. Measured: file size = 48 MiB (vs 96 MiB at default 0.5, vs LMDB's 42 MiB). Updated the post: \"the file is 48 MiB[^bench] (measured) — close to LMDB's 42 MiB.\" The exact number is now grounded in a real bench. Defects 0; wordcount 4669 → 4673.","timestamp":1778321657282,"segment":6}
{"run":51,"commit":"6eae109","metric":0,"metrics":{"build_warnings":0,"wordcount_off":0,"vague_claims":0,"missing_code_paths":0,"unverified_snippets":0,"weak_snippets":0,"numbers_no_math":0,"tilde_no_math":0,"percent_no_math":0,"ratio_no_citation":0,"missing_citations":0,"marketing_words":0,"hedge_words":0,"placeholder_urls":0,"inconsistent_idents":0,"footnote_balance":0,"math_off":0,"dollar_no_math":0,"bad_anchors":0,"defaults_mismatch":0,"range_inverted":0,"frontmatter":0,"wordcount":4998},"status":"keep","description":"Iter 51 (no-op — reverted addition that pushed over 5000-word ceiling). Tried adding a \"next ID to assign: 521\" callout to §4.2 but it pushed wordcount to 5023 (23 over the 5000 limit). Trimmed back. The ID-range claim \"500-520 belong to the manifest-list record\" is verifiable by reading ManifestFile.java directly, doesn't strictly need the inline comment. Wordcount 4998. Defects 0. The post is now in stable shape: 51 keep iterations across the audit, every category at 0, real measured manifest_length, real verified file paths and commit hashes, internally consistent binary-prefix arithmetic.","timestamp":1778321661776,"segment":6}
{"run":44,"commit":"f42ffa0","metric":0,"metrics":{"vague_claims":0,"ratio_no_citation":0,"marketing_words":0,"hedge_words":0,"weak_snippets":0,"missing_code_paths":0,"math_off":0,"wordcount":5382,"unverified_snippets":0,"missing_citations":0,"numbers_no_math":0,"frontmatter":0},"status":"keep","description":"Iter 44 (autoresearch.ideas.md final refresh). Recorded the audit close-out: iters 39-43 (Postgres page-layout precision, historical-claim weakening, MiB precision rollback to consistent KB, inline-script reproducibility honesty). Total closed: 25+ items across the resume cycle. Open items remain (per-page critical CSS, cross-CPU SIMD bench, 10M-row build, EXPLAIN demo, perf flamegraph) — all 'nice to have' beyond the brief's correctness scope. Wordcount 5382; defects 0.","timestamp":1778321662122,"segment":6}
{"run":30,"commit":"bbeb3c8","metric":0,"metrics":{"build_warnings":0,"wordcount_off":0,"vague_claims":0,"missing_code_paths":0,"unverified_snippets":0,"weak_snippets":0,"numbers_no_math":0,"tilde_no_math":0,"percent_no_math":0,"ratio_no_citation":0,"missing_citations":0,"marketing_words":0,"hedge_words":0,"placeholder_urls":0,"inconsistent_idents":0,"footnote_balance":0,"math_off":0,"dollar_no_math":0,"bad_anchors":0,"frontmatter":0,"wordcount":4650},"status":"keep","description":"Iter 39 (closing summary in §5 — paths-by-number → paths-by-name). After iter 38 reworked the §3 four-paths labels, the closing summary \"Co-located multi-table joins stay in path 2 (router)\" became inconsistent — path 2 is now \"router for multi-shard modify\" in §3, not co-located multi-table SELECT. The actual function for co-located multi-table SELECT that prunes to a single shard is CreateSingleTaskRouterSelectPlan (verified in multi_router_planner.c:270). Reworked the closing summary to use FUNCTION NAMES instead of path numbers: \"fast-path router (skips standard_planner) ... CreateSingleTaskRouterSelectPlan for co-located SELECTs ... multi-shard modify via the router ... multi-shard SELECT path (logical planner with aggregate split) ... repartition.\" Now reader following the post's own enumeration sees a consistent, function-name-anchored taxonomy. Reference-table collapse and recursive-planning collapses also reframed without path numbers. defects 0 → 0; wordcount 4621 → 4650.","timestamp":1778321663037,"segment":6}
{"run":50,"commit":"1c288f9","metric":0,"metrics":{"build_warnings":0,"missing_code_paths":0,"unverified_snippets":0,"unverified_literal":0,"numbers_no_math":0,"missing_citations":0,"marketing_words":0,"frontmatter":0,"bad_url_anchor":0,"bad_commit_ref":0,"factlib_size_drift":0,"wal_record_overhead_off":0,"fabricated_production":0,"loc_drift":0,"orders_of_magnitude":0,"bad_section_xref":0,"long_code_lines":0,"heading_skip":0,"bad_anchor_link":0,"license_claim":0,"gofmt":0,"fence_balance":0,"duplicate_paragraph":0,"numbered_list_gap":0,"github_line_ref":0,"digit_claim":0,"wordcount":4994},"status":"keep","description":"Iter 52 (handoff documentation). Updated .autoresearch/factlib/autoresearch.md with a 'Status (50+ iterations in)' section listing: defects 0 across 30 detectors, wordcount 4994/5000, all brief sections + stretches, ~14 named real bugs fixed in the post, 3 named real bugs in factlib upstream surfaced, and the full weighted detector list. Future sessions resuming this autoresearch loop have a clean handoff document instead of needing to re-derive context from autoresearch.jsonl. defects unchanged.","timestamp":1778321669117,"segment":4}
{"run":46,"commit":"9a9e35f","metric":0,"metrics":{"build_warnings":0,"wordcount_off":0,"vague_claims":0,"missing_code_paths":0,"unverified_snippets":0,"weak_snippets":0,"numbers_no_math":0,"tilde_no_math":0,"percent_no_math":0,"ratio_no_citation":0,"missing_citations":0,"marketing_words":0,"hedge_words":0,"placeholder_urls":0,"inconsistent_idents":0,"footnote_balance":0,"math_off":0,"dollar_no_math":0,"bad_anchors":0,"frontmatter":0,"unbacked_claims":0,"wordcount":4581},"status":"keep","description":"Iter 46 (precision — tradeoff #6 framing). The line said 'Tail latency under spillover is worse, not better' and asserted 'P99 under saturation is sharper for Scylla. P50 is much better.' as bare claims. Reframed: 'Tail latency at a hot partition is sharper, not flatter' (more accurate — it's specifically about hot keys, not general saturation), and softened the P50/P99 claim with 'typically wins' and 'against a hot key' qualifiers. Same observation, more honest about its scope (hot-key-specific, not general). wordcount 4566 to 4581.","timestamp":1778321671661,"segment":6}
{"run":45,"commit":"8de7ed3","metric":0,"metrics":{"vague_claims":0,"ratio_no_citation":0,"marketing_words":0,"hedge_words":0,"weak_snippets":0,"missing_code_paths":0,"math_off":0,"wordcount":5385,"unverified_snippets":0,"missing_citations":0,"numbers_no_math":0,"frontmatter":0},"status":"keep","description":"Iter 45 (clarification of tids visited-set rationale). My §4.2 phrasing 'the thing that survives between calls is the TID, since we re-read tuples each time' was ambiguous — did 'between calls' mean between layer-descent invocations (correct) or between Postgres scan calls (incorrect)? Reworded: 'the TID is the only stable handle when the elements aren't pinned in memory across the layer-descent calls'. Clearer that we're talking about the disk-path's three-call layer descent (entryPoint->level + 1 invocations of HnswSearchLayer), not the IndexAmRoutine's amgettuple call sequence. Wordcount 5385; defects 0.","timestamp":1778321685898,"segment":6}
{"run":23,"commit":"5ac27a9","metric":0,"metrics":{"build_warnings":0,"wordcount_off":0,"vague_claims":0,"missing_code_paths":0,"unverified_snippets":0,"weak_snippets":0,"numbers_no_math":0,"tilde_no_math":0,"percent_no_math":0,"ratio_no_citation":0,"missing_citations":0,"marketing_words":0,"hedge_words":0,"placeholder_urls":0,"inconsistent_idents":0,"footnote_balance":0,"math_off":0,"dollar_no_math":0,"bad_anchors":0,"defaults_mismatch":0,"range_inverted":0,"unbacked_claims":0,"http_not_https":0,"heading_skip":0,"frontmatter":0,"wordcount":4195},"status":"keep","description":"Iter 23 (architecture section enrichment). Counted prose-only words in the architecture-in-200-words section: 95 (vs brief target of 200). Added two technical-completeness sentences: (a) 'SSTables follow a standard block-and-index layout with per-table bloom filters and per-block CRC32C checksums' — bloom filters are real per y/bloom.go and CRC32C is real per pb/badgerpb4.proto; (b) 'A 256 MiB Ristretto-backed BlockCache (default per options.go:148) sits in front of SST block reads to keep hot blocks off disk' — verified default in options.go:148 'BlockCacheSize: 256 << 20'. Also clarified vlog 'reads page-fault into the kernel page cache' — accurate per the mmap behavior. Now the section covers: memtable, skiplist, sst+bloom+crc, vlog+mmap, discard mmap file, manifest, block cache. 7 components for ~135 words of prose. Wordcount 4157 → 4195. defects 0.","timestamp":1778321692872,"segment":6}
{"run":46,"commit":"7c57cb1","metric":0,"metrics":{"vague_claims":0,"ratio_no_citation":0,"marketing_words":0,"hedge_words":0,"weak_snippets":0,"missing_code_paths":0,"math_off":0,"wordcount":5396,"unverified_snippets":0,"missing_citations":0,"numbers_no_math":0,"frontmatter":0},"status":"keep","description":"Iter 46 (visited-set semantics correctness, second pass). Iter 45 said the visited-set survives 'across the layer-descent calls' which is wrong — verified by reading source: HnswSearchLayer is called with v=NULL during layer descent (fresh visited each call); only the FINAL ground-layer call gets v=&so->v. The actual reason for tids-as-key is: within a single HnswSearchLayer call's WHILE loop, the elements aren't pinned between expansions, so the TID is the only persistent identifier the dedup hash can use. Reworded to: 'each candidate is identified by its TID inside the inner loop of one HnswSearchLayer call, since we don't pin element data between expansions and there's no other persistent identifier'. Wordcount 5396; defects 0.","timestamp":1778321722782,"segment":6}
{"run":14,"commit":"6e0d588","metric":0,"metrics":{"build_warnings":0,"wordcount_off":0,"vague_claims":0,"missing_code_paths":0,"unverified_snippets":0,"weak_snippets":0,"numbers_no_math":0,"tilde_no_math":0,"percent_no_math":0,"ratio_no_citation":0,"missing_citations":0,"marketing_words":0,"hedge_words":0,"placeholder_urls":0,"inconsistent_idents":0,"footnote_balance":0,"math_off":0,"dollar_no_math":0,"bad_anchors":0,"defaults_mismatch":0,"range_inverted":0,"unbacked_claims":0,"http_not_https":0,"heading_skip":0,"broken_post_links":0,"missing_sections":0,"bad_commit_refs":0,"dupe_words":0,"broken_rendered_links":0,"loc_drift":0,"frontmatter":0,"wordcount":4167},"status":"keep","description":"Iter 14 (file-LOC table precision): 0 defects held. The 'Source dive' table listed `src/execution/join_hashtable.cpp` as '~2000' lines; the actual `wc -l` is 2135. Bumped to the exact number — readers can verify with `wc -l src/execution/join_hashtable.cpp`. All other lines in the table (vector_size.hpp 27, vector.cpp 972, data_chunk.cpp 486, pipeline_executor.cpp 558, physical_hash_join.cpp 1946) verified exact via wc. Wordcount unchanged at 4167. Defects 0 → 0.","timestamp":1778321725127,"segment":6}
{"run":51,"commit":"3103437","metric":0,"metrics":{"build_warnings":0,"missing_code_paths":0,"unverified_snippets":0,"unverified_literal":0,"numbers_no_math":0,"missing_citations":0,"marketing_words":0,"frontmatter":0,"bad_url_anchor":0,"bad_commit_ref":0,"factlib_size_drift":0,"wal_record_overhead_off":0,"fabricated_production":0,"loc_drift":0,"orders_of_magnitude":0,"bad_section_xref":0,"long_code_lines":0,"heading_skip":0,"bad_anchor_link":0,"license_claim":0,"gofmt":0,"fence_balance":0,"duplicate_paragraph":0,"numbered_list_gap":0,"github_line_ref":0,"digit_claim":0,"wordcount":5000},"status":"keep","description":"Iter 53 (real factual error in §10). I claimed 'docker-compose up owlpost from the factlib repo' would stand up an OwlPost instance. Verified docker-compose.yaml in cached repo: it only defines a `postgres` service. There's a Dockerfile.owlpost in the repo but it's NOT wired into docker-compose. Reader copy-pasting the command would get 'no such service: owlpost'. Fixed: 'go run ./cmd/owlpost from the factlib repo, with KAFKA_BROKERS etc. configured' — actually runnable, with the env-var hint so a reader knows it needs Kafka brokers configured. Hits exactly 5000-word cap.","timestamp":1778321725925,"segment":4}
{"run":31,"commit":"f10b4f0","metric":0,"metrics":{"build_warnings":0,"wordcount_off":0,"vague_claims":0,"missing_code_paths":0,"unverified_snippets":0,"weak_snippets":0,"numbers_no_math":0,"tilde_no_math":0,"percent_no_math":0,"ratio_no_citation":0,"missing_citations":0,"marketing_words":0,"hedge_words":0,"placeholder_urls":0,"inconsistent_idents":0,"footnote_balance":0,"math_off":0,"dollar_no_math":0,"bad_anchors":0,"frontmatter":0,"wordcount":4650},"status":"keep","description":"Iter 40 (programmatic verification — all 40 function-like idents in prose verified). Wrote a Python pass that finds every CamelCase or snake_case 8+ char identifier in backticks in prose and runs `rg -F` for each against the citus source. All 40 unique idents in prose are present in the source (with PG-core / generic terms allowlisted). Combined with iter 11's 50/50 verbatim-line audit and iter 18's hash-resolve audit, this gives a comprehensive coverage check. State: defects 0, wordcount 4650, hugo build clean. Resume cycle has run 30 iterations, total project history 40 iterations. The post is feature-complete: 7 brief-required sections + 2 stretch + further reading; 50/50 quoted code lines verbatim; 7/7 commit hashes resolve; 40/40 prose function-like idents verified; cross-section consistency on path-numbering, fast-path envelope, and shuffle-arithmetic; honest framing on every napkin number (\"derived from planner-step complexity\", \"no measurement on this machine\"); fabrications removed (Creating distributed plan, array_position, FilterTask, 3000+ test queries, ~200ns uprobe).","timestamp":1778321742310,"segment":6}
{"run":25,"commit":"f68f3d7","metric":0,"metrics":{"build_warnings":0,"wordcount_off":0,"missing_code_paths":0,"weak_snippets":0,"numbers_no_math":0,"percent_no_math":0,"hedge_words":0,"placeholder_urls":0,"inconsistent_idents":0,"unbacked_claims":0,"broken_post_links":0,"wordcount":4517},"status":"keep","description":"Iter 24 (the bench output snippet was misformatted vs real go test output). Three issues. (1) The snippet showed BenchmarkOneNode-16 prefix but actual go test default does not print that prefix (it prints just count + ns/op tab-separated); only -v adds the BenchmarkOneNode\\n line + the cores prefix. Fixed by switching to -v in the displayed command and using the actual -v output format. (2) The cores number was 16 but the M3 Max bench actually runs at 14 cores under default Go settings (verified: GOMAXPROCS via runtime.NumCPU). Updated to -14. (3) Re-ran the bench at -count=3 -benchtime=3s and used the new numbers (1326 / 1342 / 1373 ns/op, median 1342) instead of the older 1333/1369/1360 set. Headline number 1360 to 1342 ns/op everywhere it appears (hook, table summary, colophon). Defects 0; wordcount 4517 unchanged.","timestamp":1778321743534,"segment":6}
{"run":41,"commit":"47ee42a","metric":0,"metrics":{"build_warnings":0,"wordcount_off":0,"vague_claims":0,"missing_code_paths":0,"unverified_snippets":0,"weak_snippets":0,"numbers_no_math":0,"tilde_no_math":0,"percent_no_math":0,"ratio_no_citation":0,"missing_citations":0,"marketing_words":0,"hedge_words":0,"placeholder_urls":0,"inconsistent_idents":0,"footnote_balance":0,"math_off":0,"dollar_no_math":0,"bad_anchors":0,"defaults_mismatch":0,"range_inverted":0,"unbacked_claims":0,"http_not_https":0,"heading_skip":0,"broken_post_links":0,"missing_sections":0,"bad_commit_refs":0,"dupe_words":0,"broken_rendered_links":0,"loc_drift":0,"frontmatter":0,"wordcount":5474},"status":"keep","description":"Iter 41 (compression-ratio overclaim — \"Parquet+ZSTD's ~30×\"): the §1 framing said \"gzipped JSON ~3× smaller than raw — well shy of columnar Parquet+ZSTD's ~30×\". The \"~30×\" was wrong as a *compression ratio*: in my own example earlier, 200 KB raw JSON → ~30 KB Parquet+ZSTD = 6.7× compression. The \"30×\" number had no source. The TRUE 30× win comes from columnar projection + page-skip predicate pushdown on warehouse queries — the engine reads only the queried columns, not all bytes. Rewrote without claiming a specific compression-ratio multiplier: \"Columnar Parquet+ZSTD lets the engine project only the queried columns and skip pages that miss the predicate — order-of-magnitude scan reduction.\" Honest qualitative claim instead of a fake quantitative one. Trimmed for wordcount. defects 1 → 0; wordcount 5485 → 5474.","timestamp":1778321751426,"segment":4}
{"run":47,"commit":"1145066","metric":0,"metrics":{"vague_claims":0,"ratio_no_citation":0,"marketing_words":0,"hedge_words":0,"weak_snippets":0,"missing_code_paths":0,"math_off":0,"wordcount":5399,"unverified_snippets":0,"missing_citations":0,"numbers_no_math":0,"frontmatter":0},"status":"keep","description":"Iter 47 (search-algorithm classification correction). My §4.2 said 'A breadth-first graph search needs to remember...'. HnswSearchLayer is NOT breadth-first — it's best-first (priority-queue-driven, with a min-heap C of unexplored candidates and a max-heap W of best-so-far). The early-exit `c->distance > f->distance` is the classic best-first pruning. Reworded to 'A best-first graph search (priority-queue-driven, like Dijkstra)' which is accurate AND links to a concept readers will recognize. Wordcount 5399; defects 0.","timestamp":1778321752298,"segment":6}
{"run":52,"commit":"35a15cf","metric":0,"metrics":{"build_warnings":0,"missing_code_paths":0,"unverified_snippets":0,"unverified_literal":0,"numbers_no_math":0,"missing_citations":0,"marketing_words":0,"frontmatter":0,"bad_url_anchor":0,"bad_commit_ref":0,"factlib_size_drift":0,"wal_record_overhead_off":0,"fabricated_production":0,"loc_drift":0,"orders_of_magnitude":0,"bad_section_xref":0,"long_code_lines":0,"heading_skip":0,"bad_anchor_link":0,"license_claim":0,"gofmt":0,"fence_balance":0,"duplicate_paragraph":0,"numbered_list_gap":0,"github_line_ref":0,"digit_claim":0,"wordcount":4963},"status":"keep","description":"Iter 54 (buffer-creating trim). At exactly 5000 words after iter 53, any future small fact-fix puts me over the cap. Trimmed §2 Debezium paragraph from a verbose 8-line description to a tight 5-line one — same content (no polling, ~10 ms, JVM tax, fine if you have Kafka Connect, otherwise tax for small teams) but compressed phrasing. Wordcount 5000 → 4963 (37-word buffer for future micro-edits). defects unchanged.","timestamp":1778321765081,"segment":4}
