{"type":"config","name":"Diagnosing TigerBeetle's 47K TPS ceiling — what's the real bottleneck?","metricName":"tb_tps","metricUnit":"","bestDirection":"higher"}
{"run":1,"commit":"7cba213","metric":27311,"metrics":{"tb_cpu_pct_one_core":67,"disk_write_mb_s":99.5,"disk_read_mb_s":5138,"wall_s":38.1,"total_written_mb":3794,"total_read_mb":195780},"status":"keep","description":"baseline: conc=1 batch=8190 count=1M — 27K RPS (lower than earlier 47K), TB cpu=67% of one core, disk wrote=100 MB/s (3.8 GB total), disk read=5 GB/s (195 GB total!). CPU NOT pegged, disk READS at 5 GB/s is suspicious","timestamp":1775391278350,"segment":0}
{"run":2,"commit":"8fb8095","metric":63656,"metrics":{"tb_cpu_pct_one_core":77,"disk_write_mb_s":93.5,"disk_read_mb_s":6963,"wall_s":16.5,"total_written_mb":1549,"total_read_mb":115230},"status":"keep","description":"FRESH DB baseline: 63.6K RPS (vs 27K on dirty 33GB DB). CPU=77%, writes=94 MB/s, reads=6.9 GB/s. LSM read amplification degrades throughput 2.4x as data grows","timestamp":1775503048963,"segment":0}
{"run":3,"commit":"8f12146","metric":40207,"metrics":{"tb_cpu_pct_one_core":75,"disk_write_mb_s":109,"disk_read_mb_s":0,"wall_s":12.4,"total_written_mb":0,"total_read_mb":0},"status":"keep","description":"Batch sweep: 500→22.7K, 1K→27.1K, 2K→29.5K, 4K→34.6K, 8K→40.2K RPS. Throughput scales sub-linearly with batch size (8x bigger batch = 1.8x faster). Both per-batch overhead AND per-transfer cost matter. CPU stays 75-83% across all. DB growing to 11GB during sweep.","timestamp":1775503263163,"segment":0}
{"run":4,"commit":"bef9119","metric":46332,"metrics":{"tb_cpu_pct_one_core":85,"disk_write_mb_s":142,"disk_read_mb_s":8974,"wall_s":217,"total_written_mb":30697,"total_read_mb":1945864},"status":"keep","description":"10M transfers steady-state: 46.3K RPS (matches blog's 46.6K). CPU=85%, writes=142 MB/s (30 GB), reads=9 GB/s (1.95 TB!). 195 KB read per transfer = LSM read amplification. RPS degrades as DB grows: 64K@1GB → 46K avg → 27K@33GB","timestamp":1775503606914,"segment":0}
{"run":5,"commit":"341101e","metric":46332,"metrics":{"tb_cpu_pct_one_core":85,"disk_write_mb_s":142,"disk_read_mb_s":8974,"wall_s":217,"total_written_mb":30697,"total_read_mb":1945864},"status":"keep","description":"CONCLUSION: TB bottleneck is LSM read amplification (195 KB reads per transfer, 9 GB/s). Not CPU (85%), not writes (142 MB/s). Fresh DB=64K, steady-state=46K, large DB=27K — tracks LSM depth. Napkin math rules out writes but can't predict actual TPS without knowing tree depth.","timestamp":1775503709009,"segment":0}
{"type":"config","name":"fdyno blog draft — diagrams, LaTeX, napkin math, FDB foundations","metricName":"build_ms","metricUnit":"ms","bestDirection":"lower"}
{"run":1,"commit":"da66c62","metric":88,"metrics":{"words":4588,"lines":673},"status":"keep","description":"Baseline of fdyno blog draft. 673 lines, 4588 words. Already includes thesis pull-quote, FDB primer with 4-process diagram, ACID write-path comparison with LaTeX, napkin math section. Now iterating: MVCC timeline, PutItem hot-path walkthrough, storage cost napkin math, tighten opening.","timestamp":1778138823769,"segment":0}
{"run":2,"commit":"8375fb9","metric":75,"metrics":{"words":4950,"lines":754},"status":"keep","description":"Iter 2: added MVCC timeline diagram in FDB primer (visualizes how reads at version V see consistent state, writes get conflict-checked at commit) + storage cost napkin math (642 B per write × replicas × LSM amp; SaaS workload = 1.5 GB, UPI-scale = 150 TB hot tier, ties back to TigerBeetle post). Build still fast.","timestamp":1778138880189,"segment":0}
{"run":3,"commit":"0242acb","metric":83,"metrics":{"words":5286,"lines":833},"status":"keep","description":"Iter 3: added \"hot path - a single PutItem, traced\" section showing per-step microsecond timings from HTTP accept through tx.Commit. Two key observations called out: (1) commit alone is ~75% of wall-clock - confirms napkin-math fsync dominance; (2) reads are CGO-heavy at p50 1.2 ms. Sets up the performance section by anchoring shape of the hot path before showing aggregate numbers.","timestamp":1778138917389,"segment":0}
{"run":4,"commit":"4692410","metric":76,"metrics":{"words":5629,"lines":877},"status":"keep","description":"Iter 4: added \"What this experiment actually proved\" section (mirrors TigerBeetle post's \"What the eBPF traces proved\"). 6 takeaways for skimmers: DynamoDB-as-compositional-primitives, differential testing > docs, strong consistency is a real product feature, CGO is the silent tax, FDB transaction limits are wide enough for any DynamoDB op, Tiger Style coding discipline transfers.","timestamp":1778138964453,"segment":0}
{"run":5,"commit":"2b9febe","metric":82,"metrics":{"words":6009,"lines":923},"status":"keep","description":"Iter 5: added Closing (ties back to opening thesis \"great API + great engine are decoupleable\"), Further Reading section (TigerBeetle post, Temporal post, Tiger Style, FDB SOSP paper, DynamoDB 2007 paper), and Colophon (1152 autoresearch iterations producing the codebase, blog itself is iter 5 of similar loop applied to prose, microbenchmark caveats). Now at 6009 words / 923 lines — comparable to TigerBeetle post.","timestamp":1778139028120,"segment":0}
{"run":6,"commit":"0b42920","metric":76,"metrics":{"words":6313,"lines":965},"status":"keep","description":"Iter 6: tone calibration to user voice (humble, positive, balanced). Replaced \"FoundationDB has bad API\" with \"tiny API\"; \"DynamoDB hidden behind proprietary service\" with \"closed engine\". Removed \"DynamoDB literally cannot offer\" / \"is the most underrated database\" / \"a real product feature\" type assertive framings. Reframed tradeoffs as \"right answer for AWS's scale\" not flaws. Added \"What DynamoDB the service buys you that fdyno doesnt\" balanced section (mirrors temporal post pattern). Self-deprecating colophon (\"My contribution was prompting\"). Cross-link to Chaitanya's correction tying to lesson about framing care. Closing softer: \"sometimes a rewarding one\".","timestamp":1778139209792,"segment":0}
{"run":7,"commit":"dcdf7ef","metric":88,"metrics":{"words":6315,"lines":966},"status":"keep","description":"Iter 7: tone polish pass. Renamed \"The win that's worth the post\" -> \"What changes when ACID covers everything\" (less self-promoting). Softened \"wasted effort\" -> \"premature\" / \"plateau\" twice. Reframed Tiger Style bullet from \"9000 lines, 1740 LOC\" boast to \"codebase stays consistent in shape across the 23 ops, single biggest factor in conformance loop staying tractable.\" Kept \"silent tax\" - colorful, accurate. \"Only honest measure\" -> \"most honest measure\".","timestamp":1778139286802,"segment":0}
{"run":8,"commit":"817d444","metric":92,"metrics":{"words":6324,"lines":966},"status":"keep","description":"Iter 8: opening \"By the end you'll know\" bullets reframed for balance. Replaced \"Why FDB makes some DynamoDB constraints disappear\" (assertive) with \"What changes when you put it on FDB - and what stays the same\". Replaced \"Where FDB layering shines and where it doesn't - tradeoffs are honest not marketing\" (defensive) with \"What DynamoDB the service still does better - this layer doesnt try to replace those\". Promises balance up front.","timestamp":1778139336032,"segment":0}
{"run":9,"commit":"1d5ad80","metric":80,"metrics":{"words":6332,"lines":966},"status":"keep","description":"Iter 9: cleaned up 4-process FDB diagram. Was using inconsistent box-drawing (╔╗ for Client, ┌┐ for everything else, mixed alignment). Now uniform ┌┐ throughout, aligned columns, slightly tighter labels (e.g. \"your app / our fdyno binary\" replaces wordier original). Renders cleaner in monospace.","timestamp":1778139420535,"segment":0}
{"run":10,"commit":"30cee06","metric":75,"metrics":{"words":6324,"lines":966},"status":"keep","description":"Iter 10: cleaned MVCC timeline diagram. Removed asymmetric thick-line (┃) + ┌──┐ wrapper that didn't render right (no closing border). Now uses simple │ as the time axis with a clear arrow at top. Still conveys the version timeline + concurrent-writer-resolver concept clearly. Builds at 75ms (best so far).","timestamp":1778139448687,"segment":0}
{"run":11,"commit":"2c0a0c5","metric":75,"metrics":{"words":6473,"lines":995},"status":"keep","description":"Iter 11: added Go code example showing the onion architecture (item_ops.go transport-agnostic + http.go thin adapter, three-line decode-call-encode). Anchors the Tiger Style claim with concrete Go that anyone can scan in 10 seconds. Cross-link to Tiger Style post. Reinforces \"every layer one job, push state down\" without bloating.","timestamp":1778139509484,"segment":0}
{"run":12,"commit":"c12b469","metric":78,"metrics":{"words":6468,"lines":995},"status":"keep","description":"Iter 12: title polish. Removed \"in 9,000 Lines of Go\" from title - reads boastful in headline position. Now just \"fdyno - DynamoDB on FoundationDB\" matching the simpler style of other posts (Temporal Under the Hood, The Tiger Style). The line count stays in the body where it's contextual factual data, not a hook.","timestamp":1778139529781,"segment":0}
{"run":13,"commit":"dd31765","metric":73,"metrics":{"words":6477,"lines":995},"status":"keep","description":"Iter 13: rewrote meta description to match the new humble + balanced tone. Was \"Building a drop-in DynamoDB-compatible service... 526/526 conformance tests\" (lead with the brag); now \"An experiment in putting DynamoDB's API on top of FoundationDB. What FDB lets you simplify, what it costs, what DynamoDB the service still does better. With napkin math, eBPF-style traces, and 526/526 conformance tests\" - leads with framing, ends with credentials. Best build time so far at 73ms.","timestamp":1778139552671,"segment":0}
{"type":"config","name":"backend.how site bug-fixes — OG/SEO/deprecations/stale assets","metricName":"hugo_warnings","metricUnit":"","bestDirection":"lower"}
{"run":1,"commit":"1133c54","metric":11,"metrics":{},"status":"keep","description":"Baseline: 11 warnings/deprecations from `hugo --logLevel debug`. Identified: (a) 8 INFO deprecated entries about markup.goldmark.renderHooks.{image,link}.enableDefault → useEmbedded (Hugo 0.148+); (b) 1 raw-HTML omitted WARN in 1b-payments post; (c) other 2 are repeats from per-language build. Confirmed by inspection: OG image still uses RelPermalink (theme bug), SearchAction schema emitted but no search exists, public/ has 10+ stale particles.min hashes, cat-stereogram has empty tags. Pruned stale ideas: privacy.twitter (already migrated to .x), menus (exists), lilac theme conflict (gone).","timestamp":1778139764028,"segment":0}
{"run":2,"commit":"930da0f","metric":3,"metrics":{},"status":"keep","description":"Iter 2: fixed Hugo 0.148+ deprecations. hugo.toml had `enableDefault = false` for both renderHooks.image and renderHooks.link, which was renamed to `useEmbedded = \"never\"` in Hugo 0.148. Per docs: false→\"never\", true→\"fallback\". Warnings 11→3 (-73%). Remaining: 1 raw-HTML WARN in 1b-payments post + 2 misc.","timestamp":1778139782708,"segment":0}
{"run":3,"commit":"a3163ee","metric":3,"metrics":{},"status":"keep","description":"Iter 3: fixed broken OG image URLs in opengraph.html. Was emitting RelPermalink (relative paths like /posts/.../feature.webp) for og:image, og:see_also, og:video — Facebook/Twitter/LinkedIn need absolute URLs to fetch them. Verified output now: og:image=\"https://backend.how/posts/the-tiger-style/beetle.webp\" instead of \"/posts/the-tiger-style/beetle.webp\". Affects social previews on every post. Warning count unchanged (it's a runtime correctness fix, not a Hugo warning).","timestamp":1778139818195,"segment":0}
{"run":4,"commit":"91e0e96","metric":3,"metrics":{},"status":"keep","description":"Iter 4: fixed JSON-LD structured-data.html. (a) Article @id now uses .Permalink (was .RelPermalink — Google needs absolute); (b) image array was producing INVALID JSON: `\"image\": [https://backend.how/foo.webp]` (unquoted URL because of safeJS) — now `\"image\": [\"https://backend.how/foo.webp\"]` properly quoted; (c) home Organization/Person schema and breadcrumb URL replace use absURL/Permalink everywhere; (d) simplified printf for image URLs from 3-arg trim hack to 2-arg Permalink+filename.","timestamp":1778139877637,"segment":0}
{"run":5,"commit":"645064a","metric":3,"metrics":{},"status":"keep","description":"Iter 5: removed dishonest SearchAction JSON-LD. hugo.toml had siteLinksSearchBox=true which emitted a SearchAction schema pointing urlTemplate at \"/tags/{search_term_string}/\" — but that URL doesn't accept a query parameter, the site has no actual search endpoint. Setting it to false makes the schema honest. Verified: 0 occurrences of SearchAction in public/index.html now (was emitting a misleading schema to Google).","timestamp":1778139899616,"segment":0}
{"run":6,"commit":"498ab66","metric":3,"metrics":{},"status":"keep","description":"Iter 6: added tags to cat-stereogram-dark-mode (was tags = []). Now [\"stereograms\", \"vision\", \"dark-mode\", \"focus\"] - relevant to the post content about stereograms and visual focus exercises. The other allegedly-tagless post from the ideas backlog (Lost SSH Access) actually doesn't have empty tags - inspected and pruned that stale claim.","timestamp":1778139919665,"segment":0}
{"run":7,"commit":"ea17089","metric":3,"metrics":{},"status":"keep","description":"Iter 7: cleaned stale public/ artifacts. Did `rm -rf public/ resources/ && hugo --gc` — went from 11 stale particles.min.*.js fingerprints to 0. Note: public/ + resources/ are gitignored so this is a local-disk cleanup, not a tracked-files fix; the artifacts were left from old builds where the theme used a particles JS asset that's no longer emitted. `hugo --gc` removes orphaned resources during build. No git diff, just a working-dir clean.","timestamp":1778139951996,"segment":0}
{"run":8,"commit":"99e6b70","metric":0,"metrics":{},"status":"keep","description":"Iter 8: silenced raw-HTML warning. The 1b-payments-per-day post had a centered <p> caption under the LaTeX cluster-replication diagram. Goldmark strips raw HTML by default for safety, so it was emitting \"Raw HTML omitted\" WARN every build. Replaced with markdown italics — loses the centering but keeps the caption text. Now: ZERO warnings/deprecations from `hugo --logLevel debug`. Down from 11 baseline.","timestamp":1778139999428,"segment":0}
{"run":9,"commit":"ecb5d2e","metric":0,"metrics":{},"status":"keep","description":"Iter 9: added font preload hint for JetBrains Mono variable TTF (already had it for Departure Mono). Site uses JetBrains as the body monospace; preloading the variable-weight TTF means it starts downloading from the very first head parse instead of waiting for CSS to be parsed and the @font-face URL to be discovered. Verified: 2 preload links in public/index.html now (was 1). DNS-prefetch + preconnect for stats.backend.how were already in place. Hugo warnings stay at 0.","timestamp":1778140101634,"segment":0}
{"run":10,"commit":"fb0118e","metric":0,"metrics":{},"status":"keep","description":"Iter 10: pruned and rewrote autoresearch.ideas.md. Verified that 9 items the backlog claimed were missing are ALREADY in the theme: copy button, reading progress bar, back-to-top, custom 404, last-updated badge, nav menu, dns-prefetch + preconnect, Departure Mono preload, privacy.x migration. The backlog was significantly drift from reality. New file is much more honest: clear \"done in this session\" + \"verified already-done in theme\" + \"still open\" sections. Build still 0 warnings.","timestamp":1778140203239,"segment":0}
{"run":11,"commit":"8c5ded5","metric":0,"metrics":{},"status":"keep","description":"Iter 11: added series prev/next navigation to single.html. Renders an ordered list of all posts in the series with the current post highlighted as \"(you are here)\". Verified rendering on both Valkey Car Platform parts: each shows \"Series: Valkey Car Platform\" with both posts listed and current marked. Took the related-posts CSS as a base and extended it for series-nav (matches dashed-border pattern). Other posts (single-entry series, no series) render nothing — the {{ if gt (len $pages) 1 }} guard prevents singleton series from showing nav.","timestamp":1778140271593,"segment":0}
{"run":12,"commit":"a907ed8","metric":0,"metrics":{"public_kb":5500},"status":"keep","description":"Iter 12: added @media print stylesheet. Hides nav/share/copy/comments/progress/back-to-top in printed output, resets to white-on-black with 11pt body, draws external link URLs inline via ::after content (so paper readers can find them), keeps code blocks readable with light bg + page-break-inside: avoid. Headings and tables don't split across pages. Useful for anyone exporting an article to PDF or printing for offline reading. 0 warnings, no impact on screen rendering.","timestamp":1778140344993,"segment":0}
{"run":13,"commit":"260d9ea","metric":0,"metrics":{"public_kb":5500},"status":"keep","description":"Iter 13: final pass on autoresearch.ideas.md. Marked the two real medium-effort items (series-nav, print-CSS) as done in this session; moved related-posts/social-sharing/footnote-backref to \"verified already-done in theme\" subsection to stop them from re-appearing on the next pass. The remaining medium-effort items are now genuinely open: active TOC highlighting (IntersectionObserver), image lightbox, and per-post description on the /posts/ list page. 0 warnings stays.","timestamp":1778140394044,"segment":0}
{"run":14,"commit":"ff7ad6b","metric":0,"metrics":{"public_kb":5600},"status":"keep","description":"Iter 14: added image lightbox. Click any article image → full-screen overlay with the image at native size; close via × button, ESC key, or click outside. Sets cursor: zoom-in on article images so it's visually obvious. Body scroll locked while overlay open. Pure-vanilla JS (~30 lines), no library dependency. CSS uses inset: 0 + flex centering with bg rgba(0,0,0,0.92). Public size: 5.5M → 5.6M (+100KB, mostly the existing image assets being part of the build, not new payload).","timestamp":1778140469528,"segment":0}
{"run":15,"commit":"caf9b47","metric":0,"metrics":{"public_kb":5600},"status":"keep","description":"Iter 15: closed out medium-effort backlog tier in autoresearch.ideas.md. Verified all remaining medium-effort items were either done in this session (image lightbox, series nav, print CSS) or already implemented in the theme (active TOC highlighting via initTOCHighlight, related posts, social sharing, footnote backrefs, post descriptions on list page). Backlog is now down to: 5 quick-wins (all done), 0 medium-effort (all done), and 8 larger-feature items (search, comments, OG image gen, etc.) for future sessions. Site at 0 warnings, 5.6M build, every concrete bug or quick-win listed pre-session is now resolved.","timestamp":1778140526158,"segment":0}
{"run":16,"commit":"9b62388","metric":0,"metrics":{"public_kb":5600},"status":"keep","description":"Iter 16: QA pass — verified no regressions across page types. Home: title + og:image abs URL + valid Person/BreadcrumbList JsonLd. Single post (tiger-style): title + og:image abs + JsonLd @id absolute + image array properly quoted JSON + share-copy-btn rendered + 11 init functions wired (added initImageLightbox). Valkey series: series-nav with aria-label rendered with both posts listed. Both font preloads present. No REF_NOT_FOUND in any post. Site is in good shape: 15 iterations, 11→0 warnings, 4 critical SEO bugs fixed (OG image abs, JSON-LD valid+abs, SearchAction removed, raw-HTML), 2 perf hints, 3 UX features (series nav, print CSS, image lightbox), backlog cleaned.","timestamp":1778140570275,"segment":0}
{"run":17,"commit":"f471098","metric":0,"metrics":{"public_kb":5600},"status":"keep","description":"Iter 17: wrote session checkpoint to autoresearch.md so next loop has context. Documents both completed work (16 iters, 11→0 warnings, 8 bug fixes + 1 perf + 3 UX + 4 maint) and the paused fdyno draft (iter 13, draft: true, ready for review). Stop condition: metric at floor (cannot go below 0 warnings); remaining backlog is half-day+ larger features. The TigerBeetle Bottleneck Concluded section is preserved at bottom for historical reference.","timestamp":1778140621079,"segment":0}
{"run":18,"commit":"850fc8e","metric":0,"metrics":{"public_kb":5600},"status":"keep","description":"Iter 18: enriched homepage featured-post cards. Was just title-link + date per featured post (~bare list); now matches /posts/ list pattern with title + date + read-time + description + 5 tags. 4 featured posts now render with full context (was 4 bare lines, now 18 elements with meta + descriptions + tags). public/index.html grew from 8.9 KB to 11.5 KB. CSS reuses .post-description/.post-tags/.post-tag from /posts/ list, only added .featured-post container styling for spacing. 0 warnings preserved.","timestamp":1778140754594,"segment":0}
{"run":19,"commit":"7f66737","metric":0,"metrics":{"public_kb":5600},"status":"keep","description":"Iter 19: replaced /tags/ index page with a real tag cloud. Was using shared list.html which rendered each tag-summary-page as a \"post\" heading; now /tags/ uses a dedicated taxonomy.html that renders tags as a cloud sorted by post count, sized in 4 buckets (xl ≥5, lg ≥3, md ≥2, sm 1). Each tag shows #name + count. 33 tags rendered with both name and count. Used .ByCount on .Site.Taxonomies. Hover effect inverts colors (matches existing .post-tag pattern). All other taxonomy pages still get their own term-list view.","timestamp":1778140817374,"segment":0}
