{"run":28,"commit":"c2f081b","metric":0,"metrics":{"build_warnings":0,"wordcount_off":0,"vague_claims":0,"missing_code_paths":0,"unverified_snippets":0,"weak_snippets":0,"numbers_no_math":0,"tilde_no_math":0,"percent_no_math":0,"ratio_no_citation":0,"missing_citations":0,"marketing_words":0,"hedge_words":0,"placeholder_urls":0,"inconsistent_idents":0,"footnote_balance":0,"math_off":0,"dollar_no_math":0,"bad_anchors":0,"defaults_mismatch":0,"range_inverted":0,"unbacked_claims":0,"http_not_https":0,"heading_skip":0,"frontmatter":0,"wordcount":4294},"status":"keep","description":"Iter 28 (closing-section internal contradiction). The closing claimed the headline workload had 'value bytes flowing through the WiscKey vlog' — but my own observation 1 (in 'Real numbers') had explicitly stated 'the headline 1M ops/s comes from the LSM still being small enough to drain — not from the WiscKey separation actually firing'. So the closing was contradicting my own analysis. Reworded to match the data: the headline shape uses small-and-compressible values that fit in the LSM, NOT vlog separation; the WiscKey win actually lands at 1 MiB+ values which is not the default workload. Now the closing is consistent with the body. Wordcount 4239 → 4294. defects 0.","timestamp":1778322090322,"segment":6}
{"run":52,"commit":"6eae109","metric":0,"metrics":{"build_warnings":0,"wordcount_off":0,"vague_claims":0,"missing_code_paths":0,"unverified_snippets":0,"weak_snippets":0,"numbers_no_math":0,"tilde_no_math":0,"percent_no_math":0,"ratio_no_citation":0,"missing_citations":0,"marketing_words":0,"hedge_words":0,"placeholder_urls":0,"inconsistent_idents":0,"footnote_balance":0,"math_off":0,"dollar_no_math":0,"bad_anchors":0,"defaults_mismatch":0,"range_inverted":0,"frontmatter":0,"wordcount":4999},"status":"keep","description":"Iter 52 (replace \"manifests I have decoded on real production tables\" with the §5 measured number, since I only ran the snippet once in this session — not multiple production tables). Real fix: §1 hook said the 300-byte estimate was \"consistent with manifests I have decoded on real production tables\" but I only decoded one manifest in this session (the §5 reproducer's 4,285 bytes). Replaced with: \"the §5 reproducer measures 4,285 bytes for a single entry\" — points the reader at the same evidence I'm using. The 300-byte estimate scales reasonably from this measurement (4,285 bytes for one entry is dominated by Avro container overhead and schema; per-entry cost amortises down once a manifest holds many entries, which is why the 8 MiB target manifest fits ~28k entries). Wordcount 4998 → 4999. Defects 0.","timestamp":1778322090427,"segment":6}
{"run":31,"commit":"a91d94d","metric":0,"metrics":{"build_warnings":0,"wordcount_off":0,"missing_code_paths":0,"weak_snippets":0,"numbers_no_math":0,"percent_no_math":0,"hedge_words":0,"placeholder_urls":0,"inconsistent_idents":0,"unbacked_claims":0,"broken_post_links":0,"wordcount":4577},"status":"keep","description":"Iter 30 (closing imprecision: a couple of microseconds, a second). Closing said the protocol does a couple of microseconds of work then waits a second. Both numbers were rough; replaced with the exact ones from the body: roughly two microseconds of state-machine work, then waits an expected 1.33 seconds (with default ElectionTick = 10 and a 100 ms tick interval). Now a reader who reads only the closing sees the same numbers as the careful walkthrough. Defects 0; wordcount 4565 to 4577.","timestamp":1778322099306,"segment":6}
{"run":35,"commit":"050f714","metric":0,"metrics":{"build_warnings":0,"wordcount_off":0,"vague_claims":0,"missing_code_paths":0,"unverified_snippets":0,"weak_snippets":0,"numbers_no_math":0,"tilde_no_math":0,"percent_no_math":0,"ratio_no_citation":0,"missing_citations":0,"marketing_words":0,"hedge_words":0,"placeholder_urls":0,"inconsistent_idents":0,"footnote_balance":0,"math_off":0,"dollar_no_math":0,"bad_anchors":0,"frontmatter":0,"wordcount":4677},"status":"keep","description":"Iter 44 (resume-cycle final audit checkpoint). Programmatic verification across 4 axes: (1) 50/50 quoted code lines verbatim against source; (2) 39/39 function-like identifiers in prose verified to exist in citus source via rg; (3) 7/7 cited commit hashes resolve in cached repo at HEAD a3d5708a6; (4) Hugo build clean across all 188 pages. 10 top-level sections present (7 brief-required + 2 stretch + further reading). Wordcount 4677 (scorer) / 4802 (full audit), well inside [3000, 5500]. defects=0 across all 28 detector dimensions. Resume cycle is now at 34 iterations on top of the original 10, total 44 iterations on this post. Substantive correctness fixes found and applied in resume cycle alone: ~25 (whitespace audit, repro line count, repartition shuffle math, router error path, planner step count, fabricated DEBUG message, DEBUG level visibility, test corpus size, PG-compat commit pattern, uprobe overhead, bucket count formula, repartition default napkin, FinalizeRouterPlan precision, path-1 vs path-2 colocation gating, pg_dist_transaction scope, fast-path envelope cross-reference, cluster-topology bullet, §3↔§5 4-paths labeling, paths-by-name closing summary, array_position example replacement, tdigest integration framing, alter_distributed_table existence, citus_extradata_container parameter encoding, hook example consistency).","timestamp":1778322107379,"segment":6}
{"run":56,"commit":"f310d0c","metric":0,"metrics":{"build_warnings":0,"missing_code_paths":0,"unverified_snippets":0,"unverified_literal":0,"numbers_no_math":0,"missing_citations":0,"marketing_words":0,"frontmatter":0,"bad_url_anchor":0,"bad_commit_ref":0,"factlib_size_drift":0,"wal_record_overhead_off":0,"fabricated_production":0,"loc_drift":0,"orders_of_magnitude":0,"bad_section_xref":0,"long_code_lines":0,"heading_skip":0,"bad_anchor_link":0,"license_claim":0,"gofmt":0,"fence_balance":0,"duplicate_paragraph":0,"numbered_list_gap":0,"github_line_ref":0,"digit_claim":0,"filler_phrases":0,"wordcount":4963},"status":"keep","description":"Iter 59 (trim hook for buffer). Tightened the post-thesis paragraph that introduces 'Postgres has shipped this since 9.6'. Removed the redundant double-link (we had both /docs/release/9.6/ AND /docs/9.6/release-9-6.html — kept the latter which actually contains the entry); compressed 'The outbox-pattern tutorials all keep teaching you to build a table, then a poller, then an index, then a cleanup job — and nine times out of ten they don't tell you about the dual-write race hiding in their first code sample' to 'The outbox-pattern tutorials still teach a table, a poller, an index, and a cleanup job — and rarely warn about the dual-write race in their first code sample.' Same content, ~30 words trimmed. Wordcount 4996 → 4963.","timestamp":1778322114915,"segment":4}
{"run":18,"commit":"ab43080","metric":0,"metrics":{"build_warnings":0,"wordcount_off":0,"vague_claims":0,"missing_code_paths":0,"unverified_snippets":0,"weak_snippets":0,"numbers_no_math":0,"tilde_no_math":0,"percent_no_math":0,"ratio_no_citation":0,"missing_citations":0,"marketing_words":0,"hedge_words":0,"placeholder_urls":0,"inconsistent_idents":0,"footnote_balance":0,"math_off":0,"dollar_no_math":0,"bad_anchors":0,"defaults_mismatch":0,"range_inverted":0,"unbacked_claims":0,"http_not_https":0,"heading_skip":0,"broken_post_links":0,"missing_sections":0,"bad_commit_refs":0,"dupe_words":0,"broken_rendered_links":0,"loc_drift":0,"frontmatter":0,"wordcount":4211},"status":"keep","description":"Iter 18 (ASCII diagram parens cleanup): 0 defects held. The architecture diagram had misaligned parens 'each operator (vector-in, ... vector-out)' split across two lines that visually broke the box. Replaced with one clean line: 'vector-in / vector-out, per stage'. Reads as cleanly in both monospace dark and light themes (verified visually). Wordcount unchanged at 4211. Defects 0.","timestamp":1778322117305,"segment":6}
{"run":53,"commit":"f7108ca","metric":0,"metrics":{"vague_claims":0,"ratio_no_citation":0,"marketing_words":0,"hedge_words":0,"weak_snippets":0,"missing_code_paths":0,"math_off":0,"wordcount":5417,"unverified_snippets":0,"missing_citations":0,"numbers_no_math":0,"frontmatter":0},"status":"keep","description":"Iter 53 (calibrated recall claim in §2). My §2 said 'In practice ... you can hit recall ≥ 95 % at ef_search = 40' but my benchmark measured 94.6 %, just below 95 %. The ≥-95 claim was aspirational, not measured. Reworded: 'recall ~95 % (94.6 % on this post's synthetic-cluster benchmark, see §5)' — anchors the claim to the measured number AND makes the synthetic-vs-real-data caveat explicit. Wordcount 5417; defects 0.","timestamp":1778322118974,"segment":6}
{"run":46,"commit":"9993da8","metric":0,"metrics":{"build_warnings":0,"wordcount_off":0,"vague_claims":0,"missing_code_paths":0,"unverified_snippets":0,"weak_snippets":0,"numbers_no_math":0,"tilde_no_math":0,"percent_no_math":0,"ratio_no_citation":0,"missing_citations":0,"marketing_words":0,"hedge_words":0,"placeholder_urls":0,"inconsistent_idents":0,"footnote_balance":0,"math_off":0,"dollar_no_math":0,"bad_anchors":0,"defaults_mismatch":0,"range_inverted":0,"unbacked_claims":0,"http_not_https":0,"heading_skip":0,"broken_post_links":0,"missing_sections":0,"bad_commit_refs":0,"dupe_words":0,"broken_rendered_links":0,"loc_drift":0,"frontmatter":0,"wordcount":5418},"status":"keep","description":"Iter 46 (createTickerSegment + handleSegmentAck snippets → source verbatim): two more snippet alignment passes. (a) createTickerSegment had `writePos   := ...` (decorative spacing), `if writePos <= lastSegPos { return }` (one-liner), and `Segment{StartIdx: ..., EndIdx: ...}` (one-liner) — source uses single-space declarations, multi-line if-blocks, and multi-line struct-literals. Replaced with source-verbatim form. Marked the omission of safety checks (`lastSegPos > writePos` warn-and-correct branch) explicitly via \"(safety checks elided)\". (b) handleSegmentAck had inlined `rb.buffer[(highContiguous-1) % rb.size]` — source has `idx := (highContiguous - 1) % rb.size; lastEvent := rb.buffer[idx]` (split). Also the log message was paraphrased \"Ack channel is full\" — source full message is \"Ack channel is full, could not send LSN after contiguous advancement\". Now both blocks substring-match source verbatim. defects 0 → 0; wordcount 5418 unchanged.","timestamp":1778322157685,"segment":4}
{"run":50,"commit":"7e33635","metric":0,"metrics":{"build_warnings":0,"wordcount_off":0,"vague_claims":0,"missing_code_paths":0,"unverified_snippets":0,"weak_snippets":0,"numbers_no_math":0,"tilde_no_math":0,"percent_no_math":0,"ratio_no_citation":0,"missing_citations":0,"marketing_words":0,"hedge_words":0,"placeholder_urls":0,"inconsistent_idents":0,"footnote_balance":0,"math_off":0,"dollar_no_math":0,"bad_anchors":0,"frontmatter":0,"unbacked_claims":0,"wordcount":4611},"status":"keep","description":"Iter 50 (correctness — fix the cache-line layout diagram offset labels). Original ASCII art labeled both rows of the sender-stats line as 0x000 and the receiver-stats line as 0x080, which was misleading: sender stats span byte 0-39 of line N (5 size_t = 40B), then padding to 64B; the next line N+1 starts at offset 0x040, line N+2 at 0x080. Two rows in same cache line both labeled 0x000 was confusing. Replaced the offset-labels approach with a per-line description: each box says explicitly 'sender stats (5 x size_t = 40 bytes) + 24 bytes of alignas padding' — same information, no misleading offset labels, makes the actual data layout self-checking. wordcount 4609 to 4611.","timestamp":1778322159556,"segment":6}
{"run":29,"commit":"5f91107","metric":0,"metrics":{"build_warnings":0,"wordcount_off":0,"vague_claims":0,"missing_code_paths":0,"unverified_snippets":0,"weak_snippets":0,"numbers_no_math":0,"tilde_no_math":0,"percent_no_math":0,"ratio_no_citation":0,"missing_citations":0,"marketing_words":0,"hedge_words":0,"placeholder_urls":0,"inconsistent_idents":0,"footnote_balance":0,"math_off":0,"dollar_no_math":0,"bad_anchors":0,"defaults_mismatch":0,"range_inverted":0,"unbacked_claims":0,"http_not_https":0,"heading_skip":0,"frontmatter":0,"wordcount":4314},"status":"keep","description":"Iter 29 (compactor scheduling precision). Source-dive paragraph said 'one is permanently scheduled to drain L0, and the other three pick whatever has the highest adjusted score'. Re-read levels.go:480-498: worker 0 PREFERENTIALLY runs L0 (the 'if id == 0 && p.level == 0: bypass adjusted>=1.0 floor' branch) but if L0 has nothing pending, worker 0 falls through to whatever non-L0 has adjusted>=1.0 just like the other workers. So 'permanently scheduled' overstates. Reworded: 'worker zero preferentially drains L0 (the id == 0 && p.level == 0 branch above bypasses the usual adjusted >= 1.0 floor), and the other three pick whatever has the highest adjusted score, falling out when nothing crosses 1.0.' Anchors back to the just-quoted snippet so the reader can verify. Wordcount 4294 → 4314. defects 0.","timestamp":1778322166450,"segment":6}
{"run":36,"commit":"f7108ca","metric":0,"metrics":{"build_warnings":0,"wordcount_off":0,"vague_claims":0,"missing_code_paths":0,"unverified_snippets":0,"weak_snippets":0,"numbers_no_math":0,"tilde_no_math":0,"percent_no_math":0,"ratio_no_citation":0,"missing_citations":0,"marketing_words":0,"hedge_words":0,"placeholder_urls":0,"inconsistent_idents":0,"footnote_balance":0,"math_off":0,"dollar_no_math":0,"bad_anchors":0,"frontmatter":0,"wordcount":4677},"status":"keep","description":"Iter 45 (architecture-diagram precision: physical-planner output overgeneralized to MapMergeJob). The diagram said \"Physical planner: MultiNode → Job tree of MapMergeJob nodes whose TaskType is READ_TASK / MAP_TASK / MERGE_TASK\". But MapMergeJob is specific to repartition; the common case (router / multi-shard SELECT / multi-shard modify) uses plain Job nodes (BuildJob, not BuildMapMergeJob in multi_physical_planner.c). Reworded to: \"Plain Jobs hold READ_TASK lists for the common case; MapMergeJob shows up only on the repartition path with MAP_TASK + MERGE_TASK plus dependent Jobs.\" Now the diagram correctly distinguishes the two Job kinds. Verified BuildJob and BuildMapMergeJob both exist in multi_physical_planner.c. defects 0 → 0; wordcount 4677 unchanged.","timestamp":1778322166754,"segment":6}
{"run":57,"commit":"56c28b6","metric":0,"metrics":{"build_warnings":0,"missing_code_paths":0,"unverified_snippets":0,"unverified_literal":0,"numbers_no_math":0,"missing_citations":0,"marketing_words":0,"frontmatter":0,"bad_url_anchor":0,"bad_commit_ref":0,"factlib_size_drift":0,"wal_record_overhead_off":0,"fabricated_production":0,"loc_drift":0,"orders_of_magnitude":0,"bad_section_xref":0,"long_code_lines":0,"heading_skip":0,"bad_anchor_link":0,"license_claim":0,"gofmt":0,"fence_balance":0,"duplicate_paragraph":0,"numbered_list_gap":0,"github_line_ref":0,"digit_claim":0,"filler_phrases":0,"wordcount":4972},"status":"keep","description":"Iter 60 (consistency between §5 example and §8 worked example). §5 said the prefix-aggregateType topic example used 'payments' as the service prefix → 'payments.user' topic. §8 byte math used 'payments-user' (13 chars) as the prefix and §10 demo passed 'payments-user' to NewPostgresAdapter. Two different prefix conventions across the post. Reconciled §5 to use 'payments-user' so the topic example matches the §8 byte math (13-char prefix → 14 B in WAL); cross-linked to §8 so reader can verify the byte-math consistency. Wordcount 4963 → 4972.","timestamp":1778322182143,"segment":4}
{"run":19,"commit":"f40882a","metric":0,"metrics":{"build_warnings":0,"wordcount_off":0,"vague_claims":0,"missing_code_paths":0,"unverified_snippets":0,"weak_snippets":0,"numbers_no_math":0,"tilde_no_math":0,"percent_no_math":0,"ratio_no_citation":0,"missing_citations":0,"marketing_words":0,"hedge_words":0,"placeholder_urls":0,"inconsistent_idents":0,"footnote_balance":0,"math_off":0,"dollar_no_math":0,"bad_anchors":0,"defaults_mismatch":0,"range_inverted":0,"unbacked_claims":0,"http_not_https":0,"heading_skip":0,"broken_post_links":0,"missing_sections":0,"bad_commit_refs":0,"dupe_words":0,"broken_rendered_links":0,"loc_drift":0,"frontmatter":0,"wordcount":4221},"status":"keep","description":"Iter 19 (correct paper attribution): 0 defects held. Real factual fix the metric didn't catch. I had attributed the foundational vectorized-execution paper to 'Boncz–Zukowski–Manegold' — Manegold was wrong. Pulled the actual PDF (cidr2005/papers/P19.pdf) and extracted the title page via pypdf: 'MonetDB/X100: Hyper-Pipelining Query Execution' by Peter Boncz, Marcin Zukowski, Niels Nes (CWI, Amsterdam). Manegold worked on related earlier MonetDB research but is not on this paper. Replaced the misattribution with the correct author list and the proper paper title. Also tightened 'the founders are the same Boncz lab' to 'its founders Mark Raasveldt and Hannes Mühleisen are from the same CWI Amsterdam database group' — Boncz advised but didn't found DuckDB; Raasveldt + Mühleisen did. Wordcount 4211 → 4221.","timestamp":1778322183486,"segment":6}
{"run":54,"commit":"24ed06b","metric":0,"metrics":{"vague_claims":0,"ratio_no_citation":0,"marketing_words":0,"hedge_words":0,"weak_snippets":0,"missing_code_paths":0,"math_off":0,"wordcount":5434,"unverified_snippets":0,"missing_citations":0,"numbers_no_math":0,"frontmatter":0},"status":"keep","description":"Iter 54 (catch a STILL-WRONG geometric-distribution claim in §2). My §2 said 'a random level ℓ from a geometric distribution with mean 1/ln(M)'. Wrong: 1/ln(M) is the rate parameter of the underlying continuous exponential (= mean of the continuous exp); the integer geometric distribution after flooring has mean 1/(M-1). This was the SAME error I'd corrected in §4.4 (iter 16/29) but missed in §2. Reworded to: 'picks a random level as floor(-ln(U) × 1/ln(M))' (the actual formula matching source code), 'The result is a geometric distribution', and 'mean integer level is 1/(M-1)'. Now §2 and §4.4 are consistent and correct. Wordcount 5434; defects 0.","timestamp":1778322189181,"segment":6}
{"run":32,"commit":"38cf52d","metric":0,"metrics":{"build_warnings":0,"wordcount_off":0,"missing_code_paths":0,"weak_snippets":0,"numbers_no_math":0,"percent_no_math":0,"hedge_words":0,"placeholder_urls":0,"inconsistent_idents":0,"unbacked_claims":0,"broken_post_links":0,"wordcount":4585},"status":"keep","description":"Iter 31 (architecture diagram type signature). The diagram had step(message) -> state, []Message which is incorrect: r.step is type stepFunc = func(r *raft, m pb.Message) error - it returns an error and mutates r in place (the messages get appended to r.msgs). Updated the diagram signature to Step(m Message) error // mutates r in place, // appends to r.msgs which is faithful to the actual Go signature. Defects 0; wordcount 4577 to 4585.","timestamp":1778322199438,"segment":6}
{"run":47,"commit":"50d3514","metric":0,"metrics":{"build_warnings":0,"wordcount_off":0,"vague_claims":0,"missing_code_paths":0,"unverified_snippets":0,"weak_snippets":0,"numbers_no_math":0,"tilde_no_math":0,"percent_no_math":0,"ratio_no_citation":0,"missing_citations":0,"marketing_words":0,"hedge_words":0,"placeholder_urls":0,"inconsistent_idents":0,"footnote_balance":0,"math_off":0,"dollar_no_math":0,"bad_anchors":0,"defaults_mismatch":0,"range_inverted":0,"unbacked_claims":0,"http_not_https":0,"heading_skip":0,"broken_post_links":0,"missing_sections":0,"bad_commit_refs":0,"dupe_words":0,"broken_rendered_links":0,"loc_drift":0,"frontmatter":0,"wordcount":5418},"status":"keep","description":"Iter 47 (findHighestContiguous → source verbatim): the snippet had `if !ok { return curReadIdx }` and `if !ok { break }` as one-liners. Source uses multi-line if blocks (canonical Go style). Replaced both with multi-line form. Now every line of this snippet substring-matches source verbatim. defects 0 → 0; wordcount 5418 unchanged.","timestamp":1778322210026,"segment":4}
{"run":37,"commit":"93ca369","metric":0,"metrics":{"build_warnings":0,"wordcount_off":0,"vague_claims":0,"missing_code_paths":0,"unverified_snippets":0,"weak_snippets":0,"numbers_no_math":0,"tilde_no_math":0,"percent_no_math":0,"ratio_no_citation":0,"missing_citations":0,"marketing_words":0,"hedge_words":0,"placeholder_urls":0,"inconsistent_idents":0,"footnote_balance":0,"math_off":0,"dollar_no_math":0,"bad_anchors":0,"frontmatter":0,"wordcount":4677},"status":"keep","description":"Iter 46 (autoresearch.ideas.md final summary refresh — captures all 19 substantive correctness fixes from resume-cycle iters 27-45). Updated the ideas-backlog to list every audit catch in this resume cycle so future agents can see the pattern of bugs the regex scorer missed. Total resume cycle: 36 iterations driving ~25 substantive fixes including: fabricated DEBUG strings, off-by-N arithmetic, wrong cause/effect chains, overgeneralized claims about MapMergeJob/tdigest/pg_dist_transaction, inconsistent path-numbering between §3 and §5, hook-example table mismatches, and ~9 others. Post state: 4677 words, 50/50 lines verbatim, 39/39 idents verified, 7/7 hashes resolve, hugo build clean, all 28 detector dimensions at 0. Total project history: 46 iterations on this post.","timestamp":1778322227686,"segment":6}
