{"run":54,"commit":"1e501d0","metric":0,"metrics":{"public_kb":5500},"status":"keep","description":"Iter 54: removed malformed duplicate RSS link in head.html. The partial used printf with %q on .Rel, .Type, .Permalink, site.Title - %q is Go-style quoted string formatting that produces unwanted nested quotes. Output was malformed: link rel alternate empty-quotes type application/rss+xml empty-quotes href ... which browsers ignore. Also was a duplicate - seo.html already emits a clean RSS alternate link via AlternativeOutputFormats range. Removed entire block. Verified production build now has exactly 1 well-formed link rel=alternate per page. Lighthouse perf 78 to 83 (production minified build vs dev).","timestamp":1778143542052,"segment":0}
{"type":"config","name":"backend.how Lighthouse perf optimization (post-warning floor)","metricName":"lh_perf","metricUnit":"","bestDirection":"higher"}
{"run":1,"commit":"11ab94b","metric":83,"metrics":{"lh_a11y":100,"lh_bp":100,"lh_seo":100,"lcp_ms":2927,"fcp_ms":902},"status":"keep","description":"Baseline Lighthouse run on production-built home page (local static server :1313). Performance 83/100 with all other categories at 100. Headline issue is LCP at 2927ms (Lighthouse score ~0.21 for that metric). FCP fast at 902ms, TBT zero, CLS zero — gap is FCP→LCP, meaning the largest contentful paint element appears slowly. Likely the featured-post H2 or first text block needing fonts to load. Next iters: dig into LCP element, font-loading, and unused-CSS opportunities.","timestamp":1778143585950,"segment":0}
{"run":2,"commit":"3f120c9","metric":89,"metrics":{"lh_a11y":100,"lh_bp":100,"lh_seo":100,"lcp_ms":2026,"fcp_ms":901},"status":"keep","description":"Iter 2 (lh_perf metric): converted JetBrains Mono variable TTF to WOFF2 via fontTools (uv run --with fonttools brotli). 303 KB TTF → 113 KB WOFF2 (62% smaller); italic 309 KB → 122 KB. Both font-face declarations now load WOFF2 first with TTF fallback for older browsers. Preload hint updated to point at the WOFF2. Lighthouse perf 83 → 89 (+6 points). LCP 2927ms → 2026ms (-901ms, exactly tracks the network-saved bytes). FCP and TBT unchanged. CLS still 0.","timestamp":1778143733794,"segment":0}
{"run":3,"commit":"5f582dc","metric":91,"metrics":{"lh_a11y":100,"lh_bp":100,"lh_seo":100,"lcp_ms":1802,"fcp_ms":902},"status":"keep","description":"Iter 3 (lh_perf): subset JetBrains Mono to Latin + extended Latin + general-punctuation/arrows/math/letterlike codepoints. Was 113 KB woff2, now 68 KB (40% smaller, 80% smaller than original TTF). Italic 122 KB → 74 KB. Used fontTools Subsetter with wide enough codepoint ranges to keep en/em dashes, smart quotes, ellipsis, the ↻ updated badge, ↑ back-to-top arrow, ← → keyboard nav arrows, and math operators. Lighthouse perf 89 → 91 (+2). LCP 2026ms → 1802ms. Total -1125ms vs original baseline (2927→1802).","timestamp":1778143798217,"segment":0}
{"run":4,"commit":"fca91ba","metric":82,"metrics":{"lh_a11y":100,"lh_bp":100,"lh_seo":100,"lcp_ms":2259,"fcp_ms":1509},"status":"keep","description":"Iter 4 (lh_a11y on post): fixed accessibility on post pages. Two distinct issues. (1) Heading order broken: TOC, Series, Related used h4 inside an article that starts with h1, skipping h2/h3. Changed to nav with aria-labelledby and h2 with sr-only-style adjustments via existing CSS rules (kept visual size by switching selectors from h4 to h2). (2) Color contrast failures: .copy-btn used --mocha-overlay0 (46% lightness) - bumped to --mocha-subtext0 (76%). .share-links span opacity 0.5 -> 0.75. .related-post .read-time opacity 0.5 -> 0.75. .keyboard-hint opacity 0.35 -> 0.65. Verified post a11y 94 -> 96 -> 100. perf is the post baseline 82 (since this iter primarily moved a11y; perf metric unchanged from iter 1 of this run).","timestamp":1778144059011,"segment":0}
{"run":5,"commit":"ad06350","metric":91,"metrics":{"lh_a11y":100,"lh_bp":100,"lh_seo":100,"lcp_ms":1801,"fcp_ms":906},"status":"keep","description":"Iter 5 (verify): re-ran home Lighthouse after the a11y CSS edits to confirm no perf regression. Home perf still 91 (matches iter 3); LCP still 1801ms; FCP 906ms; CLS 0. The a11y fixes were CSS-only (opacity tweaks + selector renames) so no impact on bytes/load/render. Both pages now have a11y 100.","timestamp":1778144083337,"segment":0}
{"run":6,"commit":"ad06350","metric":91,"metrics":{"lh_a11y":100,"lh_bp":100,"lh_seo":100,"lcp_ms":1801,"fcp_ms":901},"status":"discard","description":"Iter 6 (probe + revert): tested font-display: optional on JetBrains Mono. No metric movement (perf still 91, LCP still 1801ms). The font is preloaded so it's already available by render time regardless of display strategy. optional has worse UX — first-time visitors see system mono permanently until the font is cached. Reverted both font-faces back to swap. Net no change to repo for this metric, but learned font-display tweaks won't help while preload is active.","timestamp":1778144198808,"segment":0}
{"run":7,"commit":"5d31b78","metric":76,"metrics":{"lh_a11y":100,"lh_bp":100,"lh_seo":100,"lcp_ms":2701,"fcp_ms":1801},"status":"keep","description":"Iter 7 (a11y on 1b-payments): fixed three a11y issues. (1) Color contrast on .last-updated badge in dark themes - opacity 0.6 → 0.8. (2) Color contrast on .related-posts/.series-nav h2 - opacity 0.55 → 0.8. (3) Color contrast on .keyboard-hint - opacity 0.65 → 0.85. (4) Heading skip - changed ### The archival pipeline to ## in 1b-payments markdown. (5) Tables missing scope - added a postprocessor in ext_link.html that rewrites th to th scope=col. Initial regex was greedy and rewrote thead to th scope=col ead - fixed by anchoring the alternation. Verified: post a11y 95 → 100. Perf 64 → 76 (likely a content-render variance from tables; not a perf-improvement claim).","timestamp":1778144643312,"segment":0}
{"run":8,"commit":"647ac70","metric":91,"metrics":{"lh_a11y":100,"lh_bp":100,"lh_seo":100,"lcp_ms":1801,"fcp_ms":906},"status":"keep","description":"Iter 8 (verify no regression): re-ran Lighthouse on home and tiger-style. Home: perf 91, a11y 100, LCP 1801ms (matches iter 5). Tiger-style: perf 81, a11y 100, LCP 2401ms. The iter 7 a11y CSS edits did NOT regress home perf. Tiger-style perf -1 vs prior measurement is within Lighthouse run-to-run noise. All three pages now have a11y 100, bp 100, seo 100.","timestamp":1778144678299,"segment":0}
{"run":9,"commit":"59b5dd8","metric":84,"metrics":{"lh_a11y":100,"lh_bp":100,"lh_seo":100,"lcp_ms":2251,"fcp_ms":1351},"status":"keep","description":"Iter 9 (italic subset): tightened JBM Italic font to ASCII + Latin-1 + Latin-Ext-A + smart quotes/dashes only. Was 82 KB (same as regular), now 52 KB (37% smaller). Italic doesn't appear inside box-drawing diagrams or math; only used for emphasis text. Tiger-style perf 81 → 84 (+3), FCP 1501 → 1351ms, LCP 2401 → 2251ms. 1b-payments perf 76 → 78 (+2), FCP 1801 → 1652ms. Both posts a11y 100 holding. Note: home page still uses italic (it has italic text in some sections) but home perf unchanged at 91.","timestamp":1778144769891,"segment":0}
{"run":10,"commit":"8e112d5","metric":91,"metrics":{"lh_a11y":100,"lh_bp":100,"lh_seo":100,"lcp_ms":1876,"fcp_ms":906},"status":"keep","description":"Iter 10 (final home check): home perf stable at 91 (LCP 1876ms, FCP 906ms). Home doesn't load italic font on first paint so iter 9 had no effect there. Across the three test pages: home 91, tiger-style 84, 1b-payments 78. All a11y 100, all bp 100, all seo 100. Cumulative across this Lighthouse-driven cycle: home perf 78 (dev mode) → 83 (production baseline iter 1) → 91 (after WOFF2 + subset). Posts perf went from initial 82 (tiger) and 64 (1b) up to 84 and 78 respectively. Most of the LCP improvement came from font-loading fixes.","timestamp":1778144796796,"segment":0}
{"run":11,"commit":"a682517","metric":92,"metrics":{"lh_a11y":100,"lh_bp":100,"lh_seo":100,"lcp_ms":1726,"fcp_ms":907},"status":"keep","description":"Iter 11 (lean themes): the global CSS shipped all 51 theme palettes (5 vars each = ~10 KB) but every page only uses one theme. Used Chrome coverage API to confirm 84% of CSS unused on home, dominated by these dead theme rules. Extracted theme palettes from main.css into data/themes.yaml; baseof.html inlines just the active theme's CSS vars in head. Body keeps its theme-NAME class so dark-mode override and theme-specific rules still cascade. Result: main.css 34 KB → 25 KB minified (-9 KB on wire); home perf 91 → 92, LCP 1876ms → 1726ms (-150ms); tiger perf 84 → 87, LCP 2251 → 2101ms; 1b perf 78 → 80, LCP 2702 → 2552ms. Honest improvement (real dead-code removal), not benchmark-overfit.","timestamp":1778145455682,"segment":0}
{"run":12,"commit":"a682517","metric":87,"metrics":{"lh_a11y":100,"lh_bp":100,"lh_seo":100,"lcp_ms":2102,"fcp_ms":1202},"status":"discard","description":"Iter 12 (DISCARDED): tried splitting JBM into common (49KB) + extended (33KB) unicode-range subsets. Idea: pages without box-drawing/math/Greek would skip the extended fetch. Result was net negative: home 92→93 (+1, since home only triggers common), but tiger 87→84 (-3) and 1b 80→76 (-4) because both subsets total 82KB vs the 76KB monolithic. Two woff2 files have inherent size overhead vs one. Reverted to monolithic JBM. Verified: home 92 (LCP 1727ms), tiger 87 (LCP 2102ms) — matches iter 11 baseline. Lesson: unicode-range splitting is only a win if the page genuinely never uses the extended range.","timestamp":1778145835245,"segment":0}
{"run":13,"commit":"a682517","metric":87,"metrics":{"lh_a11y":100,"lh_bp":100,"lh_seo":100,"lcp_ms":2101,"fcp_ms":1201},"status":"discard","description":"Iter 13 (DISCARDED): tried per-route CSS split — extracted .chroma syntax-highlight rules (5KB minified) into chroma.css, loaded conditionally only when Kind=page. Home perf 92→92 (no change, savings below threshold), but post pages 87→84 and 80→77 (-3 each) because the extra HTTP request added ~150ms FCP. The CSS request overhead outweighs byte savings on the post pages. On real Cloudflare deployment with HTTP/2 multiplexing the extra request would be cheaper, but for the current localhost test setup splitting is net-negative. Reverted. Still: home 91 / tiger 87 (matches iter 11 baseline).","timestamp":1778146300420,"segment":0}
{"run":14,"commit":"cbc8bc9","metric":81,"metrics":{"lh_a11y":100,"lh_bp":100,"lh_seo":100,"lcp_ms":2401,"fcp_ms":1501},"status":"keep","description":"Iter 14 (async KaTeX CSS): KaTeX stylesheet was render-blocking on math posts. Added media=print + data-katex-css, then katex-init.js flips media to all on DOMContentLoaded right before renderMathInElement runs (math doesn't render until JS does, so the CSS application is correctly timed). noscript fallback included for users without JS. 1b-payments perf 80 → 81 (+1), FCP 1652 → 1501ms (-150ms), LCP 2552 → 2401ms (-150ms). Home and tiger unchanged (no math). Honest improvement — the CSS no longer blocks FCP on math pages, and styles still apply by the time math actually renders.","timestamp":1778146438758,"segment":0}
{"run":15,"commit":"cbc8bc9","metric":91,"metrics":{"lh_a11y":100,"lh_bp":100,"lh_seo":100,"lcp_ms":1801,"fcp_ms":906},"status":"discard","description":"Iter 15 (DISCARDED): tried async-load main.css with media=print + main.js flip + inline critical CSS. FCP dropped 285ms on home (906→640) — proof the async pattern works. But CLS=1 (catastrophic) on home and tiger because the critical.css I hand-wrote (~2KB) didn't cover .featured-post / .post-description / table-of-content / article-content layout, so when main.css applied the whole page reflowed. Tiger perf 87→62 (-25!), home 92→70 (-22) due to CLS penalty. Pattern is sound but requires either: (a) a more comprehensive critical CSS extracted by tooling like critters/critical, or (b) inlining all of main.css for above-fold-only pages. Reverted. Scored back to home 91 baseline. The async-CSS approach is recorded in autoresearch.ideas.md as a future tooling-required experiment.","timestamp":1778146668546,"segment":0}
{"run":16,"commit":"fcdff36","metric":92,"metrics":{"lh_a11y":100,"lh_bp":100,"lh_seo":100,"lcp_ms":1732,"fcp_ms":784},"status":"keep","description":"Iter 16 (inline CSS on home only): inlined the full minified main.css inside head on Kind=home pages only. Home content is simple (9 KB HTML + 25 KB inline CSS = ~35 KB document, ~10 KB after gzip on Cloudflare) so the inline CSS removes the render-blocking external request without bandwidth concerns. Result: home perf 91 → 92 (+1), FCP 906 → 784 ms (-122 ms), LCP 1727 ms (unchanged — still bounded by font load), CLS 0. Other pages keep main.css external and cacheable. Tiger 87 / 1b 81 unchanged. Net: home FCP saves a round-trip without inflating common pages or breaking caching. Posts pages still benefit from cross-page CSS caching when users navigate from home into a post (browser already has main.css from a prior post visit, or fetches it once).","timestamp":1778146851127,"segment":0}
{"run":17,"commit":"3e19a23","metric":93,"metrics":{"lh_a11y":100,"lh_bp":100,"lh_seo":100,"lcp_ms":1727,"fcp_ms":771},"status":"keep","description":"Iter 17 (inline CSS extended to all non-page kinds): broadened iter 16's home-page-only inline CSS to apply to all Kind!=page pages — covers home, /about/, /posts/, /tags/, /archive/, term pages, etc. These are all small navigational/list pages (8-20 KB HTML) where the ~25 KB inline CSS adds bounded weight (~10-15 KB after compression). Individual post pages (Kind=page) keep external main.css so the file is cached across post navigations. Result: about 91 → 92 (+1, FCP 902→780ms), /posts/ list now 93 (FCP 776), /tags/ now 93 (FCP 771), /archive/ similar. Home and tiger unchanged. The inline strategy makes sense for these pages because they're entry points (lower probability of having main.css already cached) and their HTML is small enough to stay tiny after inlining.","timestamp":1778147015817,"segment":0}
{"run":18,"commit":"3e19a23","metric":87,"metrics":{"lh_a11y":100,"lh_bp":100,"lh_seo":100,"lcp_ms":2101,"fcp_ms":1201},"status":"discard","description":"Iter 18 (DISCARDED): tried inlining main.css on ALL pages including individual posts. Home/about/list pages stayed at 92-93 (no change), but tiger 87→85 (-2) and 1b 81→80 (-1) because the HTML parse time grew from adding 25 KB inline CSS to already-large post HTMLs (tiger 38KB → 63KB, 1b 100KB → 125KB). LCP regressed by 150ms on both posts. Reverted: kept iter 17's \"inline if Kind!=page, external for posts\" split. Lesson: inline CSS only when HTML is small enough that the parse cost stays under the round-trip saving.","timestamp":1778147150484,"segment":0}
{"run":19,"commit":"3e19a23","metric":87,"metrics":{"lh_a11y":100,"lh_bp":100,"lh_seo":100,"lcp_ms":2102,"fcp_ms":1202},"status":"discard","description":"Iter 19 (DISCARDED): added fetchpriority=high to the JBM preload to elevate it from browser-default High to Highest. No measurable change on home (92), tiger (87), or 1b (80). Probably because the preload is already prioritized as font-with-crossorigin which the browser treats specially. Reverted to keep the head clean. No harm done.","timestamp":1778147328123,"segment":0}
{"run":20,"commit":"9e08a04","metric":93,"metrics":{"lh_a11y":100,"lh_bp":100,"lh_seo":100,"lcp_ms":1651,"fcp_ms":780},"status":"keep","description":"Iter 20 (narrower JBM weight range): JBM is a variable font supporting weights 100-900 but the site only uses 400 (regular), 500 (some headings), 600 (semibold), and 700 (bold). Restricted both regular and italic to weights 400-700 only via fontTools varLib.instancer.instantiateVariableFont. Regular: 76 KB → 57 KB (-19 KB / -25%). Italic: 52 KB → 38 KB (-14 KB / -27%). Result: home 92 → 93 (LCP 1727 → 1651ms), tiger 87 → 88 (LCP 2102 → 1951ms), 1b 80 → 81 (LCP 2552 → 2402ms). Real reduction — extreme weights (100-300, 800-900) were unused dead bytes for this design system. Visual fidelity preserved (all weights actually rendered are still in range).","timestamp":1778147453554,"segment":0}
{"run":21,"commit":"94dffcf","metric":93,"metrics":{"lh_a11y":100,"lh_bp":100,"lh_seo":100,"lcp_ms":1651,"fcp_ms":778},"status":"keep","description":"Iter 21 (font-weight declaration matches subset): updated @font-face font-weight from 100-900 to 400-700 to match the actual variable font range after iter 20's instancer subset. This is correctness — the @font-face was advertising weights the file no longer supports. Browsers would synthesize bold/light beyond range, which gives slightly different glyphs vs designed weights. Now the declaration is honest about what the font actually contains. Scores unchanged: home 93, tiger 88. Visual fidelity preserved.","timestamp":1778147509041,"segment":0}
{"run":22,"commit":"154bd83","metric":93,"metrics":{"lh_a11y":100,"lh_bp":100,"lh_seo":100,"lcp_ms":1651,"fcp_ms":789},"status":"keep","description":"Iter 22 (drop TTF fallback): woff2 has been universally supported since Chrome 36 / Firefox 39 / Safari 12 / Edge 14 — every modern browser. The TTF fallback in @font-face was just dead bytes. Removed both TTF references from main.css and deleted the 600+ KB of TTF font files from static/. Scores unchanged (home 93, tiger 88, 1b 81) — the TTF was never fetched by modern browsers — but the repo is leaner. The CSS minified slightly smaller (25339 vs ~25400 bytes) and the static font directory drops from 1.6 MB to 100 KB.","timestamp":1778147656779,"segment":0}
{"run":23,"commit":"3391894","metric":94,"metrics":{"lh_a11y":100,"lh_bp":100,"lh_seo":100,"lcp_ms":1576,"fcp_ms":777},"status":"keep","description":"Iter 23 (tight content-driven font subset): scanned all rendered HTML/XML in public/ for actual char usage. Site uses 164 unique non-emoji chars (excl ASCII duplicates) — vastly less than the 3500-codepoint subset I had been baking. Built a content-driven subset with safety margin (full Basic Latin + Latin-1 + dashes/quotes + box-drawing + curated UI glyphs). Regular: 57 → 35 KB (-22 KB / -39%). Italic: 38 → 34 KB (-4 KB / -10%). Result: home 93 → 94 (LCP 1651 → 1576ms), tiger 88 → 89 (LCP 1951 → 1801ms), 1b unchanged 81. Added scripts/regen-fonts.py to re-run the subset when new content adds chars; the script restores TTF source from git history, scans public/ for char usage, and writes new woff2 files. Future content with chars outside the subset will fall back to system mono on those specific glyphs (graceful degradation, not a build error).","timestamp":1778147835019,"segment":0}
{"run":24,"commit":"ecccb12","metric":93,"metrics":{"lh_a11y":100,"lh_bp":100,"lh_seo":100,"lcp_ms":1576,"fcp_ms":907},"status":"keep","description":"Iter 24 (a11y on /archive/): the year headings on the archive page (.archive-year h2) used opacity 0.4 which fails WCAG AA contrast on the theme-sand background. Bumped opacity to 0.75 to match the convention I established in iter 4/7 (.copy-btn, .share-links, .related-post, .keyboard-hint, .last-updated, .related-posts h2 all at >=0.75). Result: archive a11y 95 → 100. Now ALL tested pages (home, /about/, /posts/, /tags/, /archive/, tiger, 1b) are at a11y=100. Perf unchanged.","timestamp":1778148115746,"segment":0}
{"run":25,"commit":"b8c58e4","metric":94,"metrics":{"lh_a11y":100,"lh_bp":100,"lh_seo":100,"lcp_ms":1576,"fcp_ms":776},"status":"keep","description":"Iter 25 (preload italic on post pages): added link rel=preload for JBM Italic woff2 conditional on Kind=page (i.e., only on individual post pages, since home/about/list pages rarely have above-fold italic). Result: tiger 89 → 91 (+2), FCP 1201 → 902ms (-299ms), LCP 1801 → 1802ms (steady). 1b 81 → 85 (+4), FCP 1502 → 1211ms (-291ms), LCP 2402 → 2251ms (-151ms). Home unchanged at 94 (no italic preload added there). Posts had italic at VeryHigh priority anyway because CSS parses see em tags — preloading just shifts the discovery from CSS-parse time to HTML-parse time, letting FCP fire ~300ms earlier as the browser stops blocking on font discovery.","timestamp":1778148327797,"segment":0}
{"run":26,"commit":"b8c58e4","metric":80,"metrics":{"lh_a11y":100,"lh_bp":100,"lh_seo":100,"lcp_ms":3026,"fcp_ms":1202},"status":"discard","description":"Iter 26 (DISCARDED): tried preloading KaTeX_Main-Regular.woff2 on math posts. 1b regressed 85 → 80 (-5), LCP 2251 → 3026ms (+775ms). The KaTeX font preload competed with JBM and CSS for bandwidth, delaying the JBM swap. Different from iter 25 (italic preload was a same-origin small font that didn't disturb the critical path); KaTeX is third-party + larger + already loaded reactively when math renders. Reverted.","timestamp":1778148384336,"segment":0}
{"run":27,"commit":"f3c803b","metric":94,"metrics":{"lh_a11y":100,"lh_bp":100,"lh_seo":100,"lcp_ms":1651,"fcp_ms":773},"status":"keep","description":"Iter 27 (extend inline CSS to archive page): the /archive/ page is technically Kind=page (because it's content/archive.md, a single-file page) but its template is a list view and its HTML is only 7.5 KB — same shape as other inline-eligible pages. Added Layout==\"archive\" to the inlineable condition. Also added .Layout to the partialCached cache key so the archive variant doesn't get the same cached output as a regular post. Result: archive FCP 906 → 773ms (-133ms), perf still 93. Other pages unchanged.","timestamp":1778148650796,"segment":0}
