{"run":50,"commit":"9af5dcb","metric":0,"metrics":{"build_warnings":0,"wordcount_off":0,"vague_claims":0,"missing_code_paths":0,"unverified_snippets":0,"weak_snippets":0,"numbers_no_math":0,"tilde_no_math":0,"percent_no_math":0,"ratio_no_citation":0,"missing_citations":0,"marketing_words":0,"hedge_words":0,"placeholder_urls":0,"inconsistent_idents":0,"footnote_balance":0,"math_off":0,"dollar_no_math":0,"bad_anchors":0,"defaults_mismatch":0,"range_inverted":0,"unbacked_claims":0,"http_not_https":0,"heading_skip":0,"broken_post_links":0,"missing_sections":0,"bad_commit_refs":0,"dupe_words":0,"broken_rendered_links":0,"loc_drift":0,"frontmatter":0,"wordcount":5418},"status":"keep","description":"Iter 50 (50-iteration milestone — final snippet polish): two more snippets brought to source-verbatim. (a) SendStandbyStatusUpdate's body had `return pglogrepl.SendStandbyStatusUpdate(...)` directly — source has `err := pglogrepl... return err`. Replaced and marked \"(err handling + log elided)\". (b) beforeNode snippet had `_ := schema.NewPrimitiveNodeLogical(...)` (blank-identifier) and `-1, -1,` on one line — source uses `err :=` and `-1, -1,` on separate lines. Replaced. Snippet match status: 16 of 24 path-commented snippets are 100% source-verbatim, the remainder are 75-89% (the non-matching lines are the path-comment headers and intentionally-elided err-handling, both expected). 50-iteration milestone summary: 17+ real correctness bugs caught (PUT/min math 7-15× wrong, 4-vs-5 atomics, 100 events/sec quiet-case wrong, workers-vs-walker writer attribution, WAL bytes vs pgoutput bytes, S3 key uses Timestamp not LSN, idx_scan semantics, dual-write fallacy mis-attribution, 4-vs-3 ops, page-index 128 MB row-group claim, fsync 600 µs vs actual 163 µs, pprof flame-graph overclaim, Timestamp.UnixMicro monotonicity overclaim, ~30× compression overclaim, \"twenty lines\" wiring overclaim, \"Five atomics\" miscount, 1.6k-800 inverted range). Plus 14+ snippet-rewrites to source-verbatim. The post is at 5418 prose words (16 over brief's 5500-bucket grace, well within scorer's tolerance). 30+ scorer dimensions all 0. Build clean. Brief stop conditions: ✓ all 8 sections, ✓ Hugo build, ✓ frontmatter TOML, wordcount slightly over (5418 vs 5000 brief target — but the post is content-rich and existing site posts are 6500+).","timestamp":1778322423242,"segment":4}
{"run":40,"commit":"c0f3db8","metric":0,"metrics":{"build_warnings":0,"wordcount_off":0,"vague_claims":0,"missing_code_paths":0,"unverified_snippets":0,"weak_snippets":0,"numbers_no_math":0,"tilde_no_math":0,"percent_no_math":0,"ratio_no_citation":0,"missing_citations":0,"marketing_words":0,"hedge_words":0,"placeholder_urls":0,"inconsistent_idents":0,"footnote_balance":0,"math_off":0,"dollar_no_math":0,"bad_anchors":0,"frontmatter":0,"wordcount":4716},"status":"keep","description":"Iter 49 (precision fix on §5 path 1 — \"wrapped in CustomScan\" was technically wrong). Original prose: \"PlannedStmt whose planTree is a SeqScan placeholder, wrapped in a CustomScan node\". Re-read FinalizeRouterPlan in distributed_planner.c (line 1600+): it constructs a NEW PlannedStmt and sets its planTree to the CustomScan directly. The original placeholder's planTree (the SeqScan) gets dropped on the floor — only the targetlist is preserved. \"Wrapped\" implies nesting, but the CustomScan REPLACES rather than wraps. Reworded: \"FastPathPlanner first builds a placeholder PlannedStmt whose planTree is a SeqScan ... so that the targetlist is populated correctly. FinalizeRouterPlan then constructs a new PlannedStmt whose planTree is a CustomScan tagged 'Citus Adaptive' — the SeqScan placeholder is dropped on the floor at this point.\" Now reflects what the source actually does. defects 0 → 0; wordcount 4696 → 4716.","timestamp":1778322436538,"segment":6}
{"run":36,"commit":"439ab8d","metric":0,"metrics":{"build_warnings":0,"wordcount_off":0,"missing_code_paths":0,"weak_snippets":0,"numbers_no_math":0,"percent_no_math":0,"hedge_words":0,"placeholder_urls":0,"inconsistent_idents":0,"unbacked_claims":0,"broken_post_links":0,"wordcount":4622},"status":"keep","description":"Iter 35 (description meta inconsistent with body). The description said 1.5 s of randomised waiting but the body derives 1.33 s as the expected first-fire over 2 followers in n=3. 1.5 s is the expected single-follower timer; 1.33 s is the order-statistic min that actually matters for failover. Updated description to 1.3 s. Defects 0; wordcount unchanged.","timestamp":1778322439719,"segment":6}
{"run":52,"commit":"0422419","metric":0,"metrics":{"build_warnings":0,"wordcount_off":0,"vague_claims":0,"missing_code_paths":0,"unverified_snippets":0,"weak_snippets":0,"numbers_no_math":0,"tilde_no_math":0,"percent_no_math":0,"ratio_no_citation":0,"missing_citations":0,"marketing_words":0,"hedge_words":0,"placeholder_urls":0,"inconsistent_idents":0,"footnote_balance":0,"math_off":0,"dollar_no_math":0,"bad_anchors":0,"frontmatter":0,"unbacked_claims":0,"wordcount":4640},"status":"keep","description":"Iter 52 (precision — instruction count claim). The Compute-it punchline said 'at the same instruction count' for shared_atomic vs sharded_padded variants. Strictly the instruction counts differ slightly: shared_atomic does atomic.AddInt64 which is LDADD on ARMv8.1+ (one instruction) but on Apple Silicon's older atomic path was an LDXR/STXR loop with possible retries; sharded_padded does a plain load-add-store (3 instructions). Reframed as 'in roughly the same number of instructions per op (one atomic vs one plain increment)'. Same point — the 32x gap is not from compute work, it's from coordination — but no overstatement. wordcount 4632 to 4640.","timestamp":1778322448283,"segment":6}
{"run":51,"commit":"ce455ad","metric":0,"metrics":{"build_warnings":0,"wordcount_off":0,"vague_claims":0,"missing_code_paths":0,"unverified_snippets":0,"weak_snippets":0,"numbers_no_math":0,"tilde_no_math":0,"percent_no_math":0,"ratio_no_citation":0,"missing_citations":0,"marketing_words":0,"hedge_words":0,"placeholder_urls":0,"inconsistent_idents":0,"footnote_balance":0,"math_off":0,"dollar_no_math":0,"bad_anchors":0,"defaults_mismatch":0,"range_inverted":0,"unbacked_claims":0,"http_not_https":0,"heading_skip":0,"broken_post_links":0,"missing_sections":0,"bad_commit_refs":0,"dupe_words":0,"broken_rendered_links":0,"loc_drift":0,"frontmatter":0,"wordcount":5398},"status":"keep","description":"Iter 51 (decoding-cost cite cleanup): the §7 decoding-cost paragraph cited the Go spec's allocation section as backing for the `~5 µs/column` figure. The Go spec page describes `new`/`make` semantics — it does NOT contain benchmark numbers, so the cite was decorative not substantive. Removed the cite. Replaced with a more honest framing: \"Both are well-trodden Go allocation patterns. Take ~5 µs/column as a back-of-envelope; a real `go test -bench` on the decoder would refine it.\" Reader gets the same point without the misleading citation. Trim helped wordcount drop to 5398 (under brief's 5500-grace bucket comfortably). defects 0 → 0; wordcount 5418 → 5398.","timestamp":1778322472472,"segment":4}
{"run":39,"commit":"b4ba8b1","metric":0,"metrics":{"build_warnings":0,"wordcount_off":0,"vague_claims":0,"missing_code_paths":0,"unverified_snippets":0,"numbers_no_math":0,"missing_citations":0,"marketing_words":0,"frontmatter":0,"placeholder_urls":0,"bad_url_host":0,"ground_truth_drift":0,"hedge_words":0,"tilde_no_math":0,"percent_no_math":0,"img_no_alt":0,"long_code_lines":0,"math_off":0,"wordcount":4825},"status":"keep","description":"Iter 39: thesis-correctness fix on the hook blockquote. The previous wording 'The image is at most a quarter of the wall-clock' was wrong on both fronts. With remote pulls (gcr.io, 2.5-3 s pull, 200 ms runtime, 22 ms app), image bytes are 90%+ of cold-start. With local pulls (300 ms pull), image is still ~60% of cold-start. The claim never held. Reworded to a more accurate thesis: 'image bytes dominate when you're cold-pulling (1.6-3 s for any of the three), and the container-runtime plumbing dominates once the image is local (~200 ms here, regardless of base). The base-image CHOICE moves wall-clock by tens of milliseconds either way.' Now the blockquote is consistent with the actual measured data and supports the post's central argument: image-size is the wrong axis to argue about. Wordcount 4796 -> 4825.","timestamp":1778322475537,"segment":6}
{"run":22,"commit":"82d90df","metric":0,"metrics":{"build_warnings":0,"wordcount_off":0,"vague_claims":0,"missing_code_paths":0,"unverified_snippets":0,"weak_snippets":0,"numbers_no_math":0,"tilde_no_math":0,"percent_no_math":0,"ratio_no_citation":0,"missing_citations":0,"marketing_words":0,"hedge_words":0,"placeholder_urls":0,"inconsistent_idents":0,"footnote_balance":0,"math_off":0,"dollar_no_math":0,"bad_anchors":0,"defaults_mismatch":0,"range_inverted":0,"unbacked_claims":0,"http_not_https":0,"heading_skip":0,"broken_post_links":0,"missing_sections":0,"bad_commit_refs":0,"dupe_words":0,"broken_rendered_links":0,"loc_drift":0,"frontmatter":0,"wordcount":4274},"status":"keep","description":"Iter 22 (MB/MiB/GB/GiB unit consistency across the post): 0 defects held. Real precision fix. The post mixed binary-prefix MB (used by pg_size_pretty) and decimal MB (used by os.path.getsize / 1e6) interchangeably, leading to small but real arithmetic mismatches. Audited every byte-quantity and re-derived from raw bytes in MiB / GiB explicitly: lineitem heap is 9461235712 bytes = 9023 MiB = 8.81 GiB exactly (was variously '9 GB' / '9.02 GiB' / 'about 9 GB' / '9000 MB' across three sections). Q06 EXPLAIN reads = 1078182 × 8 KiB = 8625456 KiB = 8423 MiB = 8.22 GiB (was variously '8.2 GiB' / '8.4 GiB'). Throughput derivation: 8423 / 25 ≈ 337 MiB/s. Q01 IO wall: 9023 / 337 ≈ 26.8 s, ÷4 ≈ 6.8 s. Every number now traces back to a measured byte count without unit drift. Wordcount 4271 → 4274.","timestamp":1778322476976,"segment":6}
{"run":37,"commit":"8e6ae39","metric":0,"metrics":{"build_warnings":0,"wordcount_off":0,"missing_code_paths":0,"weak_snippets":0,"numbers_no_math":0,"percent_no_math":0,"hedge_words":0,"placeholder_urls":0,"inconsistent_idents":0,"unbacked_claims":0,"broken_post_links":0,"wordcount":4622},"status":"keep","description":"Iter 36 (consolidate hook ratios on 1.3 s expected wait). The hook had two ratio derivations that used 1.5 s as the wait (the per-follower expected timer), but the body and description use 1.3 s (the order-stat min over 2 followers, which is what failover actually waits for). Updated the hook two ratios to 1.3 s: 200 us / 1.8 us approx 100x and 1.3 s / 200 us approx 6500x; below the table 1.3 s / 1.8 us approx 722000. Now consistent with the body and description. (1.5 s remains in the body as a labelled per-follower expectation, then 1.33 s is the explicit order-stat result.) Defects 0; wordcount 4622 unchanged.","timestamp":1778322484557,"segment":6}
{"run":32,"commit":"0770cdb","metric":0,"metrics":{"build_warnings":0,"wordcount_off":0,"vague_claims":0,"missing_code_paths":0,"unverified_snippets":0,"weak_snippets":0,"numbers_no_math":0,"tilde_no_math":0,"percent_no_math":0,"ratio_no_citation":0,"missing_citations":0,"marketing_words":0,"hedge_words":0,"placeholder_urls":0,"inconsistent_idents":0,"footnote_balance":0,"math_off":0,"dollar_no_math":0,"bad_anchors":0,"defaults_mismatch":0,"range_inverted":0,"unbacked_claims":0,"http_not_https":0,"heading_skip":0,"frontmatter":0,"wordcount":4362},"status":"keep","description":"Iter 32 (bpftrace one-liner improvement). Linux bpftrace one-liner used '@[args->count] = count()' which creates one histogram bin per distinct byte count — produces unwieldy output for any real workload (thousands of bins). Idiomatic bpftrace histograms use the hist() built-in: '@bytes = hist(args->count)' which auto-buckets by power-of-2. Updated and added explanatory tail '— auto-bucketed histogram of pwrite sizes by power-of-two bins'. Now the one-liner is something a reader can copy-paste and get a useful output without further refinement. Wordcount 4353 → 4362. defects 0.","timestamp":1778322487525,"segment":6}
{"run":34,"commit":"b1b07ba","metric":0,"metrics":{"build_warnings":0,"wordcount_off":0,"vague_claims":0,"missing_code_paths":0,"unverified_snippets":0,"weak_snippets":0,"numbers_no_math":0,"tilde_no_math":0,"percent_no_math":0,"ratio_no_citation":0,"missing_citations":0,"marketing_words":0,"hedge_words":0,"placeholder_urls":0,"inconsistent_idents":0,"footnote_balance":0,"math_off":0,"dollar_no_math":0,"bad_anchors":0,"defaults_mismatch":0,"range_inverted":0,"unbacked_claims":0,"http_not_https":0,"heading_skip":0,"broken_post_links":0,"missing_sections":0,"bad_commit_refs":0,"dupe_words":0,"broken_rendered_links":0,"frontmatter":0,"wordcount":4713},"status":"keep","description":"Iter 33 (audit pass — §4.3 skiplist count consistency with iter 32 ASCII). After iter 32's ASCII flow update mentioned \"for each memtable in queue (newest→oldest, skiplist scan)\", the prose still said \"1 skiplist probe\". A reader cross-checking the ASCII against the prose would notice the inconsistency. Updated to \"1-3 skiplist probes (typically one mutable memtable + 0-2 immutable awaiting flush)\" — aligns with both the source code (Pebble's mem queue model) and the typical operational reality. The \"1-3\" range comes from: (a) always 1 mutable; (b) immutables exist between freeze-time and flush-completion-time, capped by MemTableStopWritesThreshold defaulting to ~5, but typically 0-2 in steady state. Defects 0; wordcount 4705 → 4713.","timestamp":1778322513010,"segment":6}
{"run":38,"commit":"fd17c84","metric":0,"metrics":{"build_warnings":0,"wordcount_off":0,"missing_code_paths":0,"weak_snippets":0,"numbers_no_math":0,"percent_no_math":0,"hedge_words":0,"placeholder_urls":0,"inconsistent_idents":0,"unbacked_claims":0,"broken_post_links":0,"wordcount":4622},"status":"keep","description":"Iter 37 (colophon bench command consistent with body snippet). The body shows go test -v -bench=BenchmarkOneNode... output (with the BenchmarkOneNode-14 prefix lines), but the colophon's command was missing the -v flag. Reader copying from colophon would not get the prefix lines. Added -v. Defects 0; wordcount 4622 unchanged.","timestamp":1778322521691,"segment":6}
{"run":52,"commit":"b12bc3d","metric":0,"metrics":{"build_warnings":0,"wordcount_off":0,"vague_claims":0,"missing_code_paths":0,"unverified_snippets":0,"weak_snippets":0,"numbers_no_math":0,"tilde_no_math":0,"percent_no_math":0,"ratio_no_citation":0,"missing_citations":0,"marketing_words":0,"hedge_words":0,"placeholder_urls":0,"inconsistent_idents":0,"footnote_balance":0,"math_off":0,"dollar_no_math":0,"bad_anchors":0,"defaults_mismatch":0,"range_inverted":0,"unbacked_claims":0,"http_not_https":0,"heading_skip":0,"broken_post_links":0,"missing_sections":0,"bad_commit_refs":0,"dupe_words":0,"broken_rendered_links":0,"loc_drift":0,"frontmatter":0,"wordcount":5400},"status":"keep","description":"Iter 52 (Parquet type fix — LIST<STRUCT<...>> → STRUCT<...>): the §8 schema-registry deferred-idea said \"Avro or Confluent Schema Registry + Parquet LIST<STRUCT<...>> columns\". WRONG: LIST<STRUCT> is for repeated/array data; CDC events have ONE before/after per row, not a list of them. The right type for typed-CDC payloads is STRUCT<col1: type1, col2: type2, ...> (per-table, since each table has its own column set). Rewrote: \"per-table Parquet STRUCT<col1: type1, ...> columns\". Now the type signature matches what an actual schematized CDC payload would look like in Parquet. defects 0 → 0; wordcount 5398 → 5400.","timestamp":1778322522704,"segment":4}
{"run":57,"commit":"7d58279","metric":0,"metrics":{"vague_claims":0,"ratio_no_citation":0,"marketing_words":0,"hedge_words":0,"weak_snippets":0,"missing_code_paths":0,"math_off":0,"wordcount":5433,"unverified_snippets":0,"missing_citations":0,"numbers_no_math":0,"frontmatter":0},"status":"keep","description":"Iter 57 (literal Unicode escape in §6). Found a stray '\\u2014' in the vacuum paragraph that was meant to be an em-dash '—'. The escape sequence had been written literally instead of resolved during one of the earlier multi-edit operations. Replaced with the actual character. Hugo build was clean (Goldmark passes the literal through), but the rendered text would show '\\u2014 see' instead of '— see'. Now fixed. Wordcount 5433; defects 0.","timestamp":1778322525903,"segment":6}
{"run":41,"commit":"22b7bcd","metric":0,"metrics":{"build_warnings":0,"wordcount_off":0,"vague_claims":0,"missing_code_paths":0,"unverified_snippets":0,"weak_snippets":0,"numbers_no_math":0,"tilde_no_math":0,"percent_no_math":0,"ratio_no_citation":0,"missing_citations":0,"marketing_words":0,"hedge_words":0,"placeholder_urls":0,"inconsistent_idents":0,"footnote_balance":0,"math_off":0,"dollar_no_math":0,"bad_anchors":0,"frontmatter":0,"wordcount":4716},"status":"keep","description":"Iter 50 (off-by-one line citation fix on §4 step 1). The prose said \"the header comment captures the simplification, lines 16-24\" but my quoted block is actually 9 lines starting at line 15 (\" * For example query: WHERE...\") and ending at line 23. Off by one. Fixed to \"lines 15-23\". Cross-checked with sed -n '15,23p' src/backend/distributed/planner/shard_pruning.c — exact match. defects 0 → 0; wordcount 4716 unchanged. This is the kind of typo a reader following the post into source would catch immediately.","timestamp":1778322537818,"segment":6}
{"run":23,"commit":"a9756bb","metric":0,"metrics":{"build_warnings":0,"wordcount_off":0,"vague_claims":0,"missing_code_paths":0,"unverified_snippets":0,"weak_snippets":0,"numbers_no_math":0,"tilde_no_math":0,"percent_no_math":0,"ratio_no_citation":0,"missing_citations":0,"marketing_words":0,"hedge_words":0,"placeholder_urls":0,"inconsistent_idents":0,"footnote_balance":0,"math_off":0,"dollar_no_math":0,"bad_anchors":0,"defaults_mismatch":0,"range_inverted":0,"unbacked_claims":0,"http_not_https":0,"heading_skip":0,"broken_post_links":0,"missing_sections":0,"bad_commit_refs":0,"dupe_words":0,"broken_rendered_links":0,"loc_drift":0,"frontmatter":0,"wordcount":4290},"status":"keep","description":"Iter 23 (profile-output arithmetic correctness): 0 defects held. Real arithmetic fix the metric didn't catch. The 'Bonus: bpftrace-style observability' section reported the operator profile sums (`SEQ_SCAN: 1.044 s + PERFECT_HASH_GROUP_BY: 1.056 s + four PROJECTIONs summing to 0.185 s + ORDER_BY: 1 ms`) and concluded '/8 ≈ 263 ms per thread' — but `(1044 + 1056 + 185 + 1) / 8 = 285.75` ms, not 263. The 263 number leaked from a stale calculation in iter 9's notes. Fixed the arithmetic: per-thread upper bound is 285.75 ms, and the reported 210.5 ms wall clock is shorter because operators run in parallel pipelines (a pipeline-barrier scheduling story, not a \"263 ms matches 211 ms with overhead\" story). Also reframed: 285.75 ms is an *upper bound* per thread, not a target. Wordcount 4274 → 4290.","timestamp":1778322545680,"segment":6}
{"run":60,"commit":"3628cbf","metric":0,"metrics":{"build_warnings":0,"missing_code_paths":0,"unverified_snippets":0,"unverified_literal":0,"numbers_no_math":0,"missing_citations":0,"marketing_words":0,"frontmatter":0,"bad_url_anchor":0,"bad_commit_ref":0,"factlib_size_drift":0,"wal_record_overhead_off":0,"fabricated_production":0,"loc_drift":0,"orders_of_magnitude":0,"bad_section_xref":0,"long_code_lines":0,"heading_skip":0,"bad_anchor_link":0,"license_claim":0,"gofmt":0,"fence_balance":0,"duplicate_paragraph":0,"numbered_list_gap":0,"github_line_ref":0,"digit_claim":0,"filler_phrases":0,"para_terminator":0,"trailing_ws":0,"wordcount":4983},"status":"keep","description":"Iter 64 (scorer extension — trailing whitespace). Added trailing_ws detector (×1): if more than 5 lines have trailing whitespace, flag 1 defect. Threshold avoids false positives on intentional code-block whitespace; 5+ is sloppy editing. Currently 0; the post is clean. defects unchanged. The scorer now has 34 detector dimensions across content correctness, code verifiability, source-of-truth alignment, prose quality, and structural sanity.","timestamp":1778322548599,"segment":4}
{"run":58,"commit":"be97a8c","metric":0,"metrics":{"vague_claims":0,"ratio_no_citation":0,"marketing_words":0,"hedge_words":0,"weak_snippets":0,"missing_code_paths":0,"math_off":0,"wordcount":5447,"unverified_snippets":0,"missing_citations":0,"numbers_no_math":0,"frontmatter":0},"status":"keep","description":"Iter 58 (post-§7 italic-block reproducibility consistency). The italic 'Source for the numbers' block at the end of §7 still claimed '±2 % and ±10 % respectively' for recall and latency reproducibility — the old claim from before iter 19. The [^bench] footnote was updated in iter 19 to be honest about host-load sensitivity, but this italic block was forgotten. Reconciled: 'Recall is deterministic (832.6 B/row reproduces to the byte); latency varies ±10 % on a quiet machine, more under host load — full methodology in [^bench]'. Both blocks now say the same thing. Wordcount 5447; defects 0.","timestamp":1778322564523,"segment":6}
