{"run":33,"commit":"f0a9e9a","metric":0,"metrics":{"build_warnings":0,"wordcount_off":0,"vague_claims":0,"missing_code_paths":0,"unverified_snippets":0,"weak_snippets":0,"numbers_no_math":0,"tilde_no_math":0,"percent_no_math":0,"ratio_no_citation":0,"missing_citations":0,"marketing_words":0,"hedge_words":0,"placeholder_urls":0,"inconsistent_idents":0,"footnote_balance":0,"math_off":0,"dollar_no_math":0,"bad_anchors":0,"defaults_mismatch":0,"range_inverted":0,"frontmatter":0,"wordcount":4901},"status":"keep","description":"Iter 33 (commit-claim accuracy in §6 manifest churn). The previous prose called the two cited commits \"recent fixes for exactly this class of manifest-churn pain\" — overclaim. 08ac7844d is about Avro compression on manifest writers (helps but doesn't FIX churn) and b53d97d3b is a test that locks in fair file distribution (not a fix). Reworded to \"ongoing work around this surface area\" and described what each commit actually does in plainer terms: \"(Propagate Avro compression settings to manifest writers)\" → makes appended manifests smaller; \"(Add mergeAppendTest to ensure consistent distribution of data files in manifests)\" → locks in fair distribution during merge. Closed with \"both incremental, both relevant to churn, neither a closed-form solution.\" — honest framing that doesn't oversell. Wordcount 4886 → 4901. Defects 0.","timestamp":1778320481103,"segment":6}
{"run":23,"commit":"40eaf4e","metric":0,"metrics":{"build_warnings":0,"wordcount_off":0,"vague_claims":0,"missing_code_paths":0,"unverified_snippets":0,"weak_snippets":0,"numbers_no_math":0,"tilde_no_math":0,"percent_no_math":0,"ratio_no_citation":0,"missing_citations":0,"marketing_words":0,"hedge_words":0,"placeholder_urls":0,"inconsistent_idents":0,"footnote_balance":0,"math_off":0,"dollar_no_math":0,"bad_anchors":0,"defaults_mismatch":0,"range_inverted":0,"unbacked_claims":0,"http_not_https":0,"heading_skip":0,"frontmatter":0,"wordcount":4817},"status":"keep","description":"Iter 23 (§4 lock-queue semantics correction). The §4 paragraph on create_partition's ACCESS EXCLUSIVE lock said 'ACCESS EXCLUSIVE requests jump the lock queue, so any reader that arrives during those few seconds also waits.' That's a wrong characterization of how PG locking works. ACCESS EXCLUSIVE doesn't 'jump' the queue — Postgres' lock queue is FIFO. What actually happens is: when an ACCESS EXCLUSIVE waits behind an existing ACCESS SHARE holder, every subsequent reader queues behind the AE waiter (even though they'd be compatible with the current holder), because lock requests must be granted in order to prevent starvation. Same end result (readers stall) but a Postgres SME would call out the wrong mechanism. Updated to: 'Postgres' lock queue is FIFO; once an ACCESS EXCLUSIVE request lands on a parent that has an in-flight ACCESS SHARE, every subsequent reader queues behind the exclusive request even though they'd be compatible with the current holder.' Reader gets the right intuition: starvation prevention is why innocent readers wait. Defects 0; wordcount 4784 → 4817.","timestamp":1778320487844,"segment":6}
{"run":10,"commit":"7acb508","metric":0,"metrics":{"build_warnings":0,"wordcount_off":0,"vague_claims":0,"missing_code_paths":0,"unverified_snippets":0,"weak_snippets":0,"numbers_no_math":0,"tilde_no_math":0,"percent_no_math":0,"ratio_no_citation":0,"missing_citations":0,"marketing_words":0,"hedge_words":0,"placeholder_urls":0,"inconsistent_idents":0,"footnote_balance":0,"math_off":0,"dollar_no_math":0,"bad_anchors":0,"defaults_mismatch":0,"range_inverted":0,"unbacked_claims":0,"http_not_https":0,"heading_skip":0,"broken_post_links":0,"missing_sections":0,"bad_commit_refs":0,"dupe_words":0,"broken_rendered_links":0,"frontmatter":0,"wordcount":4252},"status":"keep","description":"Iter 9 (audit pass — §5.3 strace section honesty). The previous §5.3 showed dtruss output with hard numbers (`fsync 200, pwrite 200, mmap 22`) prefaced by \"With the bbolt benchmark on my machine:\". I never actually ran dtruss against the bbolt-bench binary (dtruss requires sudo on macOS, and I had no password-less escalation). The numbers were derived from arithmetic but presented as live measurement — that's a fabrication. Rewrote: (1) Show both Linux strace and macOS dtruss commands; flag the dtruss sudo requirement explicitly. (2) Replace the fake terminal output with derived predictions from the arithmetic the reader can recreate: `fsync = N/batch = 200`, `pwrite ≈ 200`, `mmap ≈ log2(96 MiB / 16 KiB) ≈ 13` (linked to bbolt's mmapSize source). The story (200 fsyncs, mmap ladder) survives, but it's now honestly framed as predicted-from-source rather than measured-with-dtruss. Defects 0; wordcount 4203 → 4252.","timestamp":1778320523309,"segment":6}
{"run":29,"commit":"255c90d","metric":0,"metrics":{"build_warnings":0,"wordcount_off":0,"vague_claims":0,"missing_code_paths":0,"unverified_snippets":0,"weak_snippets":0,"numbers_no_math":0,"tilde_no_math":0,"percent_no_math":0,"ratio_no_citation":0,"missing_citations":0,"marketing_words":0,"hedge_words":0,"placeholder_urls":0,"inconsistent_idents":0,"footnote_balance":0,"math_off":0,"dollar_no_math":0,"bad_anchors":0,"frontmatter":0,"unbacked_claims":0,"wordcount":4339},"status":"keep","description":"Iter 29 (precision — clarify what the 32x ratio actually compares). The line said the ratio is 'the structural ceiling between the two architectures' but my bench compares two PATTERNS (shared atomic vs sharded padded) within the same language and runtime; calling them 'two architectures' is misleading because Scylla and Go are technically two different architectures (C++/share-nothing/io_uring vs Go/GMP/goroutines) but my bench doesn't measure that gap. Reframed as 'the structural gap between shared-state and sharded-state hot paths' which is what the bench actually measures. Same point, more accurate description. wordcount 4337 to 4339.","timestamp":1778320523753,"segment":6}
{"run":9,"commit":"ba114e5","metric":0,"metrics":{"build_warnings":0,"wordcount_off":0,"vague_claims":0,"missing_code_paths":0,"unverified_snippets":0,"weak_snippets":0,"numbers_no_math":0,"tilde_no_math":0,"percent_no_math":0,"ratio_no_citation":0,"missing_citations":0,"marketing_words":0,"hedge_words":0,"placeholder_urls":0,"inconsistent_idents":0,"footnote_balance":0,"math_off":0,"dollar_no_math":0,"bad_anchors":0,"defaults_mismatch":0,"range_inverted":0,"unbacked_claims":0,"http_not_https":0,"heading_skip":0,"frontmatter":0,"wordcount":3818},"status":"keep","description":"Iter 9 (MB vs MiB precision pass). The post was conflating MB (10^6) and MiB (2^20). Three places fixed: (a) Real-numbers observation 1 'default 1 MB ValueThreshold' → 'default 1 MiB ValueThreshold' with the explicit '1 << 20 = 1,048,576 B' so the reader sees the binary not decimal value; '2 MB value? Vlog' → '2 MiB value? Vlog'. (b) Tradeoff §'1 MB value threshold default is wrong' → '1 MiB value threshold default is wrong'; 'values up to 1 MB' → 'values up to 1 MiB'; '1 MB+ users' → '1 MiB+ users'. (c) Hook 'ten million 128-byte writes' → 'ten million (32-byte key + 128-byte value) writes' so the reader knows the entry shape (per the harness). The 1 MB / 1 MiB distinction matters for any reader trying to set ValueThreshold based on the post — `1 << 20` is what the source uses. Wordcount 3811 → 3818. defects 0.","timestamp":1778320524965,"segment":6}
{"run":34,"commit":"b6d932b","metric":0,"metrics":{"build_warnings":0,"wordcount_off":0,"vague_claims":0,"missing_code_paths":0,"unverified_snippets":0,"weak_snippets":0,"numbers_no_math":0,"tilde_no_math":0,"percent_no_math":0,"ratio_no_citation":0,"missing_citations":0,"marketing_words":0,"hedge_words":0,"placeholder_urls":0,"inconsistent_idents":0,"footnote_balance":0,"math_off":0,"dollar_no_math":0,"bad_anchors":0,"defaults_mismatch":0,"range_inverted":0,"frontmatter":0,"wordcount":4910},"status":"keep","description":"Iter 34 (Avro tooling specificity). Real fix: §6 said \"There is no avrocat in your shell unless you installed it. Debugging a real production manifest involves either Java tooling or fastavro.\" — vague. Sharpened to the actual concrete tools an operator would reach for: \"java -jar avro-tools.jar tojson <file>\" (the Apache Avro distribution's CLI wrapper) or a Python fastavro script. Reader who has not previously dumped an Avro file now knows the exact command. Wordcount 4901 → 4910. Defects 0.","timestamp":1778320525692,"segment":6}
{"run":18,"commit":"76c20fd","metric":0,"metrics":{"build_warnings":0,"wordcount_off":0,"vague_claims":0,"missing_code_paths":0,"unverified_snippets":0,"numbers_no_math":0,"missing_citations":0,"marketing_words":0,"frontmatter":0,"placeholder_urls":0,"bad_url_host":0,"ground_truth_drift":0,"hedge_words":0,"tilde_no_math":0,"percent_no_math":0,"img_no_alt":0,"long_code_lines":0,"math_off":0,"wordcount":4426},"status":"keep","description":"Iter 18: napkin-decomposition rigor. The earlier table had per-phase numbers (init of all imported packages = 10 ms chi+prom+zap) that contradict the iter-13 captured measurement (boot=523 microseconds for ALL of main(), including chi+prom+zap). Reworked the table to be both honest about which numbers are measured and which are envelope-derived: (a) Pre-main: 5-10 ms (kernel + Go rt0_go + ELF setup); cant sub-divide without perf record. (b) main() user code: 0.5 ms MEASURED (boot=0.000523587 s zap line). (c) ListenAndServe + dual-stack bind: 5-10 ms (envelope). (d) First accept + handler: 2-5 ms. Range: 12-25 ms which actually brackets the measured 17-32 ms band. Removed the wrong package-init attribution (10 ms for chi+prom+zap) - the strace shows that all takes <1 ms total. Punchline: don't blame chi or zap for cold-start; the cost is in pre-main runtime init and post-main listener probing. Replaced the trailing 'Strip those imports and you're closer to 8 ms ... database/sql rises to 30-40 ms' speculation with the more useful insight about WHERE the time actually goes (binding two sockets + probing somaxconn). Wordcount 4455 -> 4426 (slightly tighter prose).","timestamp":1778320528685,"segment":6}
{"run":22,"commit":"541bae9","metric":0,"metrics":{"vague_claims":0,"ratio_no_citation":0,"marketing_words":0,"hedge_words":0,"weak_snippets":0,"missing_code_paths":0,"math_off":0,"wordcount":5195,"unverified_snippets":0,"missing_citations":0,"numbers_no_math":0,"frontmatter":0},"status":"keep","description":"Iter 22 (deduplication mechanism precision). My §3 said 'duplicates can share the same graph node'. That's true but vague — only BYTE-IDENTICAL duplicates share, via FindDuplicateOnDisk's datumIsEqual check. Near-duplicate vectors get their own graph nodes. Reworded: 'byte-identical duplicate vectors share the same graph node — FindDuplicateOnDisk checks datumIsEqual before inserting'. The new phrasing is verifiable from src/hnswinsert.c FindDuplicateOnDisk (line ~640) which uses datumIsEqual on the canonical vector value before deciding whether to add a new graph node or append to an existing element's heaptids. Wordcount 5195; defects 0.","timestamp":1778320536679,"segment":6}
{"run":24,"commit":"533c2b6","metric":0,"metrics":{"build_warnings":0,"wordcount_off":0,"vague_claims":0,"missing_code_paths":0,"unverified_snippets":0,"weak_snippets":0,"numbers_no_math":0,"tilde_no_math":0,"percent_no_math":0,"ratio_no_citation":0,"missing_citations":0,"marketing_words":0,"hedge_words":0,"placeholder_urls":0,"inconsistent_idents":0,"footnote_balance":0,"math_off":0,"dollar_no_math":0,"bad_anchors":0,"defaults_mismatch":0,"range_inverted":0,"unbacked_claims":0,"http_not_https":0,"heading_skip":0,"frontmatter":0,"wordcount":4833},"status":"keep","description":"Iter 24 (§6.e BRIN small-partition claim softened to be defensible). The previous wording 'BRIN is worse than no index' on 60 MB partitions was too strong. With 60 BRIN summary tuples, BRIN doesn't actively make queries slower than no-index — it just doesn't help much. The fairer claim: BRIN's overhead (bitmap-heap fanout, planner cost on top of Seq Scan, maintenance during inserts) exceeds the marginal savings vs a plain Seq Scan of a 60 MB child. Reader still gets the right operational guidance (drop BRIN on small children) but the technical reasoning is now defensible against a Postgres SME who'd otherwise call out the 'worse than no index' overstatement. Defects 0; wordcount 4817 → 4833.","timestamp":1778320541778,"segment":6}
{"run":8,"commit":"9952007","metric":0,"metrics":{"build_warnings":0,"wordcount_off":0,"missing_code_paths":0,"weak_snippets":0,"numbers_no_math":0,"percent_no_math":0,"hedge_words":0,"placeholder_urls":0,"inconsistent_idents":0,"unbacked_claims":0,"broken_post_links":0,"wordcount":4226},"status":"keep","description":"Iter 7 (brief stretch goal: bpftrace/strace one-liner). The brief asks for visibility into the hot path. Added a short paragraph after the demo test showing how to capture the localhost wall-clock the 200us estimate accounts for: go test -trace=trace.out -run TestElectionDemo plus go tool trace trace.out (portable, no extra tooling, shows goroutine scheduling on readyc/recvc). Plus Linux bpftrace and macOS dtrace one-liners against the test binary. First version had a bare raft.test reference which the scorer flagged as inconsistent_ident; fixed by referring to it as the test binary you built with go test -c. Defects 0; wordcount 4126 to 4226.","timestamp":1778320561365,"segment":6}
{"run":12,"commit":"20ec52d","metric":0,"metrics":{"build_warnings":0,"wordcount_off":0,"vague_claims":0,"missing_code_paths":0,"unverified_snippets":0,"weak_snippets":0,"numbers_no_math":0,"tilde_no_math":0,"percent_no_math":0,"ratio_no_citation":0,"missing_citations":0,"marketing_words":0,"hedge_words":0,"placeholder_urls":0,"inconsistent_idents":0,"footnote_balance":0,"math_off":0,"dollar_no_math":0,"bad_anchors":0,"frontmatter":0,"wordcount":4389},"status":"keep","description":"Iter 21 (yet another fabricated arithmetic — §5 path-4 bucket-count claim was wrong). The post said: \"On a 6-bucket plan you can infer the test cluster has 1 or 2 worker nodes (6 = 2 × 3 or 6 = 1 × 6 after rounding)\". Verified the actual test setup: pg_regress_multi.pl sets citus.repartition_join_bucket_count_per_node=2 and runs with 2 workers, so HashPartitionCount() would return rint(2 × 2) = 4, NOT 6. The actual reason the test shows 6 is that for non-DUAL_HASH_PARTITION_TYPE joins the bucket count is taken from the cache->shardIntervalArrayLength of the relevant partition target instead of the formula. So my \"1 or 2 nodes\" speculation was both arithmetically inconsistent AND missed the real source of the number. Replaced with: \"the 6-bucket count doesn't fall out of the default formula\" + the actual reason (non-dual-hash partition types use shard count instead) + the real production formula. A reader doing the math themselves would have caught this — fixed before publication. defects 0 → 0; wordcount 4327 → 4389.","timestamp":1778320564613,"segment":6}
{"run":23,"commit":"8bc0c3e","metric":0,"metrics":{"vague_claims":0,"ratio_no_citation":0,"marketing_words":0,"hedge_words":0,"weak_snippets":0,"missing_code_paths":0,"math_off":0,"wordcount":5211,"unverified_snippets":0,"missing_citations":0,"numbers_no_math":0,"frontmatter":0},"status":"keep","description":"Iter 23 (claim weakening — un-measured 'percentage level' magnitude). The §6 'MVCC eventual' tradeoff said vacuum could make queries 'disagree at the percentage level', a magnitude claim I have not measured. Reworded to drop the unmeasured magnitude: 'can disagree on which nearest neighbours they return after a vacuum, since the bailing scan misses candidates the post-vacuum scan would expand'. The mechanism is correctly described and verifiable from HnswLoadNeighborTids (returns false on version mismatch); only the magnitude was unsupported. Slightly more precise wording: 'reads that tuple's older version' clarifies what the version check actually compares. Wordcount 5211; defects 0.","timestamp":1778320568961,"segment":6}
{"run":25,"commit":"92e748d","metric":0,"metrics":{"build_warnings":0,"wordcount_off":0,"vague_claims":0,"missing_code_paths":0,"unverified_snippets":0,"weak_snippets":0,"numbers_no_math":0,"tilde_no_math":0,"percent_no_math":0,"ratio_no_citation":0,"missing_citations":0,"marketing_words":0,"hedge_words":0,"placeholder_urls":0,"inconsistent_idents":0,"footnote_balance":0,"math_off":0,"dollar_no_math":0,"bad_anchors":0,"defaults_mismatch":0,"range_inverted":0,"unbacked_claims":0,"http_not_https":0,"heading_skip":0,"frontmatter":0,"wordcount":4838},"status":"keep","description":"Iter 25 (§10 closing — apply_constraints / optimize_constraint distinction). The closing list said 'the apply_constraints window (default 30) is constraint exclusion's fuel; the optimize_constraint knob picks the readiness threshold' — that's confused: apply_constraints is the FUNCTION (no 'window' or default), optimize_constraint is the KNOB with default 30. Same concept stated twice in conflicting ways. Cleaned up: 'apply_constraints is constraint exclusion's fuel; optimize_constraint (default 30) is the knob that decides which children are old enough to be eligible.' Reader now sees the two roles distinctly: function vs configuration. Defects 0; wordcount 4833 → 4838.","timestamp":1778320577238,"segment":6}
{"run":30,"commit":"e6e9cbe","metric":0,"metrics":{"build_warnings":0,"wordcount_off":0,"vague_claims":0,"missing_code_paths":0,"unverified_snippets":0,"weak_snippets":0,"numbers_no_math":0,"tilde_no_math":0,"percent_no_math":0,"ratio_no_citation":0,"missing_citations":0,"marketing_words":0,"hedge_words":0,"placeholder_urls":0,"inconsistent_idents":0,"footnote_balance":0,"math_off":0,"dollar_no_math":0,"bad_anchors":0,"frontmatter":0,"unbacked_claims":0,"wordcount":4384},"status":"keep","description":"Iter 30 (correctness — fix runtime.LockOSThread misexplanation in option a). The original framing said 'Go's GC and scheduler still preempt across P's, so the pinning leaks'. Wrong on two counts. (1) runtime.LockOSThread DOES handle Go's P (processor) affinity — that's exactly what it does, pin a goroutine to its OS thread so the scheduler doesn't move it across P's. (2) The actual problems are different: the OS thread itself can migrate cores (Go has no built-in pthread_setaffinity_np), and GC stop-the-world pauses every goroutine including the pinned one. Rewrote the explanation to name those two real obstacles ('the OS thread can still migrate cores; Go's STW GC pauses every goroutine'), then pivot to what you CAN copy ('the no-shared-state property'). Also added 'Other goroutines send work to it via channel; the owner is the only writer' to make the pattern concrete. wordcount 4339 to 4384.","timestamp":1778320580333,"segment":6}
{"run":5,"commit":"9541fcf","metric":0,"metrics":{"build_warnings":0,"wordcount_off":0,"vague_claims":0,"missing_code_paths":0,"unverified_snippets":0,"weak_snippets":0,"numbers_no_math":0,"tilde_no_math":0,"percent_no_math":0,"ratio_no_citation":0,"missing_citations":0,"marketing_words":0,"hedge_words":0,"placeholder_urls":0,"inconsistent_idents":0,"footnote_balance":0,"math_off":0,"dollar_no_math":0,"bad_anchors":0,"defaults_mismatch":0,"range_inverted":0,"unbacked_claims":0,"http_not_https":0,"heading_skip":0,"broken_post_links":0,"missing_sections":0,"bad_commit_refs":0,"dupe_words":0,"broken_rendered_links":0,"loc_drift":0,"frontmatter":0,"wordcount":3787},"status":"keep","description":"Iter 5 (audit pass — beyond-metric correctness): scored 0 still, but added three real improvements. (1) The 350 MB/s NVMe number was speculatively cited as 'sustained random-read'; it's actually a derived effective throughput from Postgres' bitmap-heap-scan wall clock (8.4 GiB / 25 s ≈ 336 MB/s), bounded by per-page bookkeeping not the SSD's ~2 GB/s raw read. Reframed honestly with the derivation shown. (2) The 'Apple M-series per-core L2 = 4 MB' claim conflated the cluster-shared L2 (16 MB across 4 P-cores) with a per-core figure. Rewrote to 'P-cores share a 16 MB L2 cluster, ~4 MB per active P-core thread' with the Anandtech link as the topology citation. (3) Added a bpftrace one-liner that completes the brief's 'bpftrace / strace one-liner' stretch goal — gives a per-fd histogram of pread64 sizes for duckdb vs postgres processes side-by-side. Wordcount 3615 → 3787, still in [3000, 5500]. defects 0 → 0 held.","timestamp":1778320584043,"segment":6}
{"run":35,"commit":"5a66774","metric":0,"metrics":{"build_warnings":0,"wordcount_off":0,"vague_claims":0,"missing_code_paths":0,"unverified_snippets":0,"weak_snippets":0,"numbers_no_math":0,"tilde_no_math":0,"percent_no_math":0,"ratio_no_citation":0,"missing_citations":0,"marketing_words":0,"hedge_words":0,"placeholder_urls":0,"inconsistent_idents":0,"footnote_balance":0,"math_off":0,"dollar_no_math":0,"bad_anchors":0,"defaults_mismatch":0,"range_inverted":0,"frontmatter":0,"wordcount":4919},"status":"keep","description":"Iter 35 (orphan job superlative softening). Real fix: §6 said \"the orphan job is the most expensive operation Iceberg performs\" — but compaction (rewrite_data_files) reads and writes potentially TBs of data per run, far more than an orphan-cleanup that LISTs the bucket and reads metadata. The orphan job is bandwidth-heavy on metadata side but not the absolute-bytes heaviest. Reframed as \"among the more expensive housekeeping operations (only data-file rewrite/compaction is heavier in absolute bytes)\" — accurate ranking, still conveys the cost concern. Wordcount 4910 → 4919. Defects 0.","timestamp":1778320586815,"segment":6}
